ffff96391fd04600 1527945382 S Ci:1:085:0 s 80 06 0100 0000 0028 40 <
ffff96391fd04600 1527945669 C Ci:1:085:0 0 18 = 12011001 e0010140 f30c3600 01000000 0001
ffff9637b5f9a6c0 1527945809 S Ci:1:004:0 s 80 06 0100 0000 0028 40 <
ffff9637b5f9a6c0 1527946805 C Ci:1:004:0 0 18 = 12010002 ef020140 450c0b67 62320201 0001
ffff9637b5f9a6c0 1527946859 S Ci:1:002:0 s 80 06 0100 0000 0028 40 <
ffff9637b5f9a6c0 1527946893 C Ci:1:002:0 0 18 = 12010002 09000140 87800080 04000000 0001
ffff9637b5f9a6c0 1527946962 S Ci:1:001:0 s 80 06 0100 0000 0028 40 <
ffff9637b5f9a6c0 1527946971 C Ci:1:001:0 0 18 = 12010002 09000040 6b1d0200 13040302 0101
ffff96399ad9f480 1535781001 C Ii:1:002:1 0:2048 2 = 0800
ffff96399ad9f480 1535781019 S Ii:1:002:1 -115:2048 2 <
ffff96391fd04000 1535781054 S Ci:1:002:0 s a3 00 0000 0003 0004 4 <
ffff96391fd04000 1535781165 C Ci:1:002:0 0 4 = 01010100
ffff96391fd04000 1535781263 S Co:1:002:0 s 23 01 0010 0003 0000 0
ffff96391fd04000 1535781459 C Co:1:002:0 0 0
ffff96391fd04000 1535781484 S Ci:1:002:0 s a3 00 0000 0003 0004 4 <
ffff96391fd04000 1535781529 C Ci:1:002:0 0 4 = 01010000
ffff96391fd04000 1535816134 S Ci:1:002:0 s a3 00 0000 0003 0004 4 <
ffff96391fd04000 1535816316 C Ci:1:002:0 0 4 = 01010000
ffff96391fd04000 1535852131 S Ci:1:002:0 s a3 00 0000 0003 0004 4 <
ffff96391fd04000 1535852299 C Ci:1:002:0 0 4 = 01010000
ffff96391fd04000 1535888128 S Ci:1:002:0 s a3 00 0000 0003 0004 4 <
ffff96391fd04000 1535888309 C Ci:1:002:0 0 4 = 01010000
ffff96391fd04000 1535924128 S Ci:1:002:0 s a3 00 0000 0003 0004 4 <
ffff96391fd04000 1535924313 C Ci:1:002:0 0 4 = 01010000
ffff96391fd04000 1535924344 S Co:1:002:0 s 23 03 0004 0003 0000 0
ffff96391fd04000 1535924419 C Co:1:002:0 0 0
ffff96391fd04000 1535944140 S Ci:1:002:0 s a3 00 0000 0003 0004 4 <
ffff96391fd04000 1535944322 C Ci:1:002:0 0 4 = 03051000
ffff96391fd04000 1535944342 S Co:1:002:0 s 23 01 0014 0003 0000 0
ffff96391fd04000 1535944423 C Co:1:002:0 0 0
ffff96391fd04000 1536004136 S Ci:1:000:0 s 80 06 0100 0000 0040 64 <
ffff96391fd04000 1536004994 C Ci:1:000:0 0 18 = 12010002 00000040 e3053607 72020304 0201
ffff96391fd04000 1536005021 S Co:1:002:0 s 23 03 0004 0003 0000 0
ffff96391fd04000 1536005179 C Co:1:002:0 0 0
ffff96391fd04000 1536024135 S Ci:1:002:0 s a3 00 0000 0003 0004 4 <
ffff96391fd04000 1536024328 C Ci:1:002:0 0 4 = 03051000
ffff96391fd04000 1536024352 S Co:1:002:0 s 23 01 0014 0003 0000 0
ffff96391fd04000 1536024406 C Co:1:002:0 0 0
ffff96391fd04000 1536084133 S Co:1:000:0 s 00 05 006c 0000 0000 0
ffff96391fd04000 1536084872 C Co:1:000:0 0 0
ffff96391fd04600 1536112127 S Ci:1:108:0 s 80 06 0100 0000 0012 18 <
ffff96391fd04600 1536112997 C Ci:1:108:0 0 18 = 12010002 00000040 e3053607 72020304 0201
ffff96391fd04600 1536113036 S Ci:1:108:0 s 80 06 0200 0000 0009 9 <
ffff96391fd04600 1536113739 C Ci:1:108:0 0 9 = 09022000 01010080 31
ffff96391fd04600 1536113773 S Ci:1:108:0 s 80 06 0200 0000 0020 32 <
ffff96391fd04600 1536114871 C Ci:1:108:0 0 32 = 09022000 01010080 31090400 00020806 50000705 81020002 00070502 02000200
ffff96391fd04b40 1536114910 S Ci:1:108:0 s 80 06 0300 0000 00ff 255 <
ffff96391fd04b40 1536115616 C Ci:1:108:0 0 4 = 04030904
ffff96391fd04b40 1536115649 S Ci:1:108:0 s 80 06 0304 0409 00ff 255 <
ffff96391fd04b40 1536116495 C Ci:1:108:0 0 24 = 18035500 53004200 20005300 74006f00 72006100 67006500
ffff96391fd04b40 1536116531 S Ci:1:108:0 s 80 06 0303 0409 00ff 255 <
ffff96391fd04b40 1536117241 C Ci:1:108:0 0 16 = 10034700 65006e00 65007200 69006300
ffff96391fd04b40 1536117274 S Ci:1:108:0 s 80 06 0302 0409 00ff 255 <
ffff96391fd04b40 1536118182 C Ci:1:108:0 0 26 = 1a033000 30003000 30003000 30003000 30003000 32003700 3200
ffff96391fd04240 1536118633 S Co:1:108:0 s 00 09 0001 0000 0000 0
ffff96391fd04240 1536119299 C Co:1:108:0 0 0
ffff9639a63cd780 1537148145 S Ci:1:108:0 s a1 fe 0000 0000 0001 1 <
ffff9639a63cd780 1537148586 C Ci:1:108:0 0 1 = 00
ffff9639a63cd780 1537148914 S Bo:1:108:2 -115 31 = 55534243 01000000 24000000 80000612 00000024 00000000 00000000 000000
ffff9639a63cd780 1537149049 C Bo:1:108:2 0 31 >
ffff96399c929e40 1537149095 S Bi:1:108:1 -115 36 <
ffff96399c929e40 1537149552 C Bi:1:108:1 0 36 = 00800000 29000000 47656e65 72696320 53544f52 41474520 44455649 43452020
ffff9639a63cd780 1537149572 S Bi:1:108:1 -115 13 <
ffff9639a63cd780 1537149661 C Bi:1:108:1 0 13 = 55534253 01000000 00000000 00
ffff9639a63cd780 1537150260 S Bo:1:108:2 -115 31 = 55534243 02000000 00000000 00000600 00000000 00000000 00000000 000000
ffff9639a63cd780 1537150424 C Bo:1:108:2 0 31 >
ffff9639a63cd780 1537150493 S Bi:1:108:1 -115 13 <
ffff9639a63cd780 1537426280 C Bi:1:108:1 0 13 = 55534253 02000000 00000000 01
ffff9639a63cd780 1537426333 S Bo:1:108:2 -115 31 = 55534243 03000000 12000000 80000603 00000012 00000000 00000000 000000
ffff9639a63cd780 1537426451 C Bo:1:108:2 0 31 >
ffff96391fddd900 1537426544 S Bi:1:108:1 -115 18 <
ffff96391fddd900 1537426674 C Bi:1:108:1 0 18 = 70000600 0000000a 00000000 28000000 0000
ffff9639a63cd780 1537426737 S Bi:1:108:1 -115 13 <
ffff9639a63cd780 1537426791 C Bi:1:108:1 0 13 = 55534253 03000000 00000000 00
ffff9639a63cd780 1537426905 S Bo:1:108:2 -115 31 = 55534243 04000000 00000000 00000600 00000000 00000000 00000000 000000
ffff9639a63cd780 1537427035 C Bo:1:108:2 0 31 >
ffff9639a63cd780 1537427089 S Bi:1:108:1 -115 13 <
ffff9639a63cd780 1537427157 C Bi:1:108:1 0 13 = 55534253 04000000 00000000 00
ffff9639a63cd780 1537427237 S Bo:1:108:2 -115 31 = 55534243 05000000 08000000 80000a25 00000000 00000000 00000000 000000
ffff9639a63cd780 1537427285 C Bo:1:108:2 0 31 >
ffff96391fddd000 1537427311 S Bi:1:108:1 -115 8 <
ffff96391fddd000 1537427408 C Bi:1:108:1 0 8 = 01cd3fff 00000200
ffff9639a63cd780 1537427446 S Bi:1:108:1 -115 13 <
ffff9639a63cd780 1537427531 C Bi:1:108:1 0 13 = 55534253 05000000 00000000 00
ffff9639a63cd780 1537427628 S Bo:1:108:2 -115 31 = 55534243 06000000 c0000000 8000061a 003f00c0 00000000 00000000 000000
ffff9639a63cd780 1537427782 C Bo:1:108:2 0 31 >
ffff96391fddd000 1537427823 S Bi:1:108:1 -115 192 <
ffff96391fddd000 1537427909 C Bi:1:108:1 -121 12 = 0b000008 00000000 00000200
ffff9639a63cd780 1537427957 S Bi:1:108:1 -115 13 <
ffff9639a63cd780 1537428286 C Bi:1:108:1 -32 0
ffff9639a63cd780 1537428323 S Co:1:108:0 s 02 01 0000 0081 0000 0
ffff9639a63cd780 1537428913 C Co:1:108:0 0 0
ffff9639a63cd780 1537428933 S Bi:1:108:1 -115 13 <
ffff9639a63cd780 1537429031 C Bi:1:108:1 0 13 = 55534253 06000000 b4000000 00
ffff9639a63cd780 1537429123 S Bo:1:108:2 -115 31 = 55534243 07000000 c0000000 8000061a 003f00c0 00000000 00000000 000000
ffff9639a63cd780 1537429300 C Bo:1:108:2 0 31 >
ffff96391fddd000 1537429346 S Bi:1:108:1 -115 192 <
ffff96391fddd000 1537429427 C Bi:1:108:1 -121 12 = 0b000008 00000000 00000200
ffff9639a63cd780 1537429463 S Bi:1:108:1 -115 13 <
ffff9639a63cd780 1537429795 C Bi:1:108:1 -32 0
ffff9639a63cd780 1537429835 S Co:1:108:0 s 02 01 0000 0081 0000 0
ffff9639a63cd780 1537430407 C Co:1:108:0 0 0
ffff9639a63cd780 1537430443 S Bi:1:108:1 -115 13 <
ffff9639a63cd780 1537430532 C Bi:1:108:1 0 13 = 55534253 07000000 b4000000 00
ffff9639a63cd780 1537430808 S Bo:1:108:2 -115 31 = 55534243 08000000 00000000 00000600 00000000 00000000 00000000 000000
ffff9639a63cd780 1537430908 C Bo:1:108:2 0 31 >
ffff9639a63cd780 1537430953 S Bi:1:108:1 -115 13 <
ffff9639a63cd780 1537431031 C Bi:1:108:1 0 13 = 55534253 08000000 00000000 00
ffff9639a63cd780 1537431104 S Bo:1:108:2 -115 31 = 55534243 09000000 00000000 0000061e 00000001 00000000 00000000 000000
ffff9639a63cd780 1537431160 C Bo:1:108:2 0 31 >
ffff9639a63cd780 1537431191 S Bi:1:108:1 -115 13 <
ffff9639a63cd780 1537431280 C Bi:1:108:1 0 13 = 55534253 09000000 00000000 01
ffff9639a63cd780 1537431311 S Bo:1:108:2 -115 31 = 55534243 0a000000 12000000 80000603 00000012 00000000 00000000 000000
ffff9639a63cd780 1537431405 C Bo:1:108:2 0 31 >
ffff96391fddd000 1537431436 S Bi:1:108:1 -115 18 <
ffff96391fddd000 1537431657 C Bi:1:108:1 0 18 = 70000500 0000000a 00000000 24000000 0000
ffff9639a63cd780 1537431688 S Bi:1:108:1 -115 13 <
ffff9639a63cd780 1537431780 C Bi:1:108:1 0 13 = 55534253 0a000000 00000000 00
ffff9639a63cd780 1537431871 S Bo:1:108:2 -115 31 = 55534243 0b000000 00000000 00000600 00000000 00000000 00000000 000000
ffff9639a63cd780 1537431904 C Bo:1:108:2 0 31 >
ffff9639a63cd780 1537431966 S Bi:1:108:1 -115 13 <
ffff9639a63cd780 1537432056 C Bi:1:108:1 0 13 = 55534253 0b000000 00000000 00
ffff9639a63cd780 1537432174 S Bo:1:108:2 -115 31 = 55534243 0c000000 08000000 80000a25 00000000 00000000 00000000 000000
ffff9639a63cd780 1537432282 C Bo:1:108:2 0 31 >
ffff96391fddd000 1537432322 S Bi:1:108:1 -115 8 <
ffff96391fddd000 1537432407 C Bi:1:108:1 0 8 = 01cd3fff 00000200
ffff9639a63cd780 1537432445 S Bi:1:108:1 -115 13 <
ffff9639a63cd780 1537432530 C Bi:1:108:1 0 13 = 55534253 0c000000 00000000 00
ffff9639a63cd780 1537432632 S Bo:1:108:2 -115 31 = 55534243 0d000000 c0000000 8000061a 003f00c0 00000000 00000000 000000
ffff9639a63cd780 1537432783 C Bo:1:108:2 0 31 >
ffff96399c929d80 1537432809 S Bi:1:108:1 -115 192 <
ffff96399c929d80 1537432910 C Bi:1:108:1 -121 12 = 0b000008 00000000 00000200
ffff9639a63cd780 1537432954 S Bi:1:108:1 -115 13 <
ffff9639a63cd780 1537433287 C Bi:1:108:1 -32 0
ffff9639a63cd780 1537433342 S Co:1:108:0 s 02 01 0000 0081 0000 0
ffff9639a63cd780 1537433910 C Co:1:108:0 0 0
ffff9639a63cd780 1537433966 S Bi:1:108:1 -115 13 <
ffff9639a63cd780 1537434031 C Bi:1:108:1 0 13 = 55534253 0d000000 b4000000 00
ffff9639a63cd780 1537434125 S Bo:1:108:2 -115 31 = 55534243 0e000000 c0000000 8000061a 003f00c0 00000000 00000000 000000
ffff9639a63cd780 1537434283 C Bo:1:108:2 0 31 >
ffff96391fddd000 1537434327 S Bi:1:108:1 -115 192 <
ffff96391fddd000 1537434411 C Bi:1:108:1 -121 12 = 0b000008 00000000 00000200
ffff9639a63cd780 1537434439 S Bi:1:108:1 -115 13 <
ffff9639a63cd780 1537434785 C Bi:1:108:1 -32 0
ffff9639a63cd780 1537434805 S Co:1:108:0 s 02 01 0000 0081 0000 0
ffff9639a63cd780 1537435413 C Co:1:108:0 0 0
ffff9639a63cd780 1537435433 S Bi:1:108:1 -115 13 <
ffff9639a63cd780 1537435531 C Bi:1:108:1 0 13 = 55534253 0e000000 b4000000 00
ffff9639a63cd780 1537435704 S Bo:1:108:2 -115 31 = 55534243 0f000000 00100000 80000a28 00000000 00000008 00000000 000000
ffff9639a63cd780 1537435782 C Bo:1:108:2 0 31 >
ffff96399c929d80 1537435814 S Bi:1:108:1 -115 4096 <
ffff96399c929d80 1537437169 C Bi:1:108:1 0 4096 = fab80010 8ed0bc00 b0b80000 8ed88ec0 fbbe007c bf0006b9 0002f3a4 ea210600
ffff9639a63cd780 1537437198 S Bi:1:108:1 -115 13 <
ffff9639a63cd780 1537437277 C Bi:1:108:1 0 13 = 55534253 0f000000 00000000 00
ffff9639a63cd780 1537437491 S Bo:1:108:2 -115 31 = 55534243 10000000 00000000 00000600 00000000 00000000 00000000 000000
ffff9639a63cd780 1537437527 C Bo:1:108:2 0 31 >
ffff9639a63cd780 1537437533 S Bi:1:108:1 -115 13 <
ffff9639a63cd780 1537437776 C Bi:1:108:1 0 13 = 55534253 10000000 00000000 00
ffff9639a63cd780 1537437801 S Bo:1:108:2 -115 31 = 55534243 11000000 00000000 00000600 00000000 00000000 00000000 000000
ffff9639a63cd780 1537437901 C Bo:1:108:2 0 31 >
ffff9639a63cd780 1537437912 S Bi:1:108:1 -115 13 <
ffff9639a63cd780 1537438025 C Bi:1:108:1 0 13 = 55534253 11000000 00000000 00
ffff9639a63cd780 1537438052 S Bo:1:108:2 -115 31 = 55534243 12000000 00000000 00000600 00000000 00000000 00000000 000000
ffff9639a63cd780 1537438152 C Bo:1:108:2 0 31 >
ffff9639a63cd780 1537438158 S Bi:1:108:1 -115 13 <
ffff9639a63cd780 1537438275 C Bi:1:108:1 0 13 = 55534253 12000000 00000000 00
ffff9639a63cd780 1537438299 S Bo:1:108:2 -115 31 = 55534243 13000000 08000000 80000a25 00000000 00000000 00000000 000000
ffff9639a63cd780 1537438403 C Bo:1:108:2 0 31 >
ffff9637b5ee7300 1537438416 S Bi:1:108:1 -115 8 <
ffff9637b5ee7300 1537438528 C Bi:1:108:1 0 8 = 01cd3fff 00000200
ffff9639a63cd780 1537438540 S Bi:1:108:1 -115 13 <
ffff9639a63cd780 1537438652 C Bi:1:108:1 0 13 = 55534253 13000000 00000000 00
ffff9639a63cd780 1537438689 S Bo:1:108:2 -115 31 = 55534243 14000000 c0000000 8000061a 003f00c0 00000000 00000000 000000
ffff9639a63cd780 1537438777 C Bo:1:108:2 0 31 >
ffff9637b5ee7300 1537438794 S Bi:1:108:1 -115 192 <
ffff9637b5ee7300 1537439029 C Bi:1:108:1 -121 12 = 0b000008 00000000 00000200
ffff9639a63cd780 1537439039 S Bi:1:108:1 -115 13 <
ffff9639a63cd780 1537439403 C Bi:1:108:1 -32 0
ffff9639a63cd780 1537439416 S Co:1:108:0 s 02 01 0000 0081 0000 0
ffff9639a63cd780 1537440032 C Co:1:108:0 0 0
ffff9639a63cd780 1537440122 S Bi:1:108:1 -115 13 <
ffff9639a63cd780 1537440160 C Bi:1:108:1 0 13 = 55534253 14000000 b4000000 00
ffff9639a63cd780 1537440192 S Bo:1:108:2 -115 31 = 55534243 15000000 00000000 00000600 00000000 00000000 00000000 000000
ffff9639a63cd780 1537440275 C Bo:1:108:2 0 31 >
ffff9639a63cd780 1537440285 S Bi:1:108:1 -115 13 <
ffff9639a63cd780 1537440399 C Bi:1:108:1 0 13 = 55534253 15000000 00000000 00
ffff9639a63cd780 1537440416 S Bo:1:108:2 -115 31 = 55534243 16000000 c0000000 8000061a 003f00c0 00000000 00000000 000000
ffff9639a63cd780 1537440526 C Bo:1:108:2 0 31 >
ffff96391de059c0 1537440535 S Bi:1:108:1 -115 192 <
ffff96391de059c0 1537440777 C Bi:1:108:1 -121 12 = 0b000008 00000000 00000200
ffff9639a63cd780 1537440780 S Bi:1:108:1 -115 13 <
ffff9639a63cd780 1537441151 C Bi:1:108:1 -32 0
ffff9639a63cd780 1537441156 S Co:1:108:0 s 02 01 0000 0081 0000 0
ffff9639a63cd780 1537441651 C Co:1:108:0 0 0
ffff9639a63cd780 1537441659 S Bi:1:108:1 -115 13 <
ffff9639a63cd780 1537441776 C Bi:1:108:1 0 13 = 55534253 16000000 b4000000 00
ffff9639a63cd780 1537441799 S Bo:1:108:2 -115 31 = 55534243 17000000 00100000 80000a28 0001cd3f 80000008 00000000 000000
ffff9639a63cd780 1537441901 C Bo:1:108:2 0 31 >
ffff96391de059c0 1537441908 S Bi:1:108:1 -115 4096 <
ffff96391de059c0 1537443166 C Bi:1:108:1 0 4096 = 86471295 3b62fef4 dbbfccd1 92d4f546 57ddf65c 858bd9be dfb8c82a c05cb895
ffff9639a63cd780 1537443172 S Bi:1:108:1 -115 13 <
ffff9639a63cd780 1537443275 C Bi:1:108:1 0 13 = 55534253 17000000 00000000 00
ffff9639a63cd780 1537443339 S Bo:1:108:2 -115 31 = 55534243 18000000 00100000 80000a28 0001cd3f f0000008 00000000 000000
ffff9639a63cd780 1537443402 C Bo:1:108:2 0 31 >
ffff96391de059c0 1537443408 S Bi:1:108:1 -115 4096 <
ffff96391de059c0 1537444404 C Bi:1:108:1 0 4096 = f9a78c85 31c58062 04d836ff 341c3f06 7ef19b20 8ee3decf fa1482c5 fa332caa
ffff9639a63cd780 1537444409 S Bi:1:108:1 -115 13 <
ffff9639a63cd780 1537444525 C Bi:1:108:1 0 13 = 55534253 18000000 00000000 00
ffff9639a63cd780 1537444573 S Bo:1:108:2 -115 31 = 55534243 19000000 00100000 80000a28 00000000 00000008 00000000 000000
ffff9639a63cd780 1537444651 C Bo:1:108:2 0 31 >
ffff96391de059c0 1537444658 S Bi:1:108:1 -115 4096 <
ffff96391de059c0 1537445791 C Bi:1:108:1 0 4096 = fab80010 8ed0bc00 b0b80000 8ed88ec0 fbbe007c bf0006b9 0002f3a4 ea210600
ffff9639a63cd780 1537445795 S Bi:1:108:1 -115 13 <
ffff9639a63cd780 1537445900 C Bi:1:108:1 0 13 = 55534253 19000000 00000000 00
ffff9639a63cd780 1537445947 S Bo:1:108:2 -115 31 = 55534243 1a000000 00100000 80000a28 00000000 08000008 00000000 000000
ffff9639a63cd780 1537446025 C Bo:1:108:2 0 31 >
ffff96391de059c0 1537446030 S Bi:1:108:1 -115 4096 <
ffff96391de059c0 1537446790 C Bi:1:108:1 0 4096 = 00000000 00000000 00000000 00000000 00000000 00000000 00000000 00000000
ffff9639a63cd780 1537446794 S Bi:1:108:1 -115 13 <
ffff9639a63cd780 1537446901 C Bi:1:108:1 0 13 = 55534253 1a000000 00000000 00
ffff9639a63cd780 1537446948 S Bo:1:108:2 -115 31 = 55534243 1b000000 00020000 80000a28 0001cd3f f8000001 00000000 000000
ffff9639a63cd780 1537447026 C Bo:1:108:2 0 31 >
ffff96391de059c0 1537447034 S Bi:1:108:1 -115 512 <
ffff96391de059c0 1537448279 C Bi:1:108:1 0 512 = cd857911 a601d7f1 6d3e1af5 cf45a44b bd4a9223 9c322c83 0972022c 91376942
ffff9639a63cd780 1537448283 S Bi:1:108:1 -115 13 <
ffff9639a63cd780 1537448401 C Bi:1:108:1 0 13 = 55534253 1b000000 00000000 00
ffff9639a63cd780 1537448418 S Bo:1:108:2 -115 31 = 55534243 1c000000 00020000 80000a28 0001cd3f f9000001 00000000 000000
ffff9639a63cd780 1537448526 C Bo:1:108:2 0 31 >
ffff96391de059c0 1537448530 S Bi:1:108:1 -115 512 <
ffff96391de059c0 1537449416 C Bi:1:108:1 0 512 = 2dd37407 26b2250a f04218bb 2890bbe3 1e8b0761 9e09b5a6 2812cd50 2a137dcf
ffff9639a63cd780 1537449420 S Bi:1:108:1 -115 13 <
ffff9639a63cd780 1537449526 C Bi:1:108:1 0 13 = 55534253 1c000000 00000000 00
ffff9639a63cd780 1537449541 S Bo:1:108:2 -115 31 = 55534243 1d000000 00020000 80000a28 0001cd3f fa000001 00000000 000000
ffff9639a63cd780 1537449652 C Bo:1:108:2 0 31 >
ffff96391de059c0 1537449656 S Bi:1:108:1 -115 512 <
ffff96391de059c0 1537450541 C Bi:1:108:1 0 512 = 592875c0 3b079913 6137fec7 695e5960 21a5871b 201193b3 71648f72 82d745fc
ffff9639a63cd780 1537450545 S Bi:1:108:1 -115 13 <
ffff9639a63cd780 1537450651 C Bi:1:108:1 0 13 = 55534253 1d000000 00000000 00
ffff9639a63cd780 1537450665 S Bo:1:108:2 -115 31 = 55534243 1e000000 00020000 80000a28 0001cd3f fb000001 00000000 000000
ffff9639a63cd780 1537450776 C Bo:1:108:2 0 31 >
ffff96391de059c0 1537450781 S Bi:1:108:1 -115 512 <
ffff96391de059c0 1537451664 C Bi:1:108:1 0 512 = 5490bea0 dc10b592 479ddc48 383c24dc d42fb99d 0d11b063 4bb161b9 396b5e8b
ffff9639a63cd780 1537451669 S Bi:1:108:1 -115 13 <
ffff9639a63cd780 1537451776 C Bi:1:108:1 0 13 = 55534253 1e000000 00000000 00
ffff9639a63cd780 1537451790 S Bo:1:108:2 -115 31 = 55534243 1f000000 00020000 80000a28 0001cd3f fc000001 00000000 000000
ffff9639a63cd780 1537451901 C Bo:1:108:2 0 31 >
ffff96391de059c0 1537451905 S Bi:1:108:1 -115 512 <
ffff96391de059c0 1537452792 C Bi:1:108:1 0 512 = 95fe1e82 1c803917 07081836 1b88661f 1652a1d0 b478338f 4a7681ce c828bd59
ffff9639a63cd780 1537452797 S Bi:1:108:1 -115 13 <
ffff9639a63cd780 1537452901 C Bi:1:108:1 0 13 = 55534253 1f000000 00000000 00
ffff9639a63cd780 1537452916 S Bo:1:108:2 -115 31 = 55534243 20000000 00020000 80000a28 0001cd3f fd000001 00000000 000000
ffff9639a63cd780 1537453026 C Bo:1:108:2 0 31 >
ffff96391de059c0 1537453031 S Bi:1:108:1 -115 512 <
ffff96391de059c0 1537453915 C Bi:1:108:1 0 512 = 87cf0e68 f4bdf946 f1b39ea6 1a1ecadd d588efb3 ade7a601 90f01529 399bdeba
ffff9639a63cd780 1537453920 S Bi:1:108:1 -115 13 <
ffff9639a63cd780 1537454027 C Bi:1:108:1 0 13 = 55534253 20000000 00000000 00
ffff9639a63cd780 1537454041 S Bo:1:108:2 -115 31 = 55534243 21000000 00020000 80000a28 0001cd3f fe000001 00000000 000000
ffff9639a63cd780 1537454151 C Bo:1:108:2 0 31 >
ffff96391de059c0 1537454156 S Bi:1:108:1 -115 512 <
ffff96391de059c0 1537455028 C Bi:1:108:1 0 512 = 6f1228a8 b5e3123a 795f5a0d e00e37e0 d7d35d75 2e704296 e7084863 e111a405
ffff9639a63cd780 1537455032 S Bi:1:108:1 -115 13 <
ffff9639a63cd780 1537455151 C Bi:1:108:1 0 13 = 55534253 21000000 00000000 00
ffff9639a63cd780 1537455167 S Bo:1:108:2 -115 31 = 55534243 22000000 00020000 80000a28 0001cd3f ff000001 00000000 000000
ffff9639a63cd780 1537455277 C Bo:1:108:2 0 31 >
ffff96391de059c0 1537455282 S Bi:1:108:1 -115 512 <
ffff96391de059c0 1537456152 C Bi:1:108:1 0 512 = 4f042556 339e5d6f 4e1baa48 4ae6eaf7 3d5e595d 5b9f5c2b e35437d1 fb284e9c
ffff9639a63cd780 1537456158 S Bi:1:108:1 -115 13 <
ffff9639a63cd780 1537456276 C Bi:1:108:1 0 13 = 55534253 22000000 00000000 00
ffff9639a63cd780 1537456326 S Bo:1:108:2 -115 31 = 55534243 23000000 00100000 80000a28 0001cd3e f8000008 00000000 000000
ffff9639a63cd780 1537456401 C Bo:1:108:2 0 31 >
ffff9637b5ee7f00 1537456418 S Bi:1:108:1 -115 4096 <
ffff9637b5ee7f00 1537457415 C Bi:1:108:1 0 4096 = 71afc68e f214dcbf d4522b5e d38e94ab dbc82926 938546ce f8f90a5c a24f60ce
ffff9639a63cd780 1537457427 S Bi:1:108:1 -115 13 <
ffff9639a63cd780 1537457526 C Bi:1:108:1 0 13 = 55534253 23000000 00000000 00
ffff9639a63cd780 1537457580 S Bo:1:108:2 -115 31 = 55534243 24000000 00100000 80000a28 0001cd3f c0000008 00000000 000000
ffff9639a63cd780 1537457651 C Bo:1:108:2 0 31 >
ffff9637b5ee7f00 1537457658 S Bi:1:108:1 -115 4096 <
ffff9637b5ee7f00 1537458417 C Bi:1:108:1 0 4096 = 2254866c 58941492 435dca95 24bb12a2 c47aa5ec 3b30e5d1 6ff91b49 f426c44f
ffff9639a63cd780 1537458423 S Bi:1:108:1 -115 13 <
ffff9639a63cd780 1537458536 C Bi:1:108:1 0 13 = 55534253 24000000 00000000 00
ffff9639a63cd780 1537458587 S Bo:1:108:2 -115 31 = 55534243 25000000 00100000 80000a28 0001cd3f 00000008 00000000 000000
ffff9639a63cd780 1537458651 C Bo:1:108:2 0 31 >
ffff9637b5ee7f00 1537458657 S Bi:1:108:1 -115 4096 <
ffff9637b5ee7f00 1537459416 C Bi:1:108:1 0 4096 = 7d3c6217 6eabd3a8 c9a59742 d99fd123 c14aaf6a 3e86358e 434be98d c3943940
ffff9639a63cd780 1537459421 S Bi:1:108:1 -115 13 <
ffff9639a63cd780 1537459526 C Bi:1:108:1 0 13 = 55534253 25000000 00000000 00
ffff9639a63cd780 1537459585 S Bo:1:108:2 -115 31 = 55534243 26000000 00100000 80000a28 0001cd3e 70000008 00000000 000000
ffff9639a63cd780 1537459651 C Bo:1:108:2 0 31 >
ffff9637b5ee7f00 1537459666 S Bi:1:108:1 -115 4096 <
ffff9637b5ee7f00 1537460666 C Bi:1:108:1 0 4096 = 0b459960 79f6dd19 bc515043 ef67d425 8e575b91 fb8a8d92 e4b5d5ec eab36e6f
ffff9639a63cd780 1537460690 S Bi:1:108:1 -115 13 <
ffff9639a63cd780 1537460776 C Bi:1:108:1 0 13 = 55534253 26000000 00000000 00
ffff9639a63cd780 1537460830 S Bo:1:108:2 -115 31 = 55534243 27000000 00100000 80000a28 0001cd3d b0000008 00000000 000000
ffff9639a63cd780 1537460901 C Bo:1:108:2 0 31 >
ffff9637b5ee7f00 1537460907 S Bi:1:108:1 -115 4096 <
ffff9637b5ee7f00 1537461916 C Bi:1:108:1 0 4096 = 3f1d6e5f 4d9da5d5 a708432c 3431e88b 1b05c101 42c37447 6084a558 8f7b0206
ffff9639a63cd780 1537461922 S Bi:1:108:1 -115 13 <
ffff9639a63cd780 1537462026 C Bi:1:108:1 0 13 = 55534253 27000000 00000000 00
ffff9639a63cd780 1537462078 S Bo:1:108:2 -115 31 = 55534243 28000000 00100000 80000a28 0001cd3d 58000008 00000000 000000
ffff9639a63cd780 1537462161 C Bo:1:108:2 0 31 >
ffff9637b5ee7f00 1537462167 S Bi:1:108:1 -115 4096 <
ffff9637b5ee7f00 1537463167 C Bi:1:108:1 0 4096 = 61c9da3f 6e5b288a ea898242 5112cbe3 cb377d7f 641d4d89 63b82c78 13072bf5
ffff9639a63cd780 1537463173 S Bi:1:108:1 -115 13 <
ffff9639a63cd780 1537463276 C Bi:1:108:1 0 13 = 55534253 28000000 00000000 00
ffff9639a63cd780 1537463334 S Bo:1:108:2 -115 31 = 55534243 29000000 00100000 80000a28 0001cd3d 20000008 00000000 000000
ffff9639a63cd780 1537463411 C Bo:1:108:2 0 31 >
ffff96391de059c0 1537463424 S Bi:1:108:1 -115 4096 <
ffff96391de059c0 1537464153 C Bi:1:108:1 0 4096 = c23d7175 ae6b76a5 30f63ccf cdd2137b e79e94cd bfe1321f a08e1ffe a2fb8982
ffff9639a63cd780 1537464159 S Bi:1:108:1 -115 13 <
ffff9639a63cd780 1537464296 C Bi:1:108:1 0 13 = 55534253 29000000 00000000 00
ffff9639a63cd780 1537464342 S Bo:1:108:2 -115 31 = 55534243 2a000000 00100000 80000a28 0001cd3c 70000008 00000000 000000
ffff9639a63cd780 1537464401 C Bo:1:108:2 0 31 >
ffff96391de059c0 1537464407 S Bi:1:108:1 -115 4096 <
ffff96391de059c0 1537465417 C Bi:1:108:1 0 4096 = ae863689 da78a7e0 9af68f9f e82c5d71 0bda1229 89b2a0e0 f60bd710 5494bfb9
ffff9639a63cd780 1537465423 S Bi:1:108:1 -115 13 <
ffff9639a63cd780 1537465536 C Bi:1:108:1 0 13 = 55534253 2a000000 00000000 00
ffff9639a63cd780 1537465596 S Bo:1:108:2 -115 31 = 55534243 2b000000 00100000 80000a28 0001cd3c 30000008 00000000 000000
ffff9639a63cd780 1537465652 C Bo:1:108:2 0 31 >
ffff96391de059c0 1537465659 S Bi:1:108:1 -115 4096 <
ffff96391de059c0 1537466666 C Bi:1:108:1 0 4096 = 1bb001f5 92d0ebec acef1afc e619404b c34e64dd 6534d43f b36c700a 955e633c
ffff9639a63cd780 1537466672 S Bi:1:108:1 -115 13 <
ffff9639a63cd780 1537466775 C Bi:1:108:1 0 13 = 55534253 2b000000 00000000 00
ffff9639a63cd780 1537466816 S Bo:1:108:2 -115 31 = 55534243 2c000000 00100000 80000a28 0001cd3c 20000008 00000000 000000
ffff9639a63cd780 1537466902 C Bo:1:108:2 0 31 >
ffff9637b5ee7f00 1537466909 S Bi:1:108:1 -115 4096 <
ffff9637b5ee7f00 1537467666 C Bi:1:108:1 0 4096 = bdb5831c 50db1304 11540383 bae5f3be 2d9b29d1 ebfa4723 29bf417a 58d1e855
ffff9639a63cd780 1537467672 S Bi:1:108:1 -115 13 <
ffff9639a63cd780 1537467776 C Bi:1:108:1 0 13 = 55534253 2c000000 00000000 00
ffff9639a63cd780 1537467822 S Bo:1:108:2 -115 31 = 55534243 2d000000 00100000 80000a28 0001cd3c 48000008 00000000 000000
ffff9639a63cd780 1537467901 C Bo:1:108:2 0 31 >
ffff96391de059c0 1537467914 S Bi:1:108:1 -115 4096 <
ffff96391de059c0 1537468819 C Bi:1:108:1 0 4096 = e22c4ded d2fe40c7 2047cc33 65432d1f 2e3c4344 a11a2071 3c86d0d9 6b3468a2
ffff9639a63cd780 1537468830 S Bi:1:108:1 -115 13 <
ffff9639a63cd780 1537468922 C Bi:1:108:1 0 13 = 55534253 2d000000 00000000 00
ffff9639a63cd780 1537469009 S Bo:1:108:2 -115 31 = 55534243 2e000000 00100000 80000a28 0001cd33 f0000008 00000000 000000
ffff9639a63cd780 1537469152 C Bo:1:108:2 0 31 >
ffff96391de059c0 1537469160 S Bi:1:108:1 -115 4096 <
ffff96391de059c0 1537470041 C Bi:1:108:1 0 4096 = 33774c51 ee74da8f 6702217e e2c2f6cc ca6c533b 88252040 96e5285e 3234a31c
ffff9639a63cd780 1537470046 S Bi:1:108:1 -115 13 <
ffff9639a63cd780 1537470191 C Bi:1:108:1 0 13 = 55534253 2e000000 00000000 00
ffff9639a63cd780 1537470275 S Bo:1:108:2 -115 31 = 55534243 2f000000 00100000 80000a28 00000008 00000008 00000000 000000
ffff9639a63cd780 1537470402 C Bo:1:108:2 0 31 >
ffff9637b5ee7f00 1537470409 S Bi:1:108:1 -115 4096 <
ffff9637b5ee7f00 1537471541 C Bi:1:108:1 0 4096 = eb58906d 6b66732e 66617400 02102000 02000000 00f80000 20004000 00080000
ffff9639a63cd780 1537471553 S Bi:1:108:1 -115 13 <
ffff9639a63cd780 1537471662 C Bi:1:108:1 0 13 = 55534253 2f000000 00000000 00
ffff9639a63cd780 1537471718 S Bo:1:108:2 -115 31 = 55534243 30000000 00100000 80000a28 00000000 18000008 00000000 000000
ffff9639a63cd780 1537471786 C Bo:1:108:2 0 31 >
ffff9637b5ee7f00 1537471792 S Bi:1:108:1 -115 4096 <
ffff9637b5ee7f00 1537472541 C Bi:1:108:1 0 4096 = 00000000 00000000 00000000 00000000 00000000 00000000 00000000 00000000
ffff9639a63cd780 1537472548 S Bi:1:108:1 -115 13 <
ffff9639a63cd780 1537472661 C Bi:1:108:1 0 13 = 55534253 30000000 00000000 00
ffff9639a63cd780 1537472700 S Bo:1:108:2 -115 31 = 55534243 31000000 00100000 80000a28 00000000 38000008 00000000 000000
ffff9639a63cd780 1537472786 C Bo:1:108:2 0 31 >
ffff9637b5ee7f00 1537472797 S Bi:1:108:1 -115 4096 <
ffff9637b5ee7f00 1537473667 C Bi:1:108:1 0 4096 = 00000000 00000000 00000000 00000000 00000000 00000000 00000000 00000000
ffff9639a63cd780 1537473673 S Bi:1:108:1 -115 13 <
ffff9639a63cd780 1537473776 C Bi:1:108:1 0 13 = 55534253 31000000 00000000 00
ffff9639a63cd780 1537473823 S Bo:1:108:2 -115 31 = 55534243 32000000 00100000 80000a28 00000000 78000008 00000000 000000
ffff9639a63cd780 1537473900 C Bo:1:108:2 0 31 >
ffff9637b5ee7f00 1537473906 S Bi:1:108:1 -115 4096 <
ffff9637b5ee7f00 1537474666 C Bi:1:108:1 0 4096 = 00000000 00000000 00000000 00000000 00000000 00000000 00000000 00000000
ffff9639a63cd780 1537474674 S Bi:1:108:1 -115 13 <
ffff9639a63cd780 1537474776 C Bi:1:108:1 0 13 = 55534253 32000000 00000000 00
ffff9639a63cd780 1537474976 S Bo:1:108:2 -115 31 = 55534243 33000000 00300000 80000a28 00000000 20000018 00000000 000000
ffff9639a63cd780 1537475026 C Bo:1:108:2 0 31 >
ffff96391de059c0 1537475039 S Bi:1:108:1 -115 12288 <
ffff96391de059c0 1537476313 C Bi:1:108:1 0 12288 = 00000000 00000000 00000000 00000000 00000000 00000000 00000000 00000000
ffff9639a63cd780 1537476321 S Bi:1:108:1 -115 13 <
ffff9639a63cd780 1537476429 C Bi:1:108:1 0 13 = 55534253 33000000 00000000 00
ffff9639a63cd780 1537476451 S Bo:1:108:2 -115 31 = 55534243 34000000 00100000 80000a28 00000000 10000008 00000000 000000
ffff9639a63cd780 1537476553 C Bo:1:108:2 0 31 >
ffff96391de059c0 1537476561 S Bi:1:108:1 -115 4096 <
ffff96391de059c0 1537477292 C Bi:1:108:1 0 4096 = 00000000 00000000 00000000 00000000 00000000 00000000 00000000 00000000
ffff9639a63cd780 1537477299 S Bi:1:108:1 -115 13 <
ffff9639a63cd780 1537477401 C Bi:1:108:1 0 13 = 55534253 34000000 00000000 00
ffff9639a63cd780 1537477430 S Bo:1:108:2 -115 31 = 55534243 35000000 00700000 80000a28 00000000 40000038 00000000 000000
ffff9639a63cd780 1537477525 C Bo:1:108:2 0 31 >
ffff96391de059c0 1537477532 S Bi:1:108:1 -115 28672 <
ffff96391de059c0 1537479433 C Bi:1:108:1 0 28672 = 00000000 00000000 00000000 00000000 00000000 00000000 00000000 00000000
ffff9639a63cd780 1537479439 S Bi:1:108:1 -115 13 <
ffff9639a63cd780 1537479651 C Bi:1:108:1 0 13 = 55534253 35000000 00000000 00
ffff9639a63cd780 1537479676 S Bo:1:108:2 -115 31 = 55534243 36000000 00200100 80000a28 00000000 80000090 00000000 000000
ffff9639a63cd780 1537479776 C Bo:1:108:2 0 31 >
ffff96391de059c0 1537479783 S Bi:1:108:1 -115 73728 <
ffff96391de059c0 1537483714 C Bi:1:108:1 0 73728 = 00000000 00000000 00000000 00000000 00000000 00000000 00000000 00000000
ffff9639a63cd780 1537483722 S Bi:1:108:1 -115 13 <
ffff9639a63cd780 1537483775 C Bi:1:108:1 0 13 = 55534253 36000000 00000000 00
ffff9639a63cd780 1537483907 S Bo:1:108:2 -115 31 = 55534243 37000000 00e00100 80000a28 00000001 100000f0 00000000 000000
ffff9639a63cd780 1537484030 C Bo:1:108:2 0 31 >
ffff96391de059c0 1537484039 S Bi:1:108:1 -115 122880 <
ffff96391de059c0 1537490095 C Bi:1:108:1 0 122880 = 00000000 00000000 00000000 00000000 00000000 00000000 00000000 00000000
ffff9639a63cd780 1537490103 S Bi:1:108:1 -115 13 <
ffff9639a63cd780 1537490149 C Bi:1:108:1 0 13 = 55534253 37000000 00000000 00
ffff9639a63cd780 1537490310 S Bo:1:108:2 -115 31 = 55534243 38000000 00e00100 80000a28 00000002 000000f0 00000000 000000
ffff9639a63cd780 1537490402 C Bo:1:108:2 0 31 >
ffff96391de059c0 1537490408 S Bi:1:108:1 -115 122880 <
ffff96391de059c0 1537496470 C Bi:1:108:1 0 122880 = 00000000 00000000 00000000 00000000 00000000 00000000 00000000 00000000
ffff9639a63cd780 1537496478 S Bi:1:108:1 -115 13 <
ffff9639a63cd780 1537496527 C Bi:1:108:1 0 13 = 55534253 38000000 00000000 00
ffff9639a63cd780 1537496567 S Bo:1:108:2 -115 31 = 55534243 39000000 00200000 80000a28 00000002 f0000010 00000000 000000
ffff9639a63cd780 1537496652 C Bo:1:108:2 0 31 >
ffff96391de059c0 1537496658 S Bi:1:108:1 -115 8192 <
ffff96391de059c0 1537497544 C Bi:1:108:1 0 8192 = 00000000 00000000 00000000 00000000 00000000 00000000 00000000 00000000
ffff9639a63cd780 1537497549 S Bi:1:108:1 -115 13 <
ffff9639a63cd780 1537497777 C Bi:1:108:1 0 13 = 55534253 39000000 00000000 00
ffff9639a63cd780 1537497900 S Bo:1:108:2 -115 31 = 55534243 3a000000 00e00100 80000a28 00000003 000000f0 00000000 000000
ffff9639a63cd780 1537498054 C Bo:1:108:2 0 31 >
ffff96391de059c0 1537498062 S Bi:1:108:1 -115 122880 <
ffff96391de059c0 1537503977 C Bi:1:108:1 0 122880 = 00000000 00000000 00000000 00000000 00000000 00000000 00000000 00000000
ffff9639a63cd780 1537503985 S Bi:1:108:1 -115 13 <
ffff9639a63cd780 1537504025 C Bi:1:108:1 0 13 = 55534253 3a000000 00000000 00
ffff9639a63cd780 1537504049 S Bo:1:108:2 -115 31 = 55534243 3b000000 00200000 80000a28 00000003 f0000010 00000000 000000
ffff9639a63cd780 1537504152 C Bo:1:108:2 0 31 >
ffff96391de059c0 1537504157 S Bi:1:108:1 -115 8192 <
ffff96391de059c0 1537505045 C Bi:1:108:1 0 8192 = 00000000 00000000 00000000 00000000 00000000 00000000 00000000 00000000
ffff9639a63cd780 1537505051 S Bi:1:108:1 -115 13 <
ffff9639a63cd780 1537505304 C Bi:1:108:1 0 13 = 55534253 3b000000 00000000 00
ffff9639a63cd780 1537505538 S Bo:1:108:2 -115 31 = 55534243 3c000000 00400000 80000a28 0001cd3c 00000020 00000000 000000
ffff9639a63cd780 1537505680 C Bo:1:108:2 0 31 >
ffff96391de059c0 1537505687 S Bi:1:108:1 -115 16384 <
ffff96391de059c0 1537507812 C Bi:1:108:1 0 16384 = b9405586 9b4180de 2ae4f211 12d4054c a98459bb 01c67a72 4ab8ba11 0d8fec53
ffff9639a63cd780 1537507820 S Bi:1:108:1 -115 13 <
ffff9639a63cd780 1537507901 C Bi:1:108:1 0 13 = 55534253 3c000000 00000000 00
ffff9639a63cd780 1537507929 S Bo:1:108:2 -115 31 = 55534243 3d000000 00100000 80000a28 0001cd3c 28000008 00000000 000000
ffff9639a63cd780 1537508027 C Bo:1:108:2 0 31 >
ffff96391de059c0 1537508033 S Bi:1:108:1 -115 4096 <
ffff96391de059c0 1537508915 C Bi:1:108:1 0 4096 = 7c88b680 a9d04623 85d9e5ee 6aaeee60 152d45cd c13a3b16 9dbddb53 532d4486
ffff9639a63cd780 1537508921 S Bi:1:108:1 -115 13 <
ffff9639a63cd780 1537509026 C Bi:1:108:1 0 13 = 55534253 3d000000 00000000 00
ffff9639a63cd780 1537509048 S Bo:1:108:2 -115 31 = 55534243 3e000000 00200000 80000a28 0001cd3c 38000010 00000000 000000
ffff9639a63cd780 1537509179 C Bo:1:108:2 0 31 >
ffff96391de059c0 1537509186 S Bi:1:108:1 -115 8192 <
ffff96391de059c0 1537510794 C Bi:1:108:1 0 8192 = 2599d80f 6954a5e0 5f171389 2efce5e2 744afb79 342ab8c3 3c5f256b c6f1c839
ffff9639a63cd780 1537510799 S Bi:1:108:1 -115 13 <
ffff9639a63cd780 1537510901 C Bi:1:108:1 0 13 = 55534253 3e000000 00000000 00
ffff9639a63cd780 1537510924 S Bo:1:108:2 -115 31 = 55534243 3f000000 00400000 80000a28 0001cd3c 50000020 00000000 000000
ffff9639a63cd780 1537511026 C Bo:1:108:2 0 31 >
ffff96391de059c0 1537511032 S Bi:1:108:1 -115 16384 <
ffff96391de059c0 1537513300 C Bi:1:108:1 0 16384 = dc1f1ecf 7868ecdf 92558671 90b8bb0d ed4e2388 c6855618 39ea92ad c07ac1a0
ffff9639a63cd780 1537513307 S Bi:1:108:1 -115 13 <
ffff9639a63cd780 1537513526 C Bi:1:108:1 0 13 = 55534253 3f000000 00000000 00
ffff9639a63cd780 1537513547 S Bo:1:108:2 -115 31 = 55534243 40000000 00100100 80000a28 0001cd3c 78000088 00000000 000000
ffff9639a63cd780 1537513651 C Bo:1:108:2 0 31 >
ffff96391de059c0 1537513657 S Bi:1:108:1 -115 69632 <
ffff96391de059c0 1537517962 C Bi:1:108:1 0 69632 = 39089c82 560fb8a3 e8eeac4d 0f61e0c7 99c56441 e5005e6c 96b82947 a53cdd58
ffff9639a63cd780 1537517969 S Bi:1:108:1 -115 13 <
ffff9639a63cd780 1537518029 C Bi:1:108:1 0 13 = 55534253 40000000 00000000 00
ffff9639a63cd780 1537518114 S Bo:1:108:2 -115 31 = 55534243 41000000 00400000 80000a28 0001cd3d 00000020 00000000 000000
ffff9639a63cd780 1537518152 C Bo:1:108:2 0 31 >
ffff96391de059c0 1537518157 S Bi:1:108:1 -115 16384 <
ffff96391de059c0 1537519930 C Bi:1:108:1 0 16384 = 7b844759 b0a9281a ccfdd722 0f2373c4 1dc9186e e7cb6e68 8db1f54f bd71c8cf
ffff9639a63cd780 1537519938 S Bi:1:108:1 -115 13 <
ffff9639a63cd780 1537520030 C Bi:1:108:1 0 13 = 55534253 41000000 00000000 00
ffff9639a63cd780 1537520070 S Bo:1:108:2 -115 31 = 55534243 42000000 00600000 80000a28 0001cd3d 28000030 00000000 000000
ffff9639a63cd780 1537520154 C Bo:1:108:2 0 31 >
ffff96391de059c0 1537520163 S Bi:1:108:1 -115 24576 <
ffff96391de059c0 1537522558 C Bi:1:108:1 0 24576 = a2837ac5 15567c15 490f2953 9b7e0d4f 689113b9 7d0b5db7 e8c99e06 0a18e4b6
ffff9639a63cd780 1537522568 S Bi:1:108:1 -115 13 <
ffff9639a63cd780 1537522653 C Bi:1:108:1 0 13 = 55534253 42000000 00000000 00
ffff9639a63cd780 1537522693 S Bo:1:108:2 -115 31 = 55534243 43000000 00a00000 80000a28 0001cd3d 60000050 00000000 000000
ffff9639a63cd780 1537522779 C Bo:1:108:2 0 31 >
ffff96391de059c0 1537522793 S Bi:1:108:1 -115 40960 <
ffff96391de059c0 1537525574 C Bi:1:108:1 0 40960 = 15cbac3a 8139ef96 131129e7 a556f61e 8518cc81 28bf3aab 257a5722 35d8b657
ffff9639a63cd780 1537525584 S Bi:1:108:1 -115 13 <
ffff9639a63cd780 1537525655 C Bi:1:108:1 0 13 = 55534253 43000000 00000000 00
ffff9639a63cd780 1537525694 S Bo:1:108:2 -115 31 = 55534243 44000000 00900000 80000a28 0001cd3d b8000048 00000000 000000
ffff9639a63cd780 1537525780 C Bo:1:108:2 0 31 >
ffff96391de059c0 1537525789 S Bi:1:108:1 -115 36864 <
ffff96391de059c0 1537528699 C Bi:1:108:1 0 36864 = dad75779 278b0665 60f5962e 98d66fcc ad84eda5 1d3e124f 8cdcd42d da8a74fa
ffff9639a63cd780 1537528708 S Bi:1:108:1 -115 13 <
ffff9639a63cd780 1537528778 C Bi:1:108:1 0 13 = 55534253 44000000 00000000 00
ffff9639a63cd780 1537528953 S Bo:1:108:2 -115 31 = 55534243 45000000 00e00000 80000a28 0001cd3e 00000070 00000000 000000
ffff9639a63cd780 1537529027 C Bo:1:108:2 0 31 >
ffff96391de059c0 1537529034 S Bi:1:108:1 -115 57344 <
ffff96391de059c0 1537532697 C Bi:1:108:1 0 57344 = d32fe994 dc24cc01 cf9b16c8 f82e7b07 41744a20 8c68ff12 76c2808a e858bca1
ffff9639a63cd780 1537532704 S Bi:1:108:1 -115 13 <
ffff9639a63cd780 1537532777 C Bi:1:108:1 0 13 = 55534253 45000000 00000000 00
ffff9639a63cd780 1537532802 S Bo:1:108:2 -115 31 = 55534243 46000000 00000100 80000a28 0001cd3e 78000080 00000000 000000
ffff9639a63cd780 1537532901 C Bo:1:108:2 0 31 >
ffff96391de059c0 1537532907 S Bi:1:108:1 -115 65536 <
ffff96391de059c0 1537537072 C Bi:1:108:1 0 65536 = af6550d0 929c4c36 2caf1e58 d5ce28af 44e9628a f4e0858d bca405de 34aba7d3
ffff9639a63cd780 1537537078 S Bi:1:108:1 -115 13 <
ffff9639a63cd780 1537537151 C Bi:1:108:1 0 13 = 55534253 46000000 00000000 00
ffff9639a63cd780 1537537224 S Bo:1:108:2 -115 31 = 55534243 47000000 00f00000 80000a28 0001cd3f 08000078 00000000 000000
ffff9639a63cd780 1537537275 C Bo:1:108:2 0 31 >
ffff96391de059c0 1537537281 S Bi:1:108:1 -115 61440 <
ffff96391de059c0 1537541451 C Bi:1:108:1 0 61440 = 20483e9e 926ef9bc a727f45d 7af5887f 2491e79e 5c5243a5 489e2ce0 f249eea7
ffff9639a63cd780 1537541458 S Bi:1:108:1 -115 13 <
ffff9639a63cd780 1537541527 C Bi:1:108:1 0 13 = 55534253 47000000 00000000 00
ffff9639a63cd780 1537541559 S Bo:1:108:2 -115 31 = 55534243 48000000 00700000 80000a28 0001cd3f 88000038 00000000 000000
ffff9639a63cd780 1537541653 C Bo:1:108:2 0 31 >
ffff96391fddd000 1537541661 S Bi:1:108:1 -115 28672 <
ffff96391fddd000 1537544184 C Bi:1:108:1 0 28672 = 8517c543 1d885b00 587aeb01 b92bf23e db313b63 b29a9ebe ebfd6091 ec6053fb
ffff9639a63cd780 1537544192 S Bi:1:108:1 -115 13 <
ffff9639a63cd780 1537544276 C Bi:1:108:1 0 13 = 55534253 48000000 00000000 00
ffff9639a63cd780 1537544325 S Bo:1:108:2 -115 31 = 55534243 49000000 00500000 80000a28 0001cd3f c8000028 00000000 000000
ffff9639a63cd780 1537544401 C Bo:1:108:2 0 31 >
ffff96391fddd000 1537544406 S Bi:1:108:1 -115 20480 <
ffff96391fddd000 1537546549 C Bi:1:108:1 0 20480 = d144d3d7 6c7913cd 60b7783e 9ae11d78 241cde61 ebee45a1 84b35a4f 0a0b8fed
ffff9639a63cd780 1537546555 S Bi:1:108:1 -115 13 <
ffff9639a63cd780 1537546777 C Bi:1:108:1 0 13 = 55534253 49000000 00000000 00
ffff9639a63cd780 1537546860 S Bo:1:108:2 -115 31 = 55534243 4a000000 00100000 80000a28 00000010 00000008 00000000 000000
ffff9639a63cd780 1537546910 C Bo:1:108:2 0 31 >
ffff96391fddd000 1537546917 S Bi:1:108:1 -115 4096 <
ffff96391fddd000 1537548168 C Bi:1:108:1 0 4096 = 01f00300 02f00300 03f00300 04f00300 05f00300 06f00300 07f00300 08f00300
ffff9639a63cd780 1537548174 S Bi:1:108:1 -115 13 <
ffff9639a63cd780 1537548276 C Bi:1:108:1 0 13 = 55534253 4a000000 00000000 00
ffff9639a63cd780 1537549205 S Bo:1:108:2 -115 31 = 55534243 4b000000 00000000 00000600 00000000 00000000 00000000 000000
ffff9639a63cd780 1537549277 C Bo:1:108:2 0 31 >
ffff9639a63cd780 1537549298 S Bi:1:108:1 -115 13 <
ffff9639a63cd780 1537549400 C Bi:1:108:1 0 13 = 55534253 4b000000 00000000 00
ffff9639a63cd780 1537584347 S Bo:1:108:2 -115 31 = 55534243 4c000000 00000000 00000600 00000000 00000000 00000000 000000
ffff9639a63cd780 1537584413 C Bo:1:108:2 0 31 >
ffff9639a63cd780 1537584451 S Bi:1:108:1 -115 13 <
ffff9639a63cd780 1537584528 C Bi:1:108:1 0 13 = 55534253 4c000000 00000000 00
ffff9639a63cd780 1537585270 S Bo:1:108:2 -115 31 = 55534243 4d000000 00000000 00000600 00000000 00000000 00000000 000000
ffff9639a63cd780 1537585405 C Bo:1:108:2 0 31 >
ffff9639a63cd780 1537585445 S Bi:1:108:1 -115 13 <
ffff9639a63cd780 1537585534 C Bi:1:108:1 0 13 = 55534253 4d000000 00000000 00
ffff9639a63cd780 1537585590 S Bo:1:108:2 -115 31 = 55534243 4e000000 00000000 00000600 00000000 00000000 00000000 000000
ffff9639a63cd780 1537585655 C Bo:1:108:2 0 31 >
ffff9639a63cd780 1537586132 S Bi:1:108:1 -115 13 <
ffff9639a63cd780 1537586283 C Bi:1:108:1 0 13 = 55534253 4e000000 00000000 00
ffff9639a63cd780 1537586354 S Bo:1:108:2 -115 31 = 55534243 4f000000 00000000 00000600 00000000 00000000 00000000 000000
ffff9639a63cd780 1537586405 C Bo:1:108:2 0 31 >
ffff9639a63cd780 1537586432 S Bi:1:108:1 -115 13 <
ffff9639a63cd780 1537586529 C Bi:1:108:1 0 13 = 55534253 4f000000 00000000 00
ffff9639a63cd780 1537587247 S Bo:1:108:2 -115 31 = 55534243 50000000 00000000 00000600 00000000 00000000 00000000 000000
ffff9639a63cd780 1537587405 C Bo:1:108:2 0 31 >
ffff9639a63cd780 1537587584 S Bi:1:108:1 -115 13 <
ffff9639a63cd780 1537587653 C Bi:1:108:1 0 13 = 55534253 50000000 00000000 00
ffff9639a63cd780 1537587700 S Bo:1:108:2 -115 31 = 55534243 51000000 00000000 00000600 00000000 00000000 00000000 000000
ffff9639a63cd780 1537587776 C Bo:1:108:2 0 31 >
ffff9639a63cd780 1537587792 S Bi:1:108:1 -115 13 <
ffff9639a63cd780 1537587901 C Bi:1:108:1 0 13 = 55534253 51000000 00000000 00
ffff9639a63cd780 1537587951 S Bo:1:108:2 -115 31 = 55534243 52000000 00000000 00000600 00000000 00000000 00000000 000000
ffff9639a63cd780 1537588028 C Bo:1:108:2 0 31 >
ffff9639a63cd780 1537588058 S Bi:1:108:1 -115 13 <
ffff9639a63cd780 1537588152 C Bi:1:108:1 0 13 = 55534253 52000000 00000000 00
ffff9639a63cd780 1537588182 S Bo:1:108:2 -115 31 = 55534243 53000000 00100000 80000a28 0001cd3f 80000008 00000000 000000
ffff9639a63cd780 1537588276 C Bo:1:108:2 0 31 >
ffff96391fddd900 1537588298 S Bi:1:108:1 -115 4096 <
ffff96391fddd900 1537589669 C Bi:1:108:1 0 4096 = 86471295 3b62fef4 dbbfccd1 92d4f546 57ddf65c 858bd9be dfb8c82a c05cb895
ffff9639a63cd780 1537589684 S Bi:1:108:1 -115 13 <
ffff9639a63cd780 1537589777 C Bi:1:108:1 0 13 = 55534253 53000000 00000000 00
ffff9639a63cd780 1537589831 S Bo:1:108:2 -115 31 = 55534243 54000000 00100000 80000a28 0001cd3f f0000008 00000000 000000
ffff9639a63cd780 1537589902 C Bo:1:108:2 0 31 >
ffff9637b5ee7f00 1537589917 S Bi:1:108:1 -115 4096 <
ffff9637b5ee7f00 1537590916 C Bi:1:108:1 0 4096 = f9a78c85 31c58062 04d836ff 341c3f06 7ef19b20 8ee3decf fa1482c5 fa332caa
ffff9639a63cd780 1537590933 S Bi:1:108:1 -115 13 <
ffff9639a63cd780 1537591026 C Bi:1:108:1 0 13 = 55534253 54000000 00000000 00
ffff9639a63cd780 1537591069 S Bo:1:108:2 -115 31 = 55534243 55000000 00100000 80000a28 00000008 00000008 00000000 000000
ffff9639a63cd780 1537591152 C Bo:1:108:2 0 31 >
ffff9637b5ee7f00 1537591158 S Bi:1:108:1 -115 4096 <
ffff9637b5ee7f00 1537592419 C Bi:1:108:1 0 4096 = eb58906d 6b66732e 66617400 02102000 02000000 00f80000 20004000 00080000
ffff9639a63cd780 1537592427 S Bi:1:108:1 -115 13 <
ffff9639a63cd780 1537592528 C Bi:1:108:1 0 13 = 55534253 55000000 00000000 00
ffff9639a63cd780 1537592587 S Bo:1:108:2 -115 31 = 55534243 56000000 00100000 80000a28 00000008 08000008 00000000 000000
ffff9639a63cd780 1537592652 C Bo:1:108:2 0 31 >
ffff9637b5ee7f00 1537592665 S Bi:1:108:1 -115 4096 <
ffff9637b5ee7f00 1537593540 C Bi:1:108:1 0 4096 = 00000000 00000000 00000000 00000000 00000000 00000000 00000000 00000000
ffff9639a63cd780 1537593553 S Bi:1:108:1 -115 13 <
ffff9639a63cd780 1537593651 C Bi:1:108:1 0 13 = 55534253 56000000 00000000 00
ffff9639a63cd780 1537593695 S Bo:1:108:2 -115 31 = 55534243 57000000 00020000 80000a28 0001cd3f f8000001 00000000 000000
ffff9639a63cd780 1537593776 C Bo:1:108:2 0 31 >
ffff9637b5ee7f00 1537593782 S Bi:1:108:1 -115 512 <
ffff9637b5ee7f00 1537595041 C Bi:1:108:1 0 512 = cd857911 a601d7f1 6d3e1af5 cf45a44b bd4a9223 9c322c83 0972022c 91376942
ffff9639a63cd780 1537595046 S Bi:1:108:1 -115 13 <
ffff9639a63cd780 1537595151 C Bi:1:108:1 0 13 = 55534253 57000000 00000000 00
ffff9639a63cd780 1537595171 S Bo:1:108:2 -115 31 = 55534243 58000000 00020000 80000a28 0001cd3f f9000001 00000000 000000
ffff9639a63cd780 1537595275 C Bo:1:108:2 0 31 >
ffff9637b5ee7f00 1537595289 S Bi:1:108:1 -115 512 <
ffff9637b5ee7f00 1537596152 C Bi:1:108:1 0 512 = 2dd37407 26b2250a f04218bb 2890bbe3 1e8b0761 9e09b5a6 2812cd50 2a137dcf
ffff9639a63cd780 1537596176 S Bi:1:108:1 -115 13 <
ffff9639a63cd780 1537596275 C Bi:1:108:1 0 13 = 55534253 58000000 00000000 00
ffff9639a63cd780 1537596305 S Bo:1:108:2 -115 31 = 55534243 59000000 00020000 80000a28 0001cd3f fa000001 00000000 000000
ffff9639a63cd780 1537596400 C Bo:1:108:2 0 31 >
ffff9637b5ee7f00 1537596414 S Bi:1:108:1 -115 512 <
ffff9637b5ee7f00 1537597289 C Bi:1:108:1 0 512 = 592875c0 3b079913 6137fec7 695e5960 21a5871b 201193b3 71648f72 82d745fc
ffff9639a63cd780 1537597305 S Bi:1:108:1 -115 13 <
ffff9639a63cd780 1537597400 C Bi:1:108:1 0 13 = 55534253 59000000 00000000 00
ffff9639a63cd780 1537597425 S Bo:1:108:2 -115 31 = 55534243 5a000000 00020000 80000a28 0001cd3f fb000001 00000000 000000
ffff9639a63cd780 1537597525 C Bo:1:108:2 0 31 >
ffff9637b5ee7f00 1537597540 S Bi:1:108:1 -115 512 <
ffff9637b5ee7f00 1537598417 C Bi:1:108:1 0 512 = 5490bea0 dc10b592 479ddc48 383c24dc d42fb99d 0d11b063 4bb161b9 396b5e8b
ffff9639a63cd780 1537598424 S Bi:1:108:1 -115 13 <
ffff9639a63cd780 1537598525 C Bi:1:108:1 0 13 = 55534253 5a000000 00000000 00
ffff9639a63cd780 1537598550 S Bo:1:108:2 -115 31 = 55534243 5b000000 00020000 80000a28 0001cd3f fc000001 00000000 000000
ffff9639a63cd780 1537598650 C Bo:1:108:2 0 31 >
ffff9637b5ee7f00 1537598664 S Bi:1:108:1 -115 512 <
ffff9637b5ee7f00 1537599540 C Bi:1:108:1 0 512 = 95fe1e82 1c803917 07081836 1b88661f 1652a1d0 b478338f 4a7681ce c828bd59
ffff9639a63cd780 1537599547 S Bi:1:108:1 -115 13 <
ffff9639a63cd780 1537599650 C Bi:1:108:1 0 13 = 55534253 5b000000 00000000 00
ffff9639a63cd780 1537599675 S Bo:1:108:2 -115 31 = 55534243 5c000000 00020000 80000a28 0001cd3f fd000001 00000000 000000
ffff9639a63cd780 1537599776 C Bo:1:108:2 0 31 >
ffff9637b5ee7f00 1537599781 S Bi:1:108:1 -115 512 <
ffff9637b5ee7f00 1537600683 C Bi:1:108:1 0 512 = 87cf0e68 f4bdf946 f1b39ea6 1a1ecadd d588efb3 ade7a601 90f01529 399bdeba
ffff9639a63cd780 1537600700 S Bi:1:108:1 -115 13 <
ffff9639a63cd780 1537600779 C Bi:1:108:1 0 13 = 55534253 5c000000 00000000 00
ffff9639a63cd780 1537600813 S Bo:1:108:2 -115 31 = 55534243 5d000000 00020000 80000a28 0001cd3f fe000001 00000000 000000
ffff9639a63cd780 1537600902 C Bo:1:108:2 0 31 >
ffff9637b5ee7f00 1537600920 S Bi:1:108:1 -115 512 <
ffff9637b5ee7f00 1537601779 C Bi:1:108:1 0 512 = 6f1228a8 b5e3123a 795f5a0d e00e37e0 d7d35d75 2e704296 e7084863 e111a405
ffff9639a63cd780 1537601797 S Bi:1:108:1 -115 13 <
ffff9639a63cd780 1537601902 C Bi:1:108:1 0 13 = 55534253 5d000000 00000000 00
ffff9639a63cd780 1537601929 S Bo:1:108:2 -115 31 = 55534243 5e000000 00020000 80000a28 0001cd3f ff000001 00000000 000000
ffff9639a63cd780 1537602027 C Bo:1:108:2 0 31 >
ffff96391fddd000 1537602034 S Bi:1:108:1 -115 512 <
ffff96391fddd000 1537602916 C Bi:1:108:1 0 512 = 4f042556 339e5d6f 4e1baa48 4ae6eaf7 3d5e595d 5b9f5c2b e35437d1 fb284e9c
ffff9639a63cd780 1537602923 S Bi:1:108:1 -115 13 <
ffff9639a63cd780 1537603027 C Bi:1:108:1 0 13 = 55534253 5e000000 00000000 00
ffff9639a63cd780 1537603099 S Bo:1:108:2 -115 31 = 55534243 5f000000 00100000 80000a28 0001cd3e f8000008 00000000 000000
ffff9639a63cd780 1537603153 C Bo:1:108:2 0 31 >
ffff96399c929e40 1537603176 S Bi:1:108:1 -115 4096 <
ffff96399c929e40 1537604156 C Bi:1:108:1 0 4096 = 71afc68e f214dcbf d4522b5e d38e94ab dbc82926 938546ce f8f90a5c a24f60ce
ffff9639a63cd780 1537604189 S Bi:1:108:1 -115 13 <
ffff9639a63cd780 1537604277 C Bi:1:108:1 0 13 = 55534253 5f000000 00000000 00
ffff9639a63cd780 1537604362 S Bo:1:108:2 -115 31 = 55534243 60000000 00100000 80000a28 00000010 00000008 00000000 000000
ffff9639a63cd780 1537604406 C Bo:1:108:2 0 31 >
ffff96399c929e40 1537604414 S Bi:1:108:1 -115 4096 <
ffff96399c929e40 1537605658 C Bi:1:108:1 0 4096 = 01f00300 02f00300 03f00300 04f00300 05f00300 06f00300 07f00300 08f00300
ffff9639a63cd780 1537605666 S Bi:1:108:1 -115 13 <
ffff9639a63cd780 1537605781 C Bi:1:108:1 0 13 = 55534253 60000000 00000000 00
ffff9639a63cd780 1537605837 S Bo:1:108:2 -115 31 = 55534243 61000000 00200000 80000a28 0000007b 60000010 00000000 000000
ffff9639a63cd780 1537605905 C Bo:1:108:2 0 31 >
ffff96399c929e40 1537605913 S Bi:1:108:1 -115 8192 <
ffff96399c929e40 1537608687 C Bi:1:108:1 0 8192 = 54202020 20202020 20202008 0000cd9a 644f644f 0000cd9a 644f0000 00000000
ffff9639a63cd780 1537608697 S Bi:1:108:1 -115 13 <
ffff9639a63cd780 1537608802 C Bi:1:108:1 0 13 = 55534253 61000000 00000000 00
ffff9639a63cd780 1537608945 S Bo:1:108:2 -115 31 = 55534243 62000000 00100000 80000a28 00000008 18000008 00000000 000000
ffff9639a63cd780 1537609030 C Bo:1:108:2 0 31 >
ffff96399c929e40 1537609039 S Bi:1:108:1 -115 4096 <
ffff96399c929e40 1537609920 C Bi:1:108:1 0 4096 = 00000000 00000000 00000000 00000000 00000000 00000000 00000000 00000000
ffff9639a63cd780 1537609928 S Bi:1:108:1 -115 13 <
ffff9639a63cd780 1537610029 C Bi:1:108:1 0 13 = 55534253 62000000 00000000 00
ffff9639a63cd780 1537610085 S Bo:1:108:2 -115 31 = 55534243 63000000 00100000 80000a28 00000008 38000008 00000000 000000
ffff9639a63cd780 1537610154 C Bo:1:108:2 0 31 >
ffff96399c929e40 1537610166 S Bi:1:108:1 -115 4096 <
ffff96399c929e40 1537611045 C Bi:1:108:1 0 4096 = 010c0000 020c0000 030c0000 040c0000 050c0000 060c0000 070c0000 080c0000
ffff9639a63cd780 1537611053 S Bi:1:108:1 -115 13 <
ffff9639a63cd780 1537611153 C Bi:1:108:1 0 13 = 55534253 63000000 00000000 00
ffff9639a63cd780 1537611221 S Bo:1:108:2 -115 31 = 55534243 64000000 00100000 80000a28 00000008 78000008 00000000 000000
ffff9639a63cd780 1537611279 C Bo:1:108:2 0 31 >
ffff96399c929e40 1537611290 S Bi:1:108:1 -115 4096 <
ffff96399c929e40 1537612160 C Bi:1:108:1 0 4096 = 012c0000 022c0000 032c0000 042c0000 052c0000 062c0000 072c0000 082c0000
ffff9639a63cd780 1537612178 S Bi:1:108:1 -115 13 <
ffff9639a63cd780 1537612275 C Bi:1:108:1 0 13 = 55534253 64000000 00000000 00
ffff9639a63cd780 1537612407 S Bo:1:108:2 -115 31 = 55534243 65000000 00300000 80000a28 00000008 20000018 00000000 000000
ffff9639a63cd780 1537612527 C Bo:1:108:2 0 31 >
ffff96399c929e40 1537612543 S Bi:1:108:1 -115 12288 <
ffff96399c929e40 1537613798 C Bi:1:108:1 0 12288 = f8ffff0f ffffff0f 98c51000 ffffff0f 00000000 ffffff0f ffffff0f 08000000
ffff9639a63cd780 1537613811 S Bi:1:108:1 -115 13 <
ffff9639a63cd780 1537613902 C Bi:1:108:1 0 13 = 55534253 65000000 00000000 00
ffff9639a63cd780 1537613931 S Bo:1:108:2 -115 31 = 55534243 66000000 00100000 80000a28 00000008 10000008 00000000 000000
ffff9639a63cd780 1537614026 C Bo:1:108:2 0 31 >
ffff96399c929e40 1537614040 S Bi:1:108:1 -115 4096 <
ffff96399c929e40 1537614916 C Bi:1:108:1 0 4096 = 00000000 00000000 00000000 00000000 00000000 00000000 00000000 00000000
ffff9639a63cd780 1537614928 S Bi:1:108:1 -115 13 <
ffff9639a63cd780 1537615027 C Bi:1:108:1 0 13 = 55534253 66000000 00000000 00
ffff9639a63cd780 1537615058 S Bo:1:108:2 -115 31 = 55534243 67000000 00700000 80000a28 00000008 40000038 00000000 000000
ffff9639a63cd780 1537615150 C Bo:1:108:2 0 31 >
ffff96399c929e40 1537615165 S Bi:1:108:1 -115 28672 <
ffff96399c929e40 1537617055 C Bi:1:108:1 0 28672 = 01100000 02100000 03100000 04100000 05100000 06100000 07100000 08100000
ffff9639a63cd780 1537617068 S Bi:1:108:1 -115 13 <
ffff9639a63cd780 1537617276 C Bi:1:108:1 0 13 = 55534253 67000000 00000000 00
ffff9639a63cd780 1537617307 S Bo:1:108:2 -115 31 = 55534243 68000000 00200100 80000a28 00000008 80000090 00000000 000000
ffff9639a63cd780 1537617401 C Bo:1:108:2 0 31 >
ffff96399c929e40 1537617416 S Bi:1:108:1 -115 73728 <
ffff96399c929e40 1537621330 C Bi:1:108:1 0 73728 = 01300000 02300000 03300000 04300000 05300000 06300000 07300000 08300000
ffff9639a63cd780 1537621352 S Bi:1:108:1 -115 13 <
ffff9639a63cd780 1537621401 C Bi:1:108:1 0 13 = 55534253 68000000 00000000 00
ffff9639a63cd780 1537621488 S Bo:1:108:2 -115 31 = 55534243 69000000 00e00100 80000a28 00000009 100000f0 00000000 000000
ffff9639a63cd780 1537621541 C Bo:1:108:2 0 31 >
ffff96399c929e40 1537621549 S Bi:1:108:1 -115 122880 <
ffff96399c929e40 1537627758 C Bi:1:108:1 0 122880 = 00000000 00000000 00000000 00000000 00000000 00000000 00000000 00000000
ffff9639a63cd780 1537627772 S Bi:1:108:1 -115 13 <
ffff9639a63cd780 1537627929 C Bi:1:108:1 0 13 = 55534253 69000000 00000000 00
ffff9639a63cd780 1537628260 S Bo:1:108:2 -115 31 = 55534243 6a000000 00e00100 80000a28 0000000a 000000f0 00000000 000000
ffff9639a63cd780 1537628417 C Bo:1:108:2 0 31 >
ffff96399c929e40 1537628429 S Bi:1:108:1 -115 122880 <
ffff96399c929e40 1537634513 C Bi:1:108:1 0 122880 = 00000000 00000000 00000000 00000000 00000000 00000000 00000000 00000000
ffff9639a63cd780 1537634528 S Bi:1:108:1 -115 13 <
ffff9639a63cd780 1537634691 C Bi:1:108:1 0 13 = 55534253 6a000000 00000000 00
ffff9639a63cd780 1537634741 S Bo:1:108:2 -115 31 = 55534243 6b000000 00200000 80000a28 0000000a f0000010 00000000 000000
ffff9639a63cd780 1537634783 C Bo:1:108:2 0 31 >
ffff9637b5ee7f00 1537634817 S Bi:1:108:1 -115 8192 <
ffff9637b5ee7f00 1537635827 C Bi:1:108:1 0 8192 = 00000000 00000000 00000000 00000000 00000000 00000000 00000000 00000000
ffff9639a63cd780 1537635845 S Bi:1:108:1 -115 13 <
ffff9639a63cd780 1537635912 C Bi:1:108:1 0 13 = 55534253 6b000000 00000000 00
ffff9639a63cd780 1537636088 S Bo:1:108:2 -115 31 = 55534243 6c000000 00e00100 80000a28 0000000b 000000f0 00000000 000000
ffff9639a63cd780 1537636191 C Bo:1:108:2 0 31 >
ffff96391fddd000 1537636203 S Bi:1:108:1 -115 122880 <
ffff96391fddd000 1537642396 C Bi:1:108:1 0 122880 = 00000000 00000000 00000000 00000000 00000000 00000000 00000000 00000000
ffff9639a63cd780 1537642426 S Bi:1:108:1 -115 13 <
ffff9639a63cd780 1537642534 C Bi:1:108:1 0 13 = 55534253 6c000000 00000000 00
ffff9639a63cd780 1537642580 S Bo:1:108:2 -115 31 = 55534243 6d000000 00200000 80000a28 0000000b f0000010 00000000 000000
ffff9639a63cd780 1537642684 C Bo:1:108:2 0 31 >
ffff96391fddd000 1537642706 S Bi:1:108:1 -115 8192 <
ffff96391fddd000 1537643678 C Bi:1:108:1 0 8192 = 01e80100 02e80100 03e80100 04e80100 05e80100 06e80100 07e80100 08e80100
ffff9639a63cd780 1537643691 S Bi:1:108:1 -115 13 <
ffff9639a63cd780 1537643808 C Bi:1:108:1 0 13 = 55534253 6d000000 00000000 00
ffff9639a63cd780 1537644220 S Bo:1:108:2 -115 31 = 55534243 6e000000 00e00100 80000a28 0001cd3c 000000f0 00000000 000000
ffff9639a63cd780 1537644280 C Bo:1:108:2 0 31 >
ffff96391fddd000 1537644309 S Bi:1:108:1 -115 122880 <
ffff96391fddd000 1537651372 C Bi:1:108:1 0 122880 = b9405586 9b4180de 2ae4f211 12d4054c a98459bb 01c67a72 4ab8ba11 0d8fec53
ffff9639a63cd780 1537651388 S Bi:1:108:1 -115 13 <
ffff9639a63cd780 1537651558 C Bi:1:108:1 0 13 = 55534253 6e000000 00000000 00
ffff9639a63cd780 1537651606 S Bo:1:108:2 -115 31 = 55534243 6f000000 00200000 80000a28 0001cd3c f0000010 00000000 000000
ffff9639a63cd780 1537651654 C Bo:1:108:2 0 31 >
ffff96391fddd000 1537651671 S Bi:1:108:1 -115 8192 <
ffff96391fddd000 1537653301 C Bi:1:108:1 0 8192 = f963e660 63de1bc8 4ca6495b c21ce1e9 e2f865df e4ef5e1d 6bccd8a9 34b0c9ef
ffff9639a63cd780 1537653318 S Bi:1:108:1 -115 13 <
ffff9639a63cd780 1537653439 C Bi:1:108:1 0 13 = 55534253 6f000000 00000000 00
ffff9639a63cd780 1537653570 S Bo:1:108:2 -115 31 = 55534243 70000000 00e00100 80000a28 0001cd3d 000000f0 00000000 000000
ffff9639a63cd780 1537653652 C Bo:1:108:2 0 31 >
ffff96391fddd000 1537653658 S Bi:1:108:1 -115 122880 <
ffff96391fddd000 1537660208 C Bi:1:108:1 0 122880 = 7b844759 b0a9281a ccfdd722 0f2373c4 1dc9186e e7cb6e68 8db1f54f bd71c8cf
ffff9639a63cd780 1537660216 S Bi:1:108:1 -115 13 <
ffff9639a63cd780 1537660277 C Bi:1:108:1 0 13 = 55534253 70000000 00000000 00
ffff9639a63cd780 1537660299 S Bo:1:108:2 -115 31 = 55534243 71000000 00200000 80000a28 0001cd3d f0000010 00000000 000000
ffff9639a63cd780 1537660402 C Bo:1:108:2 0 31 >
ffff96399c929e40 1537660431 S Bi:1:108:1 -115 8192 <
ffff96399c929e40 1537661921 C Bi:1:108:1 0 8192 = afd2a21f 517b479c d2a505fa dca14889 8179d352 ca70669a a9680bc6 0025d56d
ffff9639a63cd780 1537661930 S Bi:1:108:1 -115 13 <
ffff9639a63cd780 1537662027 C Bi:1:108:1 0 13 = 55534253 71000000 00000000 00
ffff9639a63cd780 1537662264 S Bo:1:108:2 -115 31 = 55534243 72000000 00e00100 80000a28 0001cd3e 000000f0 00000000 000000
ffff9639a63cd780 1537662403 C Bo:1:108:2 0 31 >
ffff96399c929e40 1537662422 S Bi:1:108:1 -115 122880 <
ffff96399c929e40 1537668853 C Bi:1:108:1 0 122880 = d32fe994 dc24cc01 cf9b16c8 f82e7b07 41744a20 8c68ff12 76c2808a e858bca1
ffff9639a63cd780 1537668879 S Bi:1:108:1 -115 13 <
ffff9639a63cd780 1537669056 C Bi:1:108:1 0 13 = 55534253 72000000 00000000 00
ffff9639a63cd780 1537669104 S Bo:1:108:2 -115 31 = 55534243 73000000 00100000 80000a28 0001cd3e f0000008 00000000 000000
ffff9639a63cd780 1537669152 C Bo:1:108:2 0 31 >
ffff96399c929e40 1537669180 S Bi:1:108:1 -115 4096 <
ffff96399c929e40 1537670042 C Bi:1:108:1 0 4096 = e10f1180 3a5e5411 a28bf88b 4db8ed45 a8818fb7 3f5cd807 a0c10df3 79ac0efa
ffff9639a63cd780 1537670071 S Bi:1:108:1 -115 13 <
ffff9639a63cd780 1537670152 C Bi:1:108:1 0 13 = 55534253 73000000 00000000 00
ffff9639a63cd780 1537670278 S Bo:1:108:2 -115 31 = 55534243 74000000 00000100 80000a28 0001cd3f 00000080 00000000 000000
ffff9639a63cd780 1537670403 C Bo:1:108:2 0 31 >
ffff96399c929e40 1537670439 S Bi:1:108:1 -115 65536 <
ffff96399c929e40 1537674469 C Bi:1:108:1 0 65536 = 7d3c6217 6eabd3a8 c9a59742 d99fd123 c14aaf6a 3e86358e 434be98d c3943940
ffff9639a63cd780 1537674483 S Bi:1:108:1 -115 13 <
ffff9639a63cd780 1537674531 C Bi:1:108:1 0 13 = 55534253 74000000 00000000 00
ffff9639a63cd780 1537674578 S Bo:1:108:2 -115 31 = 55534243 75000000 00d00000 80000a28 0001cd3f 88000068 00000000 000000
ffff9639a63cd780 1537674656 C Bo:1:108:2 0 31 >
ffff96391de053c0 1537674668 S Bi:1:108:1 -115 53248 <
ffff96391de053c0 1537678330 C Bi:1:108:1 0 53248 = 8517c543 1d885b00 587aeb01 b92bf23e db313b63 b29a9ebe ebfd6091 ec6053fb
ffff9639a63cd780 1537678340 S Bi:1:108:1 -115 13 <
ffff9639a63cd780 1537678414 C Bi:1:108:1 0 13 = 55534253 75000000 00000000 00
ffff9639a63cd780 1537678567 S Bo:1:108:2 -115 31 = 55534243 76000000 00100000 80000a28 00000018 00000008 00000000 000000
ffff9639a63cd780 1537678665 C Bo:1:108:2 0 31 >
ffff96391fddd000 1537678675 S Bi:1:108:1 -115 4096 <
ffff96391fddd000 1537679810 C Bi:1:108:1 0 4096 = 00000000 00000000 00000000 00000000 00000000 00000000 00000000 00000000
ffff9639a63cd780 1537679834 S Bi:1:108:1 -115 13 <
ffff9639a63cd780 1537679937 C Bi:1:108:1 0 13 = 55534253 76000000 00000000 00
ffff9639a63cd780 1537680089 S Bo:1:108:2 -115 31 = 55534243 77000000 00000000 00000600 00000000 00000000 00000000 000000
ffff9639a63cd780 1537680152 C Bo:1:108:2 0 31 >
ffff9639a63cd780 1537680168 S Bi:1:108:1 -115 13 <
ffff9639a63cd780 1537680277 C Bi:1:108:1 0 13 = 55534253 77000000 00000000 00
ffff9639a63cd780 1537680366 S Bo:1:108:2 -115 31 = 55534243 78000000 00100000 80000a28 00000000 00000008 00000000 000000
ffff9639a63cd780 1537680402 C Bo:1:108:2 0 31 >
ffff96399c929e40 1537680411 S Bi:1:108:1 -115 4096 <
ffff96399c929e40 1537681292 C Bi:1:108:1 0 4096 = fab80010 8ed0bc00 b0b80000 8ed88ec0 fbbe007c bf0006b9 0002f3a4 ea210600
ffff9639a63cd780 1537681299 S Bi:1:108:1 -115 13 <
ffff9639a63cd780 1537681401 C Bi:1:108:1 0 13 = 55534253 78000000 00000000 00
ffff9639a63cd780 1537681672 S Bo:1:108:2 -115 31 = 55534243 79000000 00000000 00000600 00000000 00000000 00000000 000000
ffff9639a63cd780 1537681781 C Bo:1:108:2 0 31 >
ffff9639a63cd780 1537681798 S Bi:1:108:1 -115 13 <
ffff9639a63cd780 1537681904 C Bi:1:108:1 0 13 = 55534253 79000000 00000000 00
ffff9639a63cd780 1537681959 S Bo:1:108:2 -115 31 = 55534243 7a000000 00000000 00000600 00000000 00000000 00000000 000000
ffff9639a63cd780 1537682030 C Bo:1:108:2 0 31 >
ffff9639a63cd780 1537682036 S Bi:1:108:1 -115 13 <
ffff9639a63cd780 1537682153 C Bi:1:108:1 0 13 = 55534253 7a000000 00000000 00
ffff9639a63cd780 1537704471 S Bo:1:108:2 -115 31 = 55534243 7b000000 00000000 00000600 00000000 00000000 00000000 000000
ffff9639a63cd780 1537704536 C Bo:1:108:2 0 31 >
ffff9639a63cd780 1537704553 S Bi:1:108:1 -115 13 <
ffff9639a63cd780 1537704652 C Bi:1:108:1 0 13 = 55534253 7b000000 00000000 00
ffff9639a63cd780 1537924255 S Bo:1:108:2 -115 31 = 55534243 7c000000 00000000 00000600 00000000 00000000 00000000 000000
ffff9639a63cd780 1537924456 C Bo:1:108:2 0 31 >
ffff9639a63cd780 1537924475 S Bi:1:108:1 -115 13 <
ffff9639a63cd780 1537924559 C Bi:1:108:1 0 13 = 55534253 7c000000 00000000 00
ffff9639a63cd780 1537924748 S Bo:1:108:2 -115 31 = 55534243 7d000000 00020000 80000a28 00000008 00000001 00000000 000000
ffff9639a63cd780 1537924787 C Bo:1:108:2 0 31 >
ffff96391de053c0 1537924801 S Bi:1:108:1 -115 512 <
ffff96391de053c0 1537925938 C Bi:1:108:1 0 512 = eb58906d 6b66732e 66617400 02102000 02000000 00f80000 20004000 00080000
ffff9639a63cd780 1537925953 S Bi:1:108:1 -115 13 <
ffff9639a63cd780 1537926030 C Bi:1:108:1 0 13 = 55534253 7d000000 00000000 00
ffff9639a63cd780 1537926112 S Bo:1:108:2 -115 31 = 55534243 7e000000 00020000 80000a28 00000008 01000001 00000000 000000
ffff9639a63cd780 1537926157 C Bo:1:108:2 0 31 >
ffff96399c929e40 1537926173 S Bi:1:108:1 -115 512 <
ffff96399c929e40 1537926919 C Bi:1:108:1 0 512 = 52526141 00000000 00000000 00000000 00000000 00000000 00000000 00000000
ffff9639a63cd780 1537926930 S Bi:1:108:1 -115 13 <
ffff9639a63cd780 1537927029 C Bi:1:108:1 0 13 = 55534253 7e000000 00000000 00
ffff9639a63cd780 1537927126 S Bo:1:108:2 -115 31 = 55534243 7f000000 00020000 80000a28 00000008 20000001 00000000 000000
ffff9639a63cd780 1537927159 C Bo:1:108:2 0 31 >
ffff96391de053c0 1537927167 S Bi:1:108:1 -115 512 <
ffff96391de053c0 1537927932 C Bi:1:108:1 0 512 = f8ffff0f ffffff0f 98c51000 ffffff0f 00000000 ffffff0f ffffff0f 08000000
ffff9639a63cd780 1537927945 S Bi:1:108:1 -115 13 <
ffff9639a63cd780 1537928033 C Bi:1:108:1 0 13 = 55534253 7f000000 00000000 00
ffff9639a63cd780 1537928101 S Bo:1:108:2 -115 31 = 55534243 80000000 00020000 80000a28 00000029 ab000001 00000000 000000
ffff9639a63cd780 1537928156 C Bo:1:108:2 0 31 >
ffff96391de053c0 1537928164 S Bi:1:108:1 -115 512 <
ffff96391de053c0 1537928918 C Bi:1:108:1 0 512 = 00000000 00000000 00000000 00000000 00000000 00000000 00000000 00000000
ffff9639a63cd780 1537928925 S Bi:1:108:1 -115 13 <
ffff9639a63cd780 1537929028 C Bi:1:108:1 0 13 = 55534253 80000000 00000000 00
ffff9639a63cd780 1537929087 S Bo:1:108:2 -115 31 = 55534243 81000000 00020000 80000a28 0000007b 60000001 00000000 000000
ffff9639a63cd780 1537929155 C Bo:1:108:2 0 31 >
ffff96391de053c0 1537929170 S Bi:1:108:1 -115 512 <
ffff96391de053c0 1537930407 C Bi:1:108:1 0 512 = 54202020 20202020 20202008 0000cd9a 644f644f 0000cd9a 644f0000 00000000
ffff9639a63cd780 1537930417 S Bi:1:108:1 -115 13 <
ffff9639a63cd780 1537930529 C Bi:1:108:1 0 13 = 55534253 81000000 00000000 00
ffff9639a63cd780 1537930589 S Bo:1:108:2 -115 31 = 55534243 82000000 00020000 80000a28 0000007b 61000001 00000000 000000
ffff9639a63cd780 1537930655 C Bo:1:108:2 0 31 >
ffff96399c929e40 1537930665 S Bi:1:108:1 -115 512 <
ffff96399c929e40 1537931919 C Bi:1:108:1 0 512 = 49504320 20202020 20202010 00648ca0 644f644f 07005a54 a34e7a7e 00000000
ffff9639a63cd780 1537931932 S Bi:1:108:1 -115 13 <
ffff9639a63cd780 1537932033 C Bi:1:108:1 0 13 = 55534253 82000000 00000000 00
ffff9639a63cd780 1537932093 S Bo:1:108:2 -115 31 = 55534243 83000000 001c0000 80000a28 0000007b 6200000e 00000000 000000
ffff9639a63cd780 1537932155 C Bo:1:108:2 0 31 >
ffff9637b5ee7f00 1537932167 S Bi:1:108:1 -115 7168 <
ffff9637b5ee7f00 1537934549 C Bi:1:108:1 0 7168 = 4c554255 4e547e32 31305f10 00004576 9a509a50 0b004576 9a506505 00000000
ffff9639a63cd780 1537934561 S Bi:1:108:1 -115 13 <
ffff9639a63cd780 1537934781 C Bi:1:108:1 0 13 = 55534253 83000000 00000000 00
ffff9639a63cd780 1537934886 S Bo:1:108:2 -115 31 = 55534243 84000000 00020000 80000a28 00010cd4 c0000001 00000000 000000
ffff9639a63cd780 1537935026 C Bo:1:108:2 0 31 >
ffff96391fddd000 1537935037 S Bi:1:108:1 -115 512 <
ffff96391fddd000 1537936937 C Bi:1:108:1 0 512 = e5740072 00610063 0065000f 00985f00 76006d00 2e007400 78000000 74000000
ffff9639a63cd780 1537936945 S Bi:1:108:1 -115 13 <
ffff9639a63cd780 1537937054 C Bi:1:108:1 0 13 = 55534253 84000000 00000000 00
ffff9639a63cd780 1537937088 S Bo:1:108:2 -115 31 = 55534243 85000000 00020000 80000a28 00010cd4 c1000001 00000000 000000
ffff9639a63cd780 1537937151 C Bo:1:108:2 0 31 >
ffff96391fddd000 1537937155 S Bi:1:108:1 -115 512 <
ffff96391fddd000 1537938652 C Bi:1:108:1 0 512 = 01770069 006e0064 006f000f 00507700 73005f00 43007200 65000000 61007400
ffff9639a63cd780 1537938657 S Bi:1:108:1 -115 13 <
ffff9639a63cd780 1537938776 C Bi:1:108:1 0 13 = 55534253 85000000 00000000 00
ffff9639a63cd780 1537938796 S Bo:1:108:2 -115 31 = 55534243 86000000 001c0000 80000a28 00010cd4 c200000e 00000000 000000
ffff9639a63cd780 1537938929 C Bo:1:108:2 0 31 >
ffff96391fddd000 1537938937 S Bi:1:108:1 -115 7168 <
ffff96391fddd000 1537940933 C Bi:1:108:1 0 7168 = 01760065 006c006f 0063000f 00796900 64006100 64006500 5f000000 6e006500
ffff9639a63cd780 1537940941 S Bi:1:108:1 -115 13 <
ffff9639a63cd780 1537941027 C Bi:1:108:1 0 13 = 55534253 86000000 00000000 00
ffff9639a63cd780 1537945300 S Bo:1:108:2 -115 31 = 55534243 87000000 00020000 80000a28 00000030 a7000001 00000000 000000
ffff9639a63cd780 1537945410 C Bo:1:108:2 0 31 >
ffff96399c929e40 1537945428 S Bi:1:108:1 -115 512 <
ffff96399c929e40 1537946407 C Bi:1:108:1 0 512 = 81431400 82431400 83431400 84431400 85431400 86431400 87431400 88431400
ffff9639a63cd780 1537946416 S Bi:1:108:1 -115 13 <
ffff9639a63cd780 1537946528 C Bi:1:108:1 0 13 = 55534253 87000000 00000000 00
ffff9639a63cd780 1537946631 S Bo:1:108:2 -115 31 = 55534243 88000000 00020000 80000a28 000144b6 30000001 00000000 000000
ffff9639a63cd780 1537946780 C Bo:1:108:2 0 31 >
ffff96391fddd000 1537946955 S Bi:1:108:1 -115 512 <
ffff96391fddd000 1537948285 C Bi:1:108:1 0 512 = 2e202020 20202020 20202010 0000ea06 64506450 1400ea06 6450af43 00000000
ffff9639a63cd780 1537948295 S Bi:1:108:1 -115 13 <
ffff9639a63cd780 1537948402 C Bi:1:108:1 0 13 = 55534253 88000000 00000000 00
ffff9639a63cd780 1537948434 S Bo:1:108:2 -115 31 = 55534243 89000000 00020000 80000a28 000144b6 31000001 00000000 000000
ffff9639a63cd780 1537948541 C Bo:1:108:2 0 31 >
ffff9637b5ee7f00 1537948547 S Bi:1:108:1 -115 512 <
ffff9637b5ee7f00 1537949540 C Bi:1:108:1 0 512 = 00000000 00000000 00000000 00000000 00000000 00000000 00000000 00000000
ffff9639a63cd780 1537949556 S Bi:1:108:1 -115 13 <
ffff9639a63cd780 1537949651 C Bi:1:108:1 0 13 = 55534253 89000000 00000000 00
ffff9639a63cd780 1537949693 S Bo:1:108:2 -115 31 = 55534243 8a000000 001c0000 80000a28 000144b6 3200000e 00000000 000000
ffff9639a63cd780 1537949787 C Bo:1:108:2 0 31 >
ffff96391fddd000 1537949794 S Bi:1:108:1 -115 7168 <
ffff96391fddd000 1537951296 C Bi:1:108:1 0 7168 = 00000000 00000000 00000000 00000000 00000000 00000000 00000000 00000000
ffff9639a63cd780 1537951303 S Bi:1:108:1 -115 13 <
ffff9639a63cd780 1537951536 C Bi:1:108:1 0 13 = 55534253 8a000000 00000000 00
ffff9639a63cd780 1537951669 S Bo:1:108:2 -115 31 = 55534243 8b000000 00020000 80000a28 00000041 4c000001 00000000 000000
ffff9639a63cd780 1537951778 C Bo:1:108:2 0 31 >
ffff96391fddd000 1537951784 S Bi:1:108:1 -115 512 <
ffff96391fddd000 1537952816 C Bi:1:108:1 0 512 = 01961c00 02961c00 03961c00 04961c00 05961c00 06961c00 07961c00 08961c00
ffff9639a63cd780 1537952824 S Bi:1:108:1 -115 13 <
ffff9639a63cd780 1537952929 C Bi:1:108:1 0 13 = 55534253 8b000000 00000000 00
ffff9639a63cd780 1537952983 S Bo:1:108:2 -115 31 = 55534243 8c000000 00020000 80000a28 000144b6 50000001 00000000 000000
ffff9639a63cd780 1537953029 C Bo:1:108:2 0 31 >
ffff96391fddd000 1537953036 S Bi:1:108:1 -115 512 <
ffff96391fddd000 1537954292 C Bi:1:108:1 0 512 = 2e202020 20202020 20202010 0000ea06 64506450 1400ea06 6450b143 00000000
ffff9639a63cd780 1537954299 S Bi:1:108:1 -115 13 <
ffff9639a63cd780 1537954403 C Bi:1:108:1 0 13 = 55534253 8c000000 00000000 00
ffff9639a63cd780 1537954431 S Bo:1:108:2 -115 31 = 55534243 8d000000 00020000 80000a28 000144b6 51000001 00000000 000000
ffff9639a63cd780 1537954527 C Bo:1:108:2 0 31 >
ffff96399c929e40 1537954536 S Bi:1:108:1 -115 512 <
ffff96399c929e40 1537955429 C Bi:1:108:1 0 512 = 01610073 00730065 006d000f 00166200 6c007900 5f007700 69000000 6e006400
ffff9639a63cd780 1537955439 S Bi:1:108:1 -115 13 <
ffff9639a63cd780 1537955536 C Bi:1:108:1 0 13 = 55534253 8d000000 00000000 00
ffff9639a63cd780 1537955566 S Bo:1:108:2 -115 31 = 55534243 8e000000 001c0000 80000a28 000144b6 5200000e 00000000 000000
ffff9639a63cd780 1537955661 C Bo:1:108:2 0 31 >
ffff9637b5ee7f00 1537955668 S Bi:1:108:1 -115 7168 <
ffff9637b5ee7f00 1537957070 C Bi:1:108:1 0 7168 = e5320030 00310039 005f000f 00e06100 76006100 6c006900 61000000 63006100
ffff9639a63cd780 1537957087 S Bi:1:108:1 -115 13 <
ffff9639a63cd780 1537957305 C Bi:1:108:1 0 13 = 55534253 8e000000 00000000 00
ffff9639a63cd780 1537957384 S Bo:1:108:2 -115 31 = 55534243 8f000000 00020000 80000a28 0001c9de a0000001 00000000 000000
ffff9639a63cd780 1537957529 C Bo:1:108:2 0 31 >
ffff96391fddd000 1537957537 S Bi:1:108:1 -115 512 <
ffff96391fddd000 1537958916 C Bi:1:108:1 0 512 = e5494e31 30497e31 4e5a2020 0000f774 71507e50 14004494 dc4e6e76 d9940b8e
ffff9639a63cd780 1537958921 S Bi:1:108:1 -115 13 <
ffff9639a63cd780 1537959026 C Bi:1:108:1 0 13 = 55534253 8f000000 00000000 00
ffff9639a63cd780 1537959058 S Bo:1:108:2 -115 31 = 55534243 90000000 00020000 80000a28 0001c9de a1000001 00000000 000000
ffff9639a63cd780 1537959151 C Bo:1:108:2 0 31 >
ffff96391fddd000 1537959156 S Bi:1:108:1 -115 512 <
ffff96391fddd000 1537960153 C Bi:1:108:1 0 512 = e5424c20 20202020 42494e20 006430a2 644f7e50 0f007b55 a34e40ae 002ca003
ffff9639a63cd780 1537960158 S Bi:1:108:1 -115 13 <
ffff9639a63cd780 1537960276 C Bi:1:108:1 0 13 = 55534253 90000000 00000000 00
ffff9639a63cd780 1537960297 S Bo:1:108:2 -115 31 = 55534243 91000000 001c0000 80000a28 0001c9de a200000e 00000000 000000
ffff9639a63cd780 1537960401 C Bo:1:108:2 0 31 >
ffff96391fddd000 1537960406 S Bi:1:108:1 -115 7168 <
ffff96391fddd000 1537961794 C Bi:1:108:1 0 7168 = e56e0074 00660073 005f000f 00666500 73007400 75006400 6f000000 2e007400
ffff9639a63cd780 1537961800 S Bi:1:108:1 -115 13 <
ffff9639a63cd780 1537961902 C Bi:1:108:1 0 13 = 55534253 91000000 00000000 00
ffff9639a63cd780 1537962242 S Bo:1:108:2 -115 31 = 55534243 92000000 00020000 80000a28 000144b6 40000001 00000000 000000
ffff9639a63cd780 1537962280 C Bo:1:108:2 0 31 >
ffff96399c929e40 1537962294 S Bi:1:108:1 -115 512 <
ffff96399c929e40 1537963793 C Bi:1:108:1 0 512 = 2e202020 20202020 20202010 0000ea06 64506450 1400ea06 6450b043 00000000
ffff9639a63cd780 1537963799 S Bi:1:108:1 -115 13 <
ffff9639a63cd780 1537963902 C Bi:1:108:1 0 13 = 55534253 92000000 00000000 00
ffff9639a63cd780 1537963928 S Bo:1:108:2 -115 31 = 55534243 93000000 00020000 80000a28 000144b6 41000001 00000000 000000
ffff9639a63cd780 1537964037 C Bo:1:108:2 0 31 >
ffff96391de05840 1537964068 S Bi:1:108:1 -115 512 <
ffff96391de05840 1537964928 C Bi:1:108:1 0 512 = 01610073 00730065 006d000f 00976200 6c007900 5f007700 69000000 6e006400
ffff9639a63cd780 1537964936 S Bi:1:108:1 -115 13 <
ffff9639a63cd780 1537965036 C Bi:1:108:1 0 13 = 55534253 93000000 00000000 00
ffff9639a63cd780 1537965064 S Bo:1:108:2 -115 31 = 55534243 94000000 001c0000 80000a28 000144b6 4200000e 00000000 000000
ffff9639a63cd780 1537965152 C Bo:1:108:2 0 31 >
ffff9637b5ee7f00 1537965163 S Bi:1:108:1 -115 7168 <
ffff9637b5ee7f00 1537966670 C Bi:1:108:1 0 7168 = e54f0043 0045004e 0054000f 00894500 20003200 30003100 39000000 2e007000
ffff9639a63cd780 1537966678 S Bi:1:108:1 -115 13 <
ffff9639a63cd780 1537966786 C Bi:1:108:1 0 13 = 55534253 94000000 00000000 00
ffff9639a63cd780 1537966854 S Bo:1:108:2 -115 31 = 55534243 95000000 00020000 80000a28 0001c9dd 50000001 00000000 000000
ffff9639a63cd780 1537966901 C Bo:1:108:2 0 31 >
ffff96391fddd000 1537966908 S Bi:1:108:1 -115 512 <
ffff96391fddd000 1537969042 C Bi:1:108:1 0 512 = e5720061 00730068 0069000f 00bb6e00 66006f00 0000ffff ffff0000 ffffffff
ffff9639a63cd780 1537969048 S Bi:1:108:1 -115 13 <
ffff9639a63cd780 1537969191 C Bi:1:108:1 0 13 = 55534253 95000000 00000000 00
ffff9639a63cd780 1537969228 S Bo:1:108:2 -115 31 = 55534243 96000000 00020000 80000a28 0001c9dd 51000001 00000000 000000
ffff9639a63cd780 1537969276 C Bo:1:108:2 0 31 >
ffff96391de05840 1537969285 S Bi:1:108:1 -115 512 <
ffff96391de05840 1537971040 C Bi:1:108:1 0 512 = e5660065 0072005f 0077000f 009a6f00 72006b00 2e007400 72000000 61007300
ffff9639a63cd780 1537971046 S Bi:1:108:1 -115 13 <
ffff9639a63cd780 1537971153 C Bi:1:108:1 0 13 = 55534253 96000000 00000000 00
ffff9639a63cd780 1537971185 S Bo:1:108:2 -115 31 = 55534243 97000000 001c0000 80000a28 0001c9dd 5200000e 00000000 000000
ffff9639a63cd780 1537971276 C Bo:1:108:2 0 31 >
ffff96391de05840 1537971280 S Bi:1:108:1 -115 7168 <
ffff96391de05840 1537973309 C Bi:1:108:1 0 7168 = e549006e 00640065 0078000f 00c66500 64004400 42002d00 73000000 74006f00
ffff9639a63cd780 1537973316 S Bi:1:108:1 -115 13 <
ffff9639a63cd780 1537973555 C Bi:1:108:1 0 13 = 55534253 97000000 00000000 00
ffff9639a63cd780 1537973662 S Bo:1:108:2 -115 31 = 55534243 98000000 00020000 80000a28 0000695c c0000001 00000000 000000
ffff9639a63cd780 1537973779 C Bo:1:108:2 0 31 >
ffff9637b5ee7f00 1537973794 S Bi:1:108:1 -115 512 <
ffff9637b5ee7f00 1537974779 C Bi:1:108:1 0 512 = 5b547261 73682049 6e666f5d 0a506174 683d416e 64726f69 642e7a69 700a4465
ffff9639a63cd780 1537974797 S Bi:1:108:1 -115 13 <
ffff9639a63cd780 1537974901 C Bi:1:108:1 0 13 = 55534253 98000000 00000000 00
ffff9639a63cd780 1537975045 S Bo:1:108:2 -115 31 = 55534243 99000000 00020000 80000a28 000066f2 a0000001 00000000 000000
ffff9639a63cd780 1537975154 C Bo:1:108:2 0 31 >
ffff96399c929e40 1537975163 S Bi:1:108:1 -115 512 <
ffff96399c929e40 1537976027 C Bi:1:108:1 0 512 = 5b547261 73682049 6e666f5d 0a506174 683d7665 722f4f53 5f323031 392d3033
ffff9639a63cd780 1537976065 S Bi:1:108:1 -115 13 <
ffff9639a63cd780 1537976151 C Bi:1:108:1 0 13 = 55534253 99000000 00000000 00
ffff9639a63cd780 1537976243 S Bo:1:108:2 -115 31 = 55534243 9a000000 00020000 80000a28 000066f3 a0000001 00000000 000000
ffff9639a63cd780 1537976276 C Bo:1:108:2 0 31 >
ffff96399c929e40 1537976284 S Bi:1:108:1 -115 512 <
ffff96399c929e40 1537977027 C Bi:1:108:1 0 512 = 5b547261 73682049 6e666f5d 0a506174 683d6c75 62756e74 752d3137 2e31305f
ffff9639a63cd780 1537977036 S Bi:1:108:1 -115 13 <
ffff9639a63cd780 1537977150 C Bi:1:108:1 0 13 = 55534253 9a000000 00000000 00
ffff9639a63cd780 1537977231 S Bo:1:108:2 -115 31 = 55534243 9b000000 00020000 80000a28 0000691e c0000001 00000000 000000
ffff9639a63cd780 1537977275 C Bo:1:108:2 0 31 >
ffff96399c929e40 1537977280 S Bi:1:108:1 -115 512 <
ffff96399c929e40 1537978027 C Bi:1:108:1 0 512 = 5b547261 73682049 6e666f5d 0a506174 683d6173 73656d62 6c795f77 696e646f
ffff9639a63cd780 1537978044 S Bi:1:108:1 -115 13 <
ffff9639a63cd780 1537978152 C Bi:1:108:1 0 13 = 55534253 9b000000 00000000 00
ffff9639a63cd780 1537978258 S Bo:1:108:2 -115 31 = 55534243 9c000000 00020000 80000a28 0000691e d0000001 00000000 000000
ffff9639a63cd780 1537978401 C Bo:1:108:2 0 31 >
ffff96399c929e40 1537978420 S Bi:1:108:1 -115 512 <
ffff96399c929e40 1537979027 C Bi:1:108:1 0 512 = 5b547261 73682049 6e666f5d 0a506174 683d6173 73656d62 6c795f77 696e646f
ffff9639a63cd780 1537979045 S Bi:1:108:1 -115 13 <
ffff9639a63cd780 1537979150 C Bi:1:108:1 0 13 = 55534253 9c000000 00000000 00
ffff9639a63cd780 1537979262 S Bo:1:108:2 -115 31 = 55534243 9d000000 00020000 80000a28 000066f2 b0000001 00000000 000000
ffff9639a63cd780 1537979400 C Bo:1:108:2 0 31 >
ffff96399c929e40 1537979420 S Bi:1:108:1 -115 512 <
ffff96399c929e40 1537980402 C Bi:1:108:1 0 512 = 5b547261 73682049 6e666f5d 0a506174 683d6573 636f6c61 25323072 61666165
ffff9639a63cd780 1537980422 S Bi:1:108:1 -115 13 <
ffff9639a63cd780 1537980525 C Bi:1:108:1 0 13 = 55534253 9d000000 00000000 00
ffff9639a63cd780 1537986344 S Bo:1:108:2 -115 31 = 55534243 9e000000 00020000 80000a28 00000008 21000001 00000000 000000
ffff9639a63cd780 1537986407 C Bo:1:108:2 0 31 >
ffff96399c929e40 1537986428 S Bi:1:108:1 -115 512 <
ffff96399c929e40 1537987906 C Bi:1:108:1 0 512 = 81000000 82000000 83000000 84000000 85000000 86000000 87000000 88000000
ffff9639a63cd780 1537987938 S Bi:1:108:1 -115 13 <
ffff9639a63cd780 1537988027 C Bi:1:108:1 0 13 = 55534253 9e000000 00000000 00
ffff9639a63cd780 1537988053 S Bo:1:108:2 -115 31 = 55534243 9f000000 00020000 80000a28 00000008 22000001 00000000 000000
ffff9639a63cd780 1537988151 C Bo:1:108:2 0 31 >
ffff9637b5ee7f00 1537988163 S Bi:1:108:1 -115 512 <
ffff9637b5ee7f00 1537988902 C Bi:1:108:1 0 512 = 01010000 02010000 03010000 04010000 05010000 06010000 07010000 08010000
ffff9639a63cd780 1537988929 S Bi:1:108:1 -115 13 <
ffff9639a63cd780 1537989026 C Bi:1:108:1 0 13 = 55534253 9f000000 00000000 00
ffff9639a63cd780 1537989059 S Bo:1:108:2 -115 31 = 55534243 a0000000 00e00100 80000a28 00000008 230000f0 00000000 000000
ffff9639a63cd780 1537989150 C Bo:1:108:2 0 31 >
ffff96399c929e40 1537989169 S Bi:1:108:1 -115 122880 <
ffff96399c929e40 1537995338 C Bi:1:108:1 0 122880 = 81010000 82010000 83010000 84010000 85010000 86010000 87010000 88010000
ffff9639a63cd780 1537995386 S Bi:1:108:1 -115 13 <
ffff9639a63cd780 1537995527 C Bi:1:108:1 0 13 = 55534253 a0000000 00000000 00
ffff9639a63cd780 1537995654 S Bo:1:108:2 -115 31 = 55534243 a1000000 001a0000 80000a28 00000009 1300000d 00000000 000000
ffff9639a63cd780 1537995778 C Bo:1:108:2 0 31 >
ffff96391fddd000 1537995795 S Bi:1:108:1 -115 6656 <
ffff96391fddd000 1537996668 C Bi:1:108:1 0 6656 = 00000000 00000000 00000000 00000000 00000000 00000000 00000000 00000000
ffff9639a63cd780 1537996687 S Bi:1:108:1 -115 13 <
ffff9639a63cd780 1537996790 C Bi:1:108:1 0 13 = 55534253 a1000000 00000000 00
ffff9639a63cd780 1537996883 S Bo:1:108:2 -115 31 = 55534243 a2000000 00020000 80000a28 00000009 20000001 00000000 000000
ffff9639a63cd780 1537997040 C Bo:1:108:2 0 31 >
ffff96391fddd000 1537997046 S Bi:1:108:1 -115 512 <
ffff96391fddd000 1537997792 C Bi:1:108:1 0 512 = 00000000 00000000 00000000 00000000 00000000 00000000 00000000 00000000
ffff9639a63cd780 1537997798 S Bi:1:108:1 -115 13 <
ffff9639a63cd780 1537997915 C Bi:1:108:1 0 13 = 55534253 a2000000 00000000 00
ffff9639a63cd780 1537997935 S Bo:1:108:2 -115 31 = 55534243 a3000000 00020000 80000a28 00000009 21000001 00000000 000000
ffff9639a63cd780 1537998025 C Bo:1:108:2 0 31 >
ffff96391fddd000 1537998030 S Bi:1:108:1 -115 512 <
ffff96391fddd000 1537998776 C Bi:1:108:1 0 512 = 00000000 00000000 00000000 00000000 00000000 00000000 00000000 00000000
ffff9639a63cd780 1537998779 S Bi:1:108:1 -115 13 <
ffff9639a63cd780 1537998900 C Bi:1:108:1 0 13 = 55534253 a3000000 00000000 00
ffff9639a63cd780 1537998924 S Bo:1:108:2 -115 31 = 55534243 a4000000 00e00100 80000a28 00000009 220000f0 00000000 000000
ffff9639a63cd780 1537999025 C Bo:1:108:2 0 31 >
ffff96391fddd000 1537999029 S Bi:1:108:1 -115 122880 <
ffff96391fddd000 1538005082 C Bi:1:108:1 0 122880 = 00000000 00000000 00000000 00000000 00000000 00000000 00000000 00000000
ffff9639a63cd780 1538005149 S Bi:1:108:1 -115 13 <
ffff9639a63cd780 1538005278 C Bi:1:108:1 0 13 = 55534253 a4000000 00000000 00
ffff9639a63cd780 1538005412 S Bo:1:108:2 -115 31 = 55534243 a5000000 001c0000 80000a28 0000000a 1200000e 00000000 000000
ffff9639a63cd780 1538005529 C Bo:1:108:2 0 31 >
ffff96391fddd000 1538005551 S Bi:1:108:1 -115 7168 <
ffff96391fddd000 1538006539 C Bi:1:108:1 0 7168 = 00000000 00000000 00000000 00000000 00000000 00000000 00000000 00000000
ffff9639a63cd780 1538006582 S Bi:1:108:1 -115 13 <
ffff9639a63cd780 1538006652 C Bi:1:108:1 0 13 = 55534253 a5000000 00000000 00
ffff9639a63cd780 1538006732 S Bo:1:108:2 -115 31 = 55534243 a6000000 00020000 80000a28 0000000a 20000001 00000000 000000
ffff9639a63cd780 1538006778 C Bo:1:108:2 0 31 >
ffff96391fddd000 1538006790 S Bi:1:108:1 -115 512 <
ffff96391fddd000 1538007530 C Bi:1:108:1 0 512 = 00000000 00000000 00000000 00000000 00000000 00000000 00000000 00000000
ffff9639a63cd780 1538007561 S Bi:1:108:1 -115 13 <
ffff9639a63cd780 1538007651 C Bi:1:108:1 0 13 = 55534253 a6000000 00000000 00
ffff9639a63cd780 1538007676 S Bo:1:108:2 -115 31 = 55534243 a7000000 00020000 80000a28 0000000a 21000001 00000000 000000
ffff9639a63cd780 1538007778 C Bo:1:108:2 0 31 >
ffff96391fddd000 1538007806 S Bi:1:108:1 -115 512 <
ffff96391fddd000 1538008533 C Bi:1:108:1 0 512 = 00000000 00000000 00000000 00000000 00000000 00000000 00000000 00000000
ffff9639a63cd780 1538008568 S Bi:1:108:1 -115 13 <
ffff9639a63cd780 1538008654 C Bi:1:108:1 0 13 = 55534253 a7000000 00000000 00
ffff9639a63cd780 1538008702 S Bo:1:108:2 -115 31 = 55534243 a8000000 00e00100 80000a28 0000000a 220000f0 00000000 000000
ffff9639a63cd780 1538008779 C Bo:1:108:2 0 31 >
ffff96399c929d80 1538008793 S Bi:1:108:1 -115 122880 <
ffff96399c929d80 1538014953 C Bi:1:108:1 0 122880 = 00000000 00000000 00000000 00000000 00000000 00000000 00000000 00000000
ffff9639a63cd780 1538014972 S Bi:1:108:1 -115 13 <
ffff9639a63cd780 1538015026 C Bi:1:108:1 0 13 = 55534253 a8000000 00000000 00
ffff9639a63cd780 1538015158 S Bo:1:108:2 -115 31 = 55534243 a9000000 001c0000 80000a28 0000000b 1200000e 00000000 000000
ffff9639a63cd780 1538015278 C Bo:1:108:2 0 31 >
ffff96391de05840 1538015295 S Bi:1:108:1 -115 7168 <
ffff96391de05840 1538016161 C Bi:1:108:1 0 7168 = 00000000 00000000 00000000 00000000 00000000 00000000 00000000 00000000
ffff9639a63cd780 1538016170 S Bi:1:108:1 -115 13 <
ffff9639a63cd780 1538016280 C Bi:1:108:1 0 13 = 55534253 a9000000 00000000 00
ffff9639a63cd780 1538016386 S Bo:1:108:2 -115 31 = 55534243 aa000000 00020000 80000a28 0000000b 20000001 00000000 000000
ffff9639a63cd780 1538016528 C Bo:1:108:2 0 31 >
ffff96391fddd000 1538016536 S Bi:1:108:1 -115 512 <
ffff96391fddd000 1538017286 C Bi:1:108:1 0 512 = 00000000 00000000 00000000 00000000 00000000 00000000 00000000 00000000
ffff9639a63cd780 1538017295 S Bi:1:108:1 -115 13 <
ffff9639a63cd780 1538017402 C Bi:1:108:1 0 13 = 55534253 aa000000 00000000 00
ffff9639a63cd780 1538017462 S Bo:1:108:2 -115 31 = 55534243 ab000000 00020000 80000a28 0000000b 21000001 00000000 000000
ffff9639a63cd780 1538017527 C Bo:1:108:2 0 31 >
ffff96391fddd000 1538017533 S Bi:1:108:1 -115 512 <
ffff96391fddd000 1538018279 C Bi:1:108:1 0 512 = 00000000 00000000 00000000 00000000 00000000 00000000 00000000 00000000
ffff9639a63cd780 1538018287 S Bi:1:108:1 -115 13 <
ffff9639a63cd780 1538018406 C Bi:1:108:1 0 13 = 55534253 ab000000 00000000 00
ffff9639a63cd780 1538018433 S Bo:1:108:2 -115 31 = 55534243 ac000000 00e00100 80000a28 0000000b 220000f0 00000000 000000
ffff9639a63cd780 1538018528 C Bo:1:108:2 0 31 >
ffff96391fddd000 1538018534 S Bi:1:108:1 -115 122880 <
ffff96391fddd000 1538024735 C Bi:1:108:1 0 122880 = 00000000 00000000 00000000 00000000 00000000 00000000 00000000 00000000
ffff9639a63cd780 1538024750 S Bi:1:108:1 -115 13 <
ffff9639a63cd780 1538024912 C Bi:1:108:1 0 13 = 55534253 ac000000 00000000 00
ffff9639a63cd780 1538025092 S Bo:1:108:2 -115 31 = 55534243 ad000000 001c0000 80000a28 0000000c 1200000e 00000000 000000
ffff9639a63cd780 1538025152 C Bo:1:108:2 0 31 >
ffff9637b5ee7f00 1538025183 S Bi:1:108:1 -115 7168 <
ffff9637b5ee7f00 1538026185 C Bi:1:108:1 0 7168 = 01f90100 02f90100 03f90100 04f90100 05f90100 06f90100 07f90100 08f90100
ffff9639a63cd780 1538026195 S Bi:1:108:1 -115 13 <
ffff9639a63cd780 1538026277 C Bi:1:108:1 0 13 = 55534253 ad000000 00000000 00
ffff9639a63cd780 1538026368 S Bo:1:108:2 -115 31 = 55534243 ae000000 00020000 80000a28 0000000c 20000001 00000000 000000
ffff9639a63cd780 1538026403 C Bo:1:108:2 0 31 >
ffff9637b5f9ac00 1538026422 S Bi:1:108:1 -115 512 <
ffff9637b5f9ac00 1538027168 C Bi:1:108:1 0 512 = 01000200 02000200 03000200 04000200 05000200 06000200 07000200 08000200
ffff9639a63cd780 1538027176 S Bi:1:108:1 -115 13 <
ffff9639a63cd780 1538027276 C Bi:1:108:1 0 13 = 55534253 ae000000 00000000 00
ffff9639a63cd780 1538027303 S Bo:1:108:2 -115 31 = 55534243 af000000 00020000 80000a28 0000000c 21000001 00000000 000000
ffff9639a63cd780 1538027402 C Bo:1:108:2 0 31 >
ffff9637b5ee7300 1538027410 S Bi:1:108:1 -115 512 <
ffff9637b5ee7300 1538028162 C Bi:1:108:1 0 512 = 81000200 82000200 83000200 84000200 85000200 86000200 87000200 88000200
ffff9639a63cd780 1538028170 S Bi:1:108:1 -115 13 <
ffff9639a63cd780 1538028304 C Bi:1:108:1 0 13 = 55534253 af000000 00000000 00
ffff9639a63cd780 1538028342 S Bo:1:108:2 -115 31 = 55534243 b0000000 00e00100 80000a28 0000000c 220000f0 00000000 000000
ffff9639a63cd780 1538028401 C Bo:1:108:2 0 31 >
ffff96391fddd000 1538028407 S Bi:1:108:1 -115 122880 <
ffff96391fddd000 1538034605 C Bi:1:108:1 0 122880 = 01010200 02010200 03010200 04010200 05010200 06010200 07010200 08010200
ffff9639a63cd780 1538034614 S Bi:1:108:1 -115 13 <
ffff9639a63cd780 1538034650 C Bi:1:108:1 0 13 = 55534253 b0000000 00000000 00
ffff9639a63cd780 1538034802 S Bo:1:108:2 -115 31 = 55534243 b1000000 001c0000 80000a28 0000000d 1200000e 00000000 000000
ffff9639a63cd780 1538034903 C Bo:1:108:2 0 31 >
ffff96391fddd000 1538034920 S Bi:1:108:1 -115 7168 <
ffff96391fddd000 1538035920 C Bi:1:108:1 0 7168 = 01790200 02790200 03790200 04790200 05790200 06790200 07790200 08790200
ffff9639a63cd780 1538035928 S Bi:1:108:1 -115 13 <
ffff9639a63cd780 1538036054 C Bi:1:108:1 0 13 = 55534253 b1000000 00000000 00
ffff9639a63cd780 1538036155 S Bo:1:108:2 -115 31 = 55534243 b2000000 00020000 80000a28 0000000d 20000001 00000000 000000
ffff9639a63cd780 1538036280 C Bo:1:108:2 0 31 >
ffff96391fddd900 1538036291 S Bi:1:108:1 -115 512 <
ffff96391fddd900 1538037042 C Bi:1:108:1 0 512 = 01800200 02800200 03800200 04800200 05800200 06800200 07800200 08800200
ffff9639a63cd780 1538037049 S Bi:1:108:1 -115 13 <
ffff9639a63cd780 1538037151 C Bi:1:108:1 0 13 = 55534253 b2000000 00000000 00
ffff9639a63cd780 1538037179 S Bo:1:108:2 -115 31 = 55534243 b3000000 00020000 80000a28 0000000d 21000001 00000000 000000
ffff9639a63cd780 1538037278 C Bo:1:108:2 0 31 >
ffff96391de05840 1538037285 S Bi:1:108:1 -115 512 <
ffff96391de05840 1538038040 C Bi:1:108:1 0 512 = 81800200 82800200 83800200 84800200 85800200 86800200 87800200 88800200
ffff9639a63cd780 1538038045 S Bi:1:108:1 -115 13 <
ffff9639a63cd780 1538038151 C Bi:1:108:1 0 13 = 55534253 b3000000 00000000 00
ffff9639a63cd780 1538038172 S Bo:1:108:2 -115 31 = 55534243 b4000000 00e00100 80000a28 0000000d 220000f0 00000000 000000
ffff9639a63cd780 1538038277 C Bo:1:108:2 0 31 >
ffff96391de05840 1538038284 S Bi:1:108:1 -115 122880 <
ffff96391de05840 1538044366 C Bi:1:108:1 0 122880 = 01810200 02810200 03810200 04810200 05810200 06810200 07810200 08810200
ffff9639a63cd780 1538044376 S Bi:1:108:1 -115 13 <
ffff9639a63cd780 1538044557 C Bi:1:108:1 0 13 = 55534253 b4000000 00000000 00
ffff9639a63cd780 1538044698 S Bo:1:108:2 -115 31 = 55534243 b5000000 001c0000 80000a28 0000000e 1200000e 00000000 000000
ffff9639a63cd780 1538044777 C Bo:1:108:2 0 31 >
ffff9637b5ee7300 1538044787 S Bi:1:108:1 -115 7168 <
ffff9637b5ee7300 1538045812 C Bi:1:108:1 0 7168 = 01f90200 02f90200 03f90200 04f90200 05f90200 06f90200 07f90200 08f90200
ffff9639a63cd780 1538045822 S Bi:1:108:1 -115 13 <
ffff9639a63cd780 1538045904 C Bi:1:108:1 0 13 = 55534253 b5000000 00000000 00
ffff9639a63cd780 1538045997 S Bo:1:108:2 -115 31 = 55534243 b6000000 00020000 80000a28 0000000e 20000001 00000000 000000
ffff9639a63cd780 1538046031 C Bo:1:108:2 0 31 >
ffff9637b5f9ac00 1538046052 S Bi:1:108:1 -115 512 <
ffff9637b5f9ac00 1538046793 C Bi:1:108:1 0 512 = 01000300 02000300 03000300 04000300 05000300 06000300 07000300 08000300
ffff9639a63cd780 1538046803 S Bi:1:108:1 -115 13 <
ffff9639a63cd780 1538046902 C Bi:1:108:1 0 13 = 55534253 b6000000 00000000 00
ffff9639a63cd780 1538046934 S Bo:1:108:2 -115 31 = 55534243 b7000000 00020000 80000a28 0000000e 21000001 00000000 000000
ffff9639a63cd780 1538047027 C Bo:1:108:2 0 31 >
ffff96391de05840 1538047034 S Bi:1:108:1 -115 512 <
ffff96391de05840 1538047790 C Bi:1:108:1 0 512 = 81000300 82000300 83000300 84000300 85000300 86000300 87000300 88000300
ffff9639a63cd780 1538047795 S Bi:1:108:1 -115 13 <
ffff9639a63cd780 1538047901 C Bi:1:108:1 0 13 = 55534253 b7000000 00000000 00
ffff9639a63cd780 1538047929 S Bo:1:108:2 -115 31 = 55534243 b8000000 00e00100 80000a28 0000000e 220000f0 00000000 000000
ffff9639a63cd780 1538048028 C Bo:1:108:2 0 31 >
ffff9637b5ee7300 1538048039 S Bi:1:108:1 -115 122880 <
ffff9637b5ee7300 1538054227 C Bi:1:108:1 0 122880 = 01010300 02010300 03010300 04010300 05010300 06010300 07010300 08010300
ffff9639a63cd780 1538054235 S Bi:1:108:1 -115 13 <
ffff9639a63cd780 1538054275 C Bi:1:108:1 0 13 = 55534253 b8000000 00000000 00
ffff9639a63cd780 1538054389 S Bo:1:108:2 -115 31 = 55534243 b9000000 001c0000 80000a28 0000000f 1200000e 00000000 000000
ffff9639a63cd780 1538054537 C Bo:1:108:2 0 31 >
ffff96391fddd900 1538054561 S Bi:1:108:1 -115 7168 <
ffff96391fddd900 1538055431 C Bi:1:108:1 0 7168 = 01790300 02790300 03790300 04790300 05790300 06790300 07790300 08790300
ffff9639a63cd780 1538055442 S Bi:1:108:1 -115 13 <
ffff9639a63cd780 1538055554 C Bi:1:108:1 0 13 = 55534253 b9000000 00000000 00
ffff9639a63cd780 1538055668 S Bo:1:108:2 -115 31 = 55534243 ba000000 00020000 80000a28 0000000f 20000001 00000000 000000
ffff9639a63cd780 1538055779 C Bo:1:108:2 0 31 >
ffff96391fddd000 1538055795 S Bi:1:108:1 -115 512 <
ffff96391fddd000 1538056554 C Bi:1:108:1 0 512 = 01800300 02800300 03800300 04800300 05800300 06800300 07800300 08800300
ffff9639a63cd780 1538056564 S Bi:1:108:1 -115 13 <
ffff9639a63cd780 1538056679 C Bi:1:108:1 0 13 = 55534253 ba000000 00000000 00
ffff9639a63cd780 1538056720 S Bo:1:108:2 -115 31 = 55534243 bb000000 00020000 80000a28 0000000f 21000001 00000000 000000
ffff9639a63cd780 1538056813 C Bo:1:108:2 0 31 >
ffff96391de05840 1538056821 S Bi:1:108:1 -115 512 <
ffff96391de05840 1538057540 C Bi:1:108:1 0 512 = 81800300 82800300 83800300 84800300 85800300 86800300 87800300 88800300
ffff9639a63cd780 1538057548 S Bi:1:108:1 -115 13 <
ffff9639a63cd780 1538057661 C Bi:1:108:1 0 13 = 55534253 bb000000 00000000 00
ffff9639a63cd780 1538057691 S Bo:1:108:2 -115 31 = 55534243 bc000000 00e00100 80000a28 0000000f 220000f0 00000000 000000
ffff9639a63cd780 1538057777 C Bo:1:108:2 0 31 >
ffff9637b5ee7300 1538057784 S Bi:1:108:1 -115 122880 <
ffff9637b5ee7300 1538063978 C Bi:1:108:1 0 122880 = 01810300 02810300 03810300 04810300 05810300 06810300 07810300 08810300
ffff9639a63cd780 1538064016 S Bi:1:108:1 -115 13 <
ffff9639a63cd780 1538064181 C Bi:1:108:1 0 13 = 55534253 bc000000 00000000 00
ffff9639a63cd780 1538064291 S Bo:1:108:2 -115 31 = 55534243 bd000000 001c0000 80000a28 00000010 1200000e 00000000 000000
ffff9639a63cd780 1538064403 C Bo:1:108:2 0 31 >
ffff96391fddd000 1538064426 S Bi:1:108:1 -115 7168 <
ffff96391fddd000 1538065434 C Bi:1:108:1 0 7168 = 01f90300 02f90300 03f90300 04f90300 05f90300 06f90300 07f90300 08f90300
ffff9639a63cd780 1538065442 S Bi:1:108:1 -115 13 <
ffff9639a63cd780 1538065527 C Bi:1:108:1 0 13 = 55534253 bd000000 00000000 00
ffff9639a63cd780 1538065626 S Bo:1:108:2 -115 31 = 55534243 be000000 00020000 80000a28 00000010 20000001 00000000 000000
ffff9639a63cd780 1538065655 C Bo:1:108:2 0 31 >
ffff9637b5ee7300 1538065668 S Bi:1:108:1 -115 512 <
ffff9637b5ee7300 1538066417 C Bi:1:108:1 0 512 = 01000400 02000400 03000400 04000400 05000400 06000400 07000400 08000400
ffff9639a63cd780 1538066430 S Bi:1:108:1 -115 13 <
ffff9639a63cd780 1538066554 C Bi:1:108:1 0 13 = 55534253 be000000 00000000 00
ffff9639a63cd780 1538066606 S Bo:1:108:2 -115 31 = 55534243 bf000000 00020000 80000a28 00000010 21000001 00000000 000000
ffff9639a63cd780 1538066666 C Bo:1:108:2 0 31 >
ffff9637b5ee7300 1538066682 S Bi:1:108:1 -115 512 <
ffff9637b5ee7300 1538067415 C Bi:1:108:1 0 512 = 81000400 82000400 83000400 84000400 85000400 86000400 87000400 88000400
ffff9639a63cd780 1538067431 S Bi:1:108:1 -115 13 <
ffff9639a63cd780 1538067527 C Bi:1:108:1 0 13 = 55534253 bf000000 00000000 00
ffff9639a63cd780 1538067560 S Bo:1:108:2 -115 31 = 55534243 c0000000 00e00100 80000a28 00000010 220000f0 00000000 000000
ffff9639a63cd780 1538067652 C Bo:1:108:2 0 31 >
ffff96391fddd900 1538067670 S Bi:1:108:1 -115 122880 <
ffff96391fddd900 1538073839 C Bi:1:108:1 0 122880 = 01010400 02010400 03010400 04010400 05010400 06010400 07010400 08010400
ffff9639a63cd780 1538073845 S Bi:1:108:1 -115 13 <
ffff9639a63cd780 1538073913 C Bi:1:108:1 0 13 = 55534253 c0000000 00000000 00
ffff9639a63cd780 1538074046 S Bo:1:108:2 -115 31 = 55534243 c1000000 001c0000 80000a28 00000011 1200000e 00000000 000000
ffff9639a63cd780 1538074164 C Bo:1:108:2 0 31 >
ffff96391fddd900 1538074199 S Bi:1:108:1 -115 7168 <
ffff96391fddd900 1538075171 C Bi:1:108:1 0 7168 = 01790400 02790400 03790400 04790400 05790400 06790400 07790400 08790400
ffff9639a63cd780 1538075207 S Bi:1:108:1 -115 13 <
ffff9639a63cd780 1538075305 C Bi:1:108:1 0 13 = 55534253 c1000000 00000000 00
ffff9639a63cd780 1538075412 S Bo:1:108:2 -115 31 = 55534243 c2000000 00020000 80000a28 00000011 20000001 00000000 000000
ffff9639a63cd780 1538075531 C Bo:1:108:2 0 31 >
ffff96391fddd900 1538075563 S Bi:1:108:1 -115 512 <
ffff96391fddd900 1538076296 C Bi:1:108:1 0 512 = 01800400 02800400 03800400 04800400 05800400 06800400 07800400 08800400
ffff9639a63cd780 1538076312 S Bi:1:108:1 -115 13 <
ffff9639a63cd780 1538076433 C Bi:1:108:1 0 13 = 55534253 c2000000 00000000 00
ffff9639a63cd780 1538076469 S Bo:1:108:2 -115 31 = 55534243 c3000000 00020000 80000a28 00000011 21000001 00000000 000000
ffff9639a63cd780 1538076529 C Bo:1:108:2 0 31 >
ffff96391de05840 1538076539 S Bi:1:108:1 -115 512 <
ffff96391de05840 1538077293 C Bi:1:108:1 0 512 = 81800400 82800400 83800400 84800400 85800400 86800400 87800400 88800400
ffff9639a63cd780 1538077314 S Bi:1:108:1 -115 13 <
ffff9639a63cd780 1538077428 C Bi:1:108:1 0 13 = 55534253 c3000000 00000000 00
ffff9639a63cd780 1538077452 S Bo:1:108:2 -115 31 = 55534243 c4000000 00e00100 80000a28 00000011 220000f0 00000000 000000
ffff9639a63cd780 1538077527 C Bo:1:108:2 0 31 >
ffff96391de05840 1538077533 S Bi:1:108:1 -115 122880 <
ffff96391de05840 1538083700 C Bi:1:108:1 0 122880 = 01810400 02810400 03810400 04810400 05810400 06810400 07810400 08810400
ffff9639a63cd780 1538083706 S Bi:1:108:1 -115 13 <
ffff9639a63cd780 1538083787 C Bi:1:108:1 0 13 = 55534253 c4000000 00000000 00
ffff9639a63cd780 1538083896 S Bo:1:108:2 -115 31 = 55534243 c5000000 001c0000 80000a28 00000012 1200000e 00000000 000000
ffff9639a63cd780 1538084026 C Bo:1:108:2 0 31 >
ffff9637b5ee7300 1538084042 S Bi:1:108:1 -115 7168 <
ffff9637b5ee7300 1538084921 C Bi:1:108:1 0 7168 = 01f90400 02f90400 03f90400 04f90400 05f90400 06f90400 07f90400 08f90400
ffff9639a63cd780 1538084930 S Bi:1:108:1 -115 13 <
ffff9639a63cd780 1538085026 C Bi:1:108:1 0 13 = 55534253 c5000000 00000000 00
ffff9639a63cd780 1538085096 S Bo:1:108:2 -115 31 = 55534243 c6000000 00020000 80000a28 00000012 20000001 00000000 000000
ffff9639a63cd780 1538085152 C Bo:1:108:2 0 31 >
ffff9637b5f9ac00 1538085173 S Bi:1:108:1 -115 512 <
ffff9637b5f9ac00 1538085918 C Bi:1:108:1 0 512 = 01000500 02000500 03000500 04000500 05000500 06000500 07000500 08000500
ffff9639a63cd780 1538085928 S Bi:1:108:1 -115 13 <
ffff9639a63cd780 1538086026 C Bi:1:108:1 0 13 = 55534253 c6000000 00000000 00
ffff9639a63cd780 1538086055 S Bo:1:108:2 -115 31 = 55534243 c7000000 00020000 80000a28 00000012 21000001 00000000 000000
ffff9639a63cd780 1538086153 C Bo:1:108:2 0 31 >
ffff9637b5ee7f00 1538086162 S Bi:1:108:1 -115 512 <
ffff9637b5ee7f00 1538086928 C Bi:1:108:1 0 512 = 81000500 82000500 83000500 84000500 85000500 86000500 87000500 88000500
ffff9639a63cd780 1538086936 S Bi:1:108:1 -115 13 <
ffff9639a63cd780 1538087054 C Bi:1:108:1 0 13 = 55534253 c7000000 00000000 00
ffff9639a63cd780 1538087105 S Bo:1:108:2 -115 31 = 55534243 c8000000 00e00100 80000a28 00000012 220000f0 00000000 000000
ffff9639a63cd780 1538087152 C Bo:1:108:2 0 31 >
ffff96391fddd000 1538087159 S Bi:1:108:1 -115 122880 <
ffff96391fddd000 1538093344 C Bi:1:108:1 0 122880 = 01010500 02010500 03010500 04010500 05010500 06010500 07010500 08010500
ffff9639a63cd780 1538093354 S Bi:1:108:1 -115 13 <
ffff9639a63cd780 1538093403 C Bi:1:108:1 0 13 = 55534253 c8000000 00000000 00
ffff9639a63cd780 1538093514 S Bo:1:108:2 -115 31 = 55534243 c9000000 001c0000 80000a28 00000013 1200000e 00000000 000000
ffff9639a63cd780 1538093654 C Bo:1:108:2 0 31 >
ffff96391fddd000 1538093677 S Bi:1:108:1 -115 7168 <
ffff96391fddd000 1538094671 C Bi:1:108:1 0 7168 = 01790500 02790500 03790500 04790500 05790500 06790500 07790500 08790500
ffff9639a63cd780 1538094682 S Bi:1:108:1 -115 13 <
ffff9639a63cd780 1538094814 C Bi:1:108:1 0 13 = 55534253 c9000000 00000000 00
ffff9639a63cd780 1538094902 S Bo:1:108:2 -115 31 = 55534243 ca000000 00020000 80000a28 00000013 20000001 00000000 000000
ffff9639a63cd780 1538095027 C Bo:1:108:2 0 31 >
ffff9637b5f9ac00 1538095044 S Bi:1:108:1 -115 512 <
ffff9637b5f9ac00 1538095791 C Bi:1:108:1 0 512 = 01800500 02800500 03800500 04800500 05800500 06800500 07800500 08800500
ffff9639a63cd780 1538095811 S Bi:1:108:1 -115 13 <
ffff9639a63cd780 1538095902 C Bi:1:108:1 0 13 = 55534253 ca000000 00000000 00
ffff9639a63cd780 1538095940 S Bo:1:108:2 -115 31 = 55534243 cb000000 00020000 80000a28 00000013 21000001 00000000 000000
ffff9639a63cd780 1538096027 C Bo:1:108:2 0 31 >
ffff96391de05840 1538096035 S Bi:1:108:1 -115 512 <
ffff96391de05840 1538096790 C Bi:1:108:1 0 512 = 81800500 82800500 83800500 84800500 85800500 86800500 87800500 88800500
ffff9639a63cd780 1538096796 S Bi:1:108:1 -115 13 <
ffff9639a63cd780 1538096901 C Bi:1:108:1 0 13 = 55534253 cb000000 00000000 00
ffff9639a63cd780 1538096929 S Bo:1:108:2 -115 31 = 55534243 cc000000 00e00100 80000a28 00000013 220000f0 00000000 000000
ffff9639a63cd780 1538097027 C Bo:1:108:2 0 31 >
ffff96391fddd000 1538097034 S Bi:1:108:1 -115 122880 <
ffff96391fddd000 1538103228 C Bi:1:108:1 0 122880 = 01810500 02810500 03810500 04810500 05810500 06810500 07810500 08810500
ffff9639a63cd780 1538103235 S Bi:1:108:1 -115 13 <
ffff9639a63cd780 1538103276 C Bi:1:108:1 0 13 = 55534253 cc000000 00000000 00
ffff9639a63cd780 1538103386 S Bo:1:108:2 -115 31 = 55534243 cd000000 001c0000 80000a28 00000014 1200000e 00000000 000000
ffff9639a63cd780 1538103529 C Bo:1:108:2 0 31 >
ffff9637b5f9ac00 1538103545 S Bi:1:108:1 -115 7168 <
ffff9637b5f9ac00 1538104419 C Bi:1:108:1 0 7168 = 01f90500 02f90500 03f90500 04f90500 05f90500 06f90500 07f90500 08f90500
ffff9639a63cd780 1538104460 S Bi:1:108:1 -115 13 <
ffff9639a63cd780 1538104527 C Bi:1:108:1 0 13 = 55534253 cd000000 00000000 00
ffff9639a63cd780 1538104614 S Bo:1:108:2 -115 31 = 55534243 ce000000 00020000 80000a28 00000014 20000001 00000000 000000
ffff9639a63cd780 1538104655 C Bo:1:108:2 0 31 >
ffff96391fddd000 1538104672 S Bi:1:108:1 -115 512 <
ffff96391fddd000 1538105416 C Bi:1:108:1 0 512 = 01000600 02000600 03000600 04000600 05000600 06000600 07000600 08000600
ffff9639a63cd780 1538105425 S Bi:1:108:1 -115 13 <
ffff9639a63cd780 1538105526 C Bi:1:108:1 0 13 = 55534253 ce000000 00000000 00
ffff9639a63cd780 1538105571 S Bo:1:108:2 -115 31 = 55534243 cf000000 00020000 80000a28 00000014 21000001 00000000 000000
ffff9639a63cd780 1538105653 C Bo:1:108:2 0 31 >
ffff96391de05840 1538105659 S Bi:1:108:1 -115 512 <
ffff96391de05840 1538106416 C Bi:1:108:1 0 512 = 81000600 82000600 83000600 84000600 85000600 86000600 87000600 88000600
ffff9639a63cd780 1538106422 S Bi:1:108:1 -115 13 <
ffff9639a63cd780 1538106527 C Bi:1:108:1 0 13 = 55534253 cf000000 00000000 00
ffff9639a63cd780 1538106553 S Bo:1:108:2 -115 31 = 55534243 d0000000 00e00100 80000a28 00000014 220000f0 00000000 000000
ffff9639a63cd780 1538106652 C Bo:1:108:2 0 31 >
ffff96391de05840 1538106659 S Bi:1:108:1 -115 122880 <
ffff96391de05840 1538112840 C Bi:1:108:1 0 122880 = 01010600 02010600 03010600 04010600 05010600 06010600 07010600 08010600
ffff9639a63cd780 1538112848 S Bi:1:108:1 -115 13 <
ffff9639a63cd780 1538112906 C Bi:1:108:1 0 13 = 55534253 d0000000 00000000 00
ffff9639a63cd780 1538113020 S Bo:1:108:2 -115 31 = 55534243 d1000000 001c0000 80000a28 00000015 1200000e 00000000 000000
ffff9639a63cd780 1538113152 C Bo:1:108:2 0 31 >
ffff9637b5ee7f00 1538113170 S Bi:1:108:1 -115 7168 <
ffff9637b5ee7f00 1538114059 C Bi:1:108:1 0 7168 = 01790600 02790600 03790600 04790600 05790600 06790600 07790600 08790600
ffff9639a63cd780 1538114069 S Bi:1:108:1 -115 13 <
ffff9639a63cd780 1538114179 C Bi:1:108:1 0 13 = 55534253 d1000000 00000000 00
ffff9639a63cd780 1538114260 S Bo:1:108:2 -115 31 = 55534243 d2000000 00020000 80000a28 00000015 20000001 00000000 000000
ffff9639a63cd780 1538114401 C Bo:1:108:2 0 31 >
ffff9637b5f9ac00 1538114417 S Bi:1:108:1 -115 512 <
ffff9637b5f9ac00 1538115042 C Bi:1:108:1 0 512 = 01800600 02800600 03800600 04800600 05800600 06800600 07800600 08800600
ffff9639a63cd780 1538115049 S Bi:1:108:1 -115 13 <
ffff9639a63cd780 1538115151 C Bi:1:108:1 0 13 = 55534253 d2000000 00000000 00
ffff9639a63cd780 1538115177 S Bo:1:108:2 -115 31 = 55534243 d3000000 00020000 80000a28 00000015 21000001 00000000 000000
ffff9639a63cd780 1538115277 C Bo:1:108:2 0 31 >
ffff96391fddd900 1538115285 S Bi:1:108:1 -115 512 <
ffff96391fddd900 1538116030 C Bi:1:108:1 0 512 = 81800600 82800600 83800600 84800600 85800600 86800600 87800600 88800600
ffff9639a63cd780 1538116038 S Bi:1:108:1 -115 13 <
ffff9639a63cd780 1538116152 C Bi:1:108:1 0 13 = 55534253 d3000000 00000000 00
ffff9639a63cd780 1538116176 S Bo:1:108:2 -115 31 = 55534243 d4000000 00e00100 80000a28 00000015 220000f0 00000000 000000
ffff9639a63cd780 1538116277 C Bo:1:108:2 0 31 >
ffff96391de05840 1538116282 S Bi:1:108:1 -115 122880 <
ffff96391de05840 1538122452 C Bi:1:108:1 0 122880 = 01810600 02810600 03810600 04810600 05810600 06810600 07810600 08810600
ffff9639a63cd780 1538122459 S Bi:1:108:1 -115 13 <
ffff9639a63cd780 1538122528 C Bi:1:108:1 0 13 = 55534253 d4000000 00000000 00
ffff9639a63cd780 1538122648 S Bo:1:108:2 -115 31 = 55534243 d5000000 001c0000 80000a28 00000016 1200000e 00000000 000000
ffff9639a63cd780 1538122776 C Bo:1:108:2 0 31 >
ffff9637b5ee7f00 1538122803 S Bi:1:108:1 -115 7168 <
ffff9637b5ee7f00 1538123794 C Bi:1:108:1 0 7168 = 00000000 00000000 00000000 00000000 00000000 00000000 00000000 00000000
ffff9639a63cd780 1538123801 S Bi:1:108:1 -115 13 <
ffff9639a63cd780 1538123901 C Bi:1:108:1 0 13 = 55534253 d5000000 00000000 00
ffff9639a63cd780 1538123979 S Bo:1:108:2 -115 31 = 55534243 d6000000 00020000 80000a28 00000016 20000001 00000000 000000
ffff9639a63cd780 1538124030 C Bo:1:108:2 0 31 >
ffff9637b5f9ac00 1538124041 S Bi:1:108:1 -115 512 <
ffff9637b5f9ac00 1538124804 C Bi:1:108:1 0 512 = 00000000 00000000 00000000 00000000 00000000 00000000 00000000 00000000
ffff9639a63cd780 1538124811 S Bi:1:108:1 -115 13 <
ffff9639a63cd780 1538124902 C Bi:1:108:1 0 13 = 55534253 d6000000 00000000 00
ffff9639a63cd780 1538124927 S Bo:1:108:2 -115 31 = 55534243 d7000000 00020000 80000a28 00000016 21000001 00000000 000000
ffff9639a63cd780 1538125027 C Bo:1:108:2 0 31 >
ffff9637b5f9ac00 1538125035 S Bi:1:108:1 -115 512 <
ffff9637b5f9ac00 1538125790 C Bi:1:108:1 0 512 = 00000000 00000000 00000000 00000000 00000000 00000000 00000000 00000000
ffff9639a63cd780 1538125803 S Bi:1:108:1 -115 13 <
ffff9639a63cd780 1538125902 C Bi:1:108:1 0 13 = 55534253 d7000000 00000000 00
ffff9639a63cd780 1538125936 S Bo:1:108:2 -115 31 = 55534243 d8000000 00e00100 80000a28 00000016 220000f0 00000000 000000
ffff9639a63cd780 1538126027 C Bo:1:108:2 0 31 >
ffff9637b5ee7300 1538126037 S Bi:1:108:1 -115 122880 <
ffff9637b5ee7300 1538132103 C Bi:1:108:1 0 122880 = 00000000 00000000 00000000 00000000 00000000 00000000 00000000 00000000
ffff9639a63cd780 1538132120 S Bi:1:108:1 -115 13 <
ffff9639a63cd780 1538132150 C Bi:1:108:1 0 13 = 55534253 d8000000 00000000 00
ffff9639a63cd780 1538132267 S Bo:1:108:2 -115 31 = 55534243 d9000000 001c0000 80000a28 00000017 1200000e 00000000 000000
ffff9639a63cd780 1538132412 C Bo:1:108:2 0 31 >
ffff96391fddd900 1538132418 S Bi:1:108:1 -115 7168 <
ffff96391fddd900 1538133309 C Bi:1:108:1 0 7168 = 01790700 02790700 03790700 04790700 05790700 06790700 07790700 08790700
ffff9639a63cd780 1538133317 S Bi:1:108:1 -115 13 <
ffff9639a63cd780 1538133412 C Bi:1:108:1 0 13 = 55534253 d9000000 00000000 00
ffff9639a63cd780 1538133494 S Bo:1:108:2 -115 31 = 55534243 da000000 00020000 80000a28 00000017 20000001 00000000 000000
ffff9639a63cd780 1538133533 C Bo:1:108:2 0 31 >
ffff96391fddd900 1538133539 S Bi:1:108:1 -115 512 <
ffff96391fddd900 1538134416 C Bi:1:108:1 0 512 = 01800700 02800700 03800700 04800700 05800700 06800700 07800700 08800700
ffff9639a63cd780 1538134423 S Bi:1:108:1 -115 13 <
ffff9639a63cd780 1538134526 C Bi:1:108:1 0 13 = 55534253 da000000 00000000 00
ffff9639a63cd780 1538134548 S Bo:1:108:2 -115 31 = 55534243 db000000 00020000 80000a28 00000017 21000001 00000000 000000
ffff9639a63cd780 1538134652 C Bo:1:108:2 0 31 >
ffff96391fddd900 1538134659 S Bi:1:108:1 -115 512 <
ffff96391fddd900 1538135431 C Bi:1:108:1 0 512 = 81800700 82800700 83800700 84800700 85800700 86800700 87800700 88800700
ffff9639a63cd780 1538135438 S Bi:1:108:1 -115 13 <
ffff9639a63cd780 1538135556 C Bi:1:108:1 0 13 = 55534253 db000000 00000000 00
ffff9639a63cd780 1538135580 S Bo:1:108:2 -115 31 = 55534243 dc000000 00e00100 80000a28 00000017 220000f0 00000000 000000
ffff9639a63cd780 1538135654 C Bo:1:108:2 0 31 >
ffff96391fddd900 1538135661 S Bi:1:108:1 -115 122880 <
ffff96391fddd900 1538141850 C Bi:1:108:1 0 122880 = 01810700 02810700 03810700 04810700 05810700 06810700 07810700 08810700
ffff9639a63cd780 1538141861 S Bi:1:108:1 -115 13 <
ffff9639a63cd780 1538141903 C Bi:1:108:1 0 13 = 55534253 dc000000 00000000 00
ffff9639a63cd780 1538142000 S Bo:1:108:2 -115 31 = 55534243 dd000000 001c0000 80000a28 00000018 1200000e 00000000 000000
ffff9639a63cd780 1538142030 C Bo:1:108:2 0 31 >
ffff96391fddd900 1538142047 S Bi:1:108:1 -115 7168 <
ffff96391fddd900 1538143046 C Bi:1:108:1 0 7168 = 00000000 00000000 00000000 00000000 00000000 00000000 00000000 00000000
ffff9639a63cd780 1538143053 S Bi:1:108:1 -115 13 <
ffff9639a63cd780 1538143153 C Bi:1:108:1 0 13 = 55534253 dd000000 00000000 00
ffff9639a63cd780 1538143242 S Bo:1:108:2 -115 31 = 55534243 de000000 00020000 80000a28 00000018 20000001 00000000 000000
ffff9639a63cd780 1538143280 C Bo:1:108:2 0 31 >
ffff96391fddd900 1538143302 S Bi:1:108:1 -115 512 <
ffff96391fddd900 1538144044 C Bi:1:108:1 0 512 = 00000000 00000000 00000000 00000000 00000000 00000000 00000000 00000000
ffff9639a63cd780 1538144051 S Bi:1:108:1 -115 13 <
ffff9639a63cd780 1538144151 C Bi:1:108:1 0 13 = 55534253 de000000 00000000 00
ffff9639a63cd780 1538144177 S Bo:1:108:2 -115 31 = 55534243 df000000 00020000 80000a28 00000018 21000001 00000000 000000
ffff9639a63cd780 1538144276 C Bo:1:108:2 0 31 >
ffff96391de05840 1538144283 S Bi:1:108:1 -115 512 <
ffff96391de05840 1538144929 C Bi:1:108:1 0 512 = 00000000 00000000 00000000 00000000 00000000 00000000 00000000 00000000
ffff9639a63cd780 1538144936 S Bi:1:108:1 -115 13 <
ffff9639a63cd780 1538145054 C Bi:1:108:1 0 13 = 55534253 df000000 00000000 00
ffff9639a63cd780 1538145083 S Bo:1:108:2 -115 31 = 55534243 e0000000 00e00100 80000a28 00000018 220000f0 00000000 000000
ffff9639a63cd780 1538145151 C Bo:1:108:2 0 31 >
ffff96391de05840 1538145158 S Bi:1:108:1 -115 122880 <
ffff96391de05840 1538151338 C Bi:1:108:1 0 122880 = 00000000 00000000 00000000 00000000 00000000 00000000 00000000 00000000
ffff9639a63cd780 1538151347 S Bi:1:108:1 -115 13 <
ffff9639a63cd780 1538151401 C Bi:1:108:1 0 13 = 55534253 e0000000 00000000 00
ffff9639a63cd780 1538151527 S Bo:1:108:2 -115 31 = 55534243 e1000000 001c0000 80000a28 00000019 1200000e 00000000 000000
ffff9639a63cd780 1538151651 C Bo:1:108:2 0 31 >
ffff9637b5ee7300 1538151680 S Bi:1:108:1 -115 7168 <
ffff9637b5ee7300 1538152545 C Bi:1:108:1 0 7168 = 01790800 02790800 03790800 04790800 05790800 06790800 07790800 08790800
ffff9639a63cd780 1538152555 S Bi:1:108:1 -115 13 <
ffff9639a63cd780 1538152652 C Bi:1:108:1 0 13 = 55534253 e1000000 00000000 00
ffff9639a63cd780 1538152719 S Bo:1:108:2 -115 31 = 55534243 e2000000 00020000 80000a28 00000019 20000001 00000000 000000
ffff9639a63cd780 1538152781 C Bo:1:108:2 0 31 >
ffff96391fddd000 1538152789 S Bi:1:108:1 -115 512 <
ffff96391fddd000 1538153542 C Bi:1:108:1 0 512 = 01800800 02800800 03800800 04800800 05800800 06800800 07800800 08800800
ffff9639a63cd780 1538153551 S Bi:1:108:1 -115 13 <
ffff9639a63cd780 1538153679 C Bi:1:108:1 0 13 = 55534253 e2000000 00000000 00
ffff9639a63cd780 1538153724 S Bo:1:108:2 -115 31 = 55534243 e3000000 00020000 80000a28 00000019 21000001 00000000 000000
ffff9639a63cd780 1538153777 C Bo:1:108:2 0 31 >
ffff96391de05840 1538153783 S Bi:1:108:1 -115 512 <
ffff96391de05840 1538154542 C Bi:1:108:1 0 512 = 81800800 82800800 83800800 84800800 85800800 86800800 87800800 88800800
ffff9639a63cd780 1538154549 S Bi:1:108:1 -115 13 <
ffff9639a63cd780 1538154652 C Bi:1:108:1 0 13 = 55534253 e3000000 00000000 00
ffff9639a63cd780 1538154675 S Bo:1:108:2 -115 31 = 55534243 e4000000 00e00100 80000a28 00000019 220000f0 00000000 000000
ffff9639a63cd780 1538154776 C Bo:1:108:2 0 31 >
ffff96391de05840 1538154782 S Bi:1:108:1 -115 122880 <
ffff96391de05840 1538160826 C Bi:1:108:1 0 122880 = 01810800 02810800 03810800 04810800 05810800 06810800 07810800 08810800
ffff9639a63cd780 1538160832 S Bi:1:108:1 -115 13 <
ffff9639a63cd780 1538160901 C Bi:1:108:1 0 13 = 55534253 e4000000 00000000 00
ffff9639a63cd780 1538160991 S Bo:1:108:2 -115 31 = 55534243 e5000000 001c0000 80000a28 0000001a 1200000e 00000000 000000
ffff9639a63cd780 1538161041 C Bo:1:108:2 0 31 >
ffff96391fddd000 1538161058 S Bi:1:108:1 -115 7168 <
ffff96391fddd000 1538162048 C Bi:1:108:1 0 7168 = 01f90800 02f90800 03f90800 04f90800 05f90800 06f90800 07f90800 08f90800
ffff9639a63cd780 1538162057 S Bi:1:108:1 -115 13 <
ffff9639a63cd780 1538162153 C Bi:1:108:1 0 13 = 55534253 e5000000 00000000 00
ffff9639a63cd780 1538162273 S Bo:1:108:2 -115 31 = 55534243 e6000000 00020000 80000a28 0000001a 20000001 00000000 000000
ffff9639a63cd780 1538162404 C Bo:1:108:2 0 31 >
ffff9637b5f9ac00 1538162420 S Bi:1:108:1 -115 512 <
ffff9637b5f9ac00 1538163046 C Bi:1:108:1 0 512 = 01000900 02000900 03000900 04000900 05000900 06000900 07000900 08000900
ffff9639a63cd780 1538163058 S Bi:1:108:1 -115 13 <
ffff9639a63cd780 1538163155 C Bi:1:108:1 0 13 = 55534253 e6000000 00000000 00
ffff9639a63cd780 1538163187 S Bo:1:108:2 -115 31 = 55534243 e7000000 00020000 80000a28 0000001a 21000001 00000000 000000
ffff9639a63cd780 1538163280 C Bo:1:108:2 0 31 >
ffff96391fddd000 1538163289 S Bi:1:108:1 -115 512 <
ffff96391fddd000 1538163919 C Bi:1:108:1 0 512 = 81000900 82000900 83000900 84000900 85000900 86000900 87000900 88000900
ffff9639a63cd780 1538163931 S Bi:1:108:1 -115 13 <
ffff9639a63cd780 1538164032 C Bi:1:108:1 0 13 = 55534253 e7000000 00000000 00
ffff9639a63cd780 1538164071 S Bo:1:108:2 -115 31 = 55534243 e8000000 00e00100 80000a28 0000001a 220000f0 00000000 000000
ffff9639a63cd780 1538164154 C Bo:1:108:2 0 31 >
ffff96391fddd000 1538164164 S Bi:1:108:1 -115 122880 <
ffff96391fddd000 1538170237 C Bi:1:108:1 0 122880 = 01010900 02010900 03010900 04010900 05010900 06010900 07010900 08010900
ffff9639a63cd780 1538170248 S Bi:1:108:1 -115 13 <
ffff9639a63cd780 1538170280 C Bi:1:108:1 0 13 = 55534253 e8000000 00000000 00
ffff9639a63cd780 1538170401 S Bo:1:108:2 -115 31 = 55534243 e9000000 001c0000 80000a28 0000001b 1200000e 00000000 000000
ffff9639a63cd780 1538170540 C Bo:1:108:2 0 31 >
ffff9637b5ee7300 1538170580 S Bi:1:108:1 -115 7168 <
ffff9637b5ee7300 1538171438 C Bi:1:108:1 0 7168 = 01790900 02790900 03790900 04790900 05790900 06790900 07790900 08790900
ffff9639a63cd780 1538171455 S Bi:1:108:1 -115 13 <
ffff9639a63cd780 1538171558 C Bi:1:108:1 0 13 = 55534253 e9000000 00000000 00
ffff9639a63cd780 1538171690 S Bo:1:108:2 -115 31 = 55534243 ea000000 00020000 80000a28 0000001b 20000001 00000000 000000
ffff9639a63cd780 1538171783 C Bo:1:108:2 0 31 >
ffff9637b5f9ac00 1538171795 S Bi:1:108:1 -115 512 <
ffff9637b5f9ac00 1538172403 C Bi:1:108:1 0 512 = 01800900 02800900 03800900 04800900 05800900 06800900 07800900 08800900
ffff9639a63cd780 1538172412 S Bi:1:108:1 -115 13 <
ffff9639a63cd780 1538172531 C Bi:1:108:1 0 13 = 55534253 ea000000 00000000 00
ffff9639a63cd780 1538172567 S Bo:1:108:2 -115 31 = 55534243 eb000000 00020000 80000a28 0000001b 21000001 00000000 000000
ffff9639a63cd780 1538172651 C Bo:1:108:2 0 31 >
ffff96391fddd000 1538172659 S Bi:1:108:1 -115 512 <
ffff96391fddd000 1538173291 C Bi:1:108:1 0 512 = 81800900 82800900 83800900 84800900 85800900 86800900 87800900 88800900
ffff9639a63cd780 1538173296 S Bi:1:108:1 -115 13 <
ffff9639a63cd780 1538173401 C Bi:1:108:1 0 13 = 55534253 eb000000 00000000 00
ffff9639a63cd780 1538173423 S Bo:1:108:2 -115 31 = 55534243 ec000000 00e00100 80000a28 0000001b 220000f0 00000000 000000
ffff9639a63cd780 1538173527 C Bo:1:108:2 0 31 >
ffff96391de05840 1538173536 S Bi:1:108:1 -115 122880 <
ffff96391de05840 1538179614 C Bi:1:108:1 0 122880 = 01810900 02810900 03810900 04810900 05810900 06810900 07810900 08810900
ffff9639a63cd780 1538179625 S Bi:1:108:1 -115 13 <
ffff9639a63cd780 1538179814 C Bi:1:108:1 0 13 = 55534253 ec000000 00000000 00
ffff9639a63cd780 1538179949 S Bo:1:108:2 -115 31 = 55534243 ed000000 001c0000 80000a28 0000001c 1200000e 00000000 000000
ffff9639a63cd780 1538180027 C Bo:1:108:2 0 31 >
ffff9637b5ee7f00 1538180054 S Bi:1:108:1 -115 7168 <
ffff9637b5ee7f00 1538180919 C Bi:1:108:1 0 7168 = 01f90900 02f90900 03f90900 04f90900 05f90900 06f90900 07f90900 08f90900
ffff9639a63cd780 1538180927 S Bi:1:108:1 -115 13 <
ffff9639a63cd780 1538181027 C Bi:1:108:1 0 13 = 55534253 ed000000 00000000 00
ffff9639a63cd780 1538181101 S Bo:1:108:2 -115 31 = 55534243 ee000000 00020000 80000a28 0000001c 20000001 00000000 000000
ffff9639a63cd780 1538181154 C Bo:1:108:2 0 31 >
ffff96391fddd000 1538181166 S Bi:1:108:1 -115 512 <
ffff96391fddd000 1538181780 C Bi:1:108:1 0 512 = 01000a00 02000a00 03000a00 04000a00 05000a00 06000a00 07000a00 08000a00
ffff9639a63cd780 1538181789 S Bi:1:108:1 -115 13 <
ffff9639a63cd780 1538181901 C Bi:1:108:1 0 13 = 55534253 ee000000 00000000 00
ffff9639a63cd780 1538181946 S Bo:1:108:2 -115 31 = 55534243 ef000000 00020000 80000a28 0000001c 21000001 00000000 000000
ffff9639a63cd780 1538182027 C Bo:1:108:2 0 31 >
ffff96391de05840 1538182033 S Bi:1:108:1 -115 512 <
ffff96391de05840 1538182678 C Bi:1:108:1 0 512 = 81000a00 82000a00 83000a00 84000a00 85000a00 86000a00 87000a00 88000a00
ffff9639a63cd780 1538182685 S Bi:1:108:1 -115 13 <
ffff9639a63cd780 1538182804 C Bi:1:108:1 0 13 = 55534253 ef000000 00000000 00
ffff9639a63cd780 1538182835 S Bo:1:108:2 -115 31 = 55534243 f0000000 00e00100 80000a28 0000001c 220000f0 00000000 000000
ffff9639a63cd780 1538182932 C Bo:1:108:2 0 31 >
ffff96391de05840 1538182940 S Bi:1:108:1 -115 122880 <
ffff96391de05840 1538188950 C Bi:1:108:1 0 122880 = 01010a00 02010a00 03010a00 04010a00 05010a00 06010a00 07010a00 08010a00
ffff9639a63cd780 1538188956 S Bi:1:108:1 -115 13 <
ffff9639a63cd780 1538189030 C Bi:1:108:1 0 13 = 55534253 f0000000 00000000 00
ffff9639a63cd780 1538189155 S Bo:1:108:2 -115 31 = 55534243 f1000000 001c0000 80000a28 0000001d 1200000e 00000000 000000
ffff9639a63cd780 1538189277 C Bo:1:108:2 0 31 >
ffff9637b5ee7f00 1538189295 S Bi:1:108:1 -115 7168 <
ffff9637b5ee7f00 1538190169 C Bi:1:108:1 0 7168 = 01790a00 02790a00 03790a00 04790a00 05790a00 06790a00 07790a00 08790a00
ffff9639a63cd780 1538190181 S Bi:1:108:1 -115 13 <
ffff9639a63cd780 1538190305 C Bi:1:108:1 0 13 = 55534253 f1000000 00000000 00
ffff9639a63cd780 1538190395 S Bo:1:108:2 -115 31 = 55534243 f2000000 00020000 80000a28 0000001d 20000001 00000000 000000
ffff9639a63cd780 1538190530 C Bo:1:108:2 0 31 >
ffff96391fddd900 1538190539 S Bi:1:108:1 -115 512 <
ffff96391fddd900 1538191168 C Bi:1:108:1 0 512 = 01800a00 02800a00 03800a00 04800a00 05800a00 06800a00 07800a00 08800a00
ffff9639a63cd780 1538191175 S Bi:1:108:1 -115 13 <
ffff9639a63cd780 1538191305 C Bi:1:108:1 0 13 = 55534253 f2000000 00000000 00
ffff9639a63cd780 1538191331 S Bo:1:108:2 -115 31 = 55534243 f3000000 00020000 80000a28 0000001d 21000001 00000000 000000
ffff9639a63cd780 1538191401 C Bo:1:108:2 0 31 >
ffff96391de05840 1538191408 S Bi:1:108:1 -115 512 <
ffff96391de05840 1538192042 C Bi:1:108:1 0 512 = 81800a00 82800a00 83800a00 84800a00 85800a00 86800a00 87800a00 88800a00
ffff9639a63cd780 1538192048 S Bi:1:108:1 -115 13 <
ffff9639a63cd780 1538192151 C Bi:1:108:1 0 13 = 55534253 f3000000 00000000 00
ffff9639a63cd780 1538192171 S Bo:1:108:2 -115 31 = 55534243 f4000000 00e00100 80000a28 0000001d 220000f0 00000000 000000
ffff9639a63cd780 1538192277 C Bo:1:108:2 0 31 >
ffff96391de05840 1538192284 S Bi:1:108:1 -115 122880 <
ffff96391de05840 1538198342 C Bi:1:108:1 0 122880 = 01810a00 02810a00 03810a00 04810a00 05810a00 06810a00 07810a00 08810a00
ffff9639a63cd780 1538198349 S Bi:1:108:1 -115 13 <
ffff9639a63cd780 1538198402 C Bi:1:108:1 0 13 = 55534253 f4000000 00000000 00
ffff9639a63cd780 1538198484 S Bo:1:108:2 -115 31 = 55534243 f5000000 001c0000 80000a28 0000001e 1200000e 00000000 000000
ffff9639a63cd780 1538198529 C Bo:1:108:2 0 31 >
ffff96391fddd900 1538198541 S Bi:1:108:1 -115 7168 <
ffff96391fddd900 1538199421 C Bi:1:108:1 0 7168 = 01f90a00 02f90a00 03f90a00 04f90a00 05f90a00 06f90a00 07f90a00 08f90a00
ffff9639a63cd780 1538199432 S Bi:1:108:1 -115 13 <
ffff9639a63cd780 1538199556 C Bi:1:108:1 0 13 = 55534253 f5000000 00000000 00
ffff9639a63cd780 1538199637 S Bo:1:108:2 -115 31 = 55534243 f6000000 00020000 80000a28 0000001e 20000001 00000000 000000
ffff9639a63cd780 1538199780 C Bo:1:108:2 0 31 >
ffff96391fddd000 1538199789 S Bi:1:108:1 -115 512 <
ffff96391fddd000 1538200418 C Bi:1:108:1 0 512 = 01000b00 02000b00 03000b00 04000b00 05000b00 06000b00 07000b00 08000b00
ffff9639a63cd780 1538200425 S Bi:1:108:1 -115 13 <
ffff9639a63cd780 1538200555 C Bi:1:108:1 0 13 = 55534253 f6000000 00000000 00
ffff9639a63cd780 1538200580 S Bo:1:108:2 -115 31 = 55534243 f7000000 00020000 80000a28 0000001e 21000001 00000000 000000
ffff9639a63cd780 1538200651 C Bo:1:108:2 0 31 >
ffff96391de05840 1538200659 S Bi:1:108:1 -115 512 <
ffff96391de05840 1538201290 C Bi:1:108:1 0 512 = 81000b00 82000b00 83000b00 84000b00 85000b00 86000b00 87000b00 88000b00
ffff9639a63cd780 1538201294 S Bi:1:108:1 -115 13 <
ffff9639a63cd780 1538201402 C Bi:1:108:1 0 13 = 55534253 f7000000 00000000 00
ffff9639a63cd780 1538201428 S Bo:1:108:2 -115 31 = 55534243 f8000000 00e00100 80000a28 0000001e 220000f0 00000000 000000
ffff9639a63cd780 1538201526 C Bo:1:108:2 0 31 >
ffff96391de05840 1538201532 S Bi:1:108:1 -115 122880 <
ffff96391de05840 1538207591 C Bi:1:108:1 0 122880 = 01010b00 02010b00 03010b00 04010b00 05010b00 06010b00 07010b00 08010b00
ffff9639a63cd780 1538207598 S Bi:1:108:1 -115 13 <
ffff9639a63cd780 1538207654 C Bi:1:108:1 0 13 = 55534253 f8000000 00000000 00
ffff9639a63cd780 1538207764 S Bo:1:108:2 -115 31 = 55534243 f9000000 001c0000 80000a28 0000001f 1200000e 00000000 000000
ffff9639a63cd780 1538207902 C Bo:1:108:2 0 31 >
ffff9637b5ee7f00 1538207920 S Bi:1:108:1 -115 7168 <
ffff9637b5ee7f00 1538208795 C Bi:1:108:1 0 7168 = 01790b00 02790b00 03790b00 04790b00 05790b00 06790b00 07790b00 08790b00
ffff9639a63cd780 1538208805 S Bi:1:108:1 -115 13 <
ffff9639a63cd780 1538208901 C Bi:1:108:1 0 13 = 55534253 f9000000 00000000 00
ffff9639a63cd780 1538209001 S Bo:1:108:2 -115 31 = 55534243 fa000000 00020000 80000a28 0000001f 20000001 00000000 000000
ffff9639a63cd780 1538209028 C Bo:1:108:2 0 31 >
ffff96391de05840 1538209046 S Bi:1:108:1 -115 512 <
ffff96391de05840 1538209785 C Bi:1:108:1 0 512 = 01800b00 02800b00 03800b00 04800b00 05800b00 06800b00 07800b00 08800b00
ffff9639a63cd780 1538209794 S Bi:1:108:1 -115 13 <
ffff9639a63cd780 1538209903 C Bi:1:108:1 0 13 = 55534253 fa000000 00000000 00
ffff9639a63cd780 1538209928 S Bo:1:108:2 -115 31 = 55534243 fb000000 00020000 80000a28 0000001f 21000001 00000000 000000
ffff9639a63cd780 1538210027 C Bo:1:108:2 0 31 >
ffff96391de056c0 1538210033 S Bi:1:108:1 -115 512 <
ffff96391de056c0 1538210678 C Bi:1:108:1 0 512 = 81800b00 82800b00 83800b00 84800b00 85800b00 86800b00 87800b00 88800b00
ffff9639a63cd780 1538210686 S Bi:1:108:1 -115 13 <
ffff9639a63cd780 1538210804 C Bi:1:108:1 0 13 = 55534253 fb000000 00000000 00
ffff9639a63cd780 1538210833 S Bo:1:108:2 -115 31 = 55534243 fc000000 00e00100 80000a28 0000001f 220000f0 00000000 000000
ffff9639a63cd780 1538210922 C Bo:1:108:2 0 31 >
ffff96391de056c0 1538210942 S Bi:1:108:1 -115 122880 <
ffff96391de056c0 1538216952 C Bi:1:108:1 0 122880 = 01810b00 02810b00 03810b00 04810b00 05810b00 06810b00 07810b00 08810b00
ffff9639a63cd780 1538216960 S Bi:1:108:1 -115 13 <
ffff9639a63cd780 1538217179 C Bi:1:108:1 0 13 = 55534253 fc000000 00000000 00
ffff9639a63cd780 1538217280 S Bo:1:108:2 -115 31 = 55534243 fd000000 001c0000 80000a28 00000020 1200000e 00000000 000000
ffff9639a63cd780 1538217401 C Bo:1:108:2 0 31 >
ffff9637b5ee7300 1538217428 S Bi:1:108:1 -115 7168 <
ffff9637b5ee7300 1538218295 C Bi:1:108:1 0 7168 = 01f90b00 02f90b00 03f90b00 04f90b00 05f90b00 06f90b00 07f90b00 08f90b00
ffff9639a63cd780 1538218321 S Bi:1:108:1 -115 13 <
ffff9639a63cd780 1538218430 C Bi:1:108:1 0 13 = 55534253 fd000000 00000000 00
ffff9639a63cd780 1538218529 S Bo:1:108:2 -115 31 = 55534243 fe000000 00020000 80000a28 00000020 20000001 00000000 000000
ffff9639a63cd780 1538218652 C Bo:1:108:2 0 31 >
ffff9637b5ee7300 1538218679 S Bi:1:108:1 -115 512 <
ffff9637b5ee7300 1538219418 C Bi:1:108:1 0 512 = 01000c00 02000c00 03000c00 04000c00 05000c00 06000c00 07000c00 08000c00
ffff9639a63cd780 1538219427 S Bi:1:108:1 -115 13 <
ffff9639a63cd780 1538219537 C Bi:1:108:1 0 13 = 55534253 fe000000 00000000 00
ffff9639a63cd780 1538219575 S Bo:1:108:2 -115 31 = 55534243 ff000000 00020000 80000a28 00000020 21000001 00000000 000000
ffff9639a63cd780 1538219651 C Bo:1:108:2 0 31 >
ffff9637b5ee7300 1538219661 S Bi:1:108:1 -115 512 <
ffff9637b5ee7300 1538220417 C Bi:1:108:1 0 512 = 81000c00 82000c00 83000c00 84000c00 85000c00 86000c00 87000c00 88000c00
ffff9639a63cd780 1538220436 S Bi:1:108:1 -115 13 <
ffff9639a63cd780 1538220526 C Bi:1:108:1 0 13 = 55534253 ff000000 00000000 00
ffff9639a63cd780 1538220563 S Bo:1:108:2 -115 31 = 55534243 00010000 00e00100 80000a28 00000020 220000f0 00000000 000000
ffff9639a63cd780 1538220651 C Bo:1:108:2 0 31 >
ffff9637b5f9ac00 1538220661 S Bi:1:108:1 -115 122880 <
ffff9637b5f9ac00 1538226738 C Bi:1:108:1 0 122880 = 01010c00 02010c00 03010c00 04010c00 05010c00 06010c00 07010c00 08010c00
ffff9639a63cd780 1538226756 S Bi:1:108:1 -115 13 <
ffff9639a63cd780 1538226930 C Bi:1:108:1 0 13 = 55534253 00010000 00000000 00
ffff9639a63cd780 1538227036 S Bo:1:108:2 -115 31 = 55534243 01010000 001c0000 80000a28 00000021 1200000e 00000000 000000
ffff9639a63cd780 1538227151 C Bo:1:108:2 0 31 >
ffff96391de056c0 1538227174 S Bi:1:108:1 -115 7168 <
ffff96391de056c0 1538228158 C Bi:1:108:1 0 7168 = 01790c00 02790c00 03790c00 04790c00 05790c00 06790c00 07790c00 08790c00
ffff9639a63cd780 1538228165 S Bi:1:108:1 -115 13 <
ffff9639a63cd780 1538228277 C Bi:1:108:1 0 13 = 55534253 01010000 00000000 00
ffff9639a63cd780 1538228354 S Bo:1:108:2 -115 31 = 55534243 02010000 00020000 80000a28 00000021 20000001 00000000 000000
ffff9639a63cd780 1538228402 C Bo:1:108:2 0 31 >
ffff9637b5f9ac00 1538228427 S Bi:1:108:1 -115 512 <
ffff9637b5f9ac00 1538229168 C Bi:1:108:1 0 512 = 01800c00 02800c00 03800c00 04800c00 05800c00 06800c00 07800c00 08800c00
ffff9639a63cd780 1538229180 S Bi:1:108:1 -115 13 <
ffff9639a63cd780 1538229277 C Bi:1:108:1 0 13 = 55534253 02010000 00000000 00
ffff9639a63cd780 1538229305 S Bo:1:108:2 -115 31 = 55534243 03010000 00020000 80000a28 00000021 21000001 00000000 000000
ffff9639a63cd780 1538229403 C Bo:1:108:2 0 31 >
ffff96391fddd000 1538229411 S Bi:1:108:1 -115 512 <
ffff96391fddd000 1538230178 C Bi:1:108:1 0 512 = 81800c00 82800c00 83800c00 84800c00 85800c00 86800c00 87800c00 88800c00
ffff9639a63cd780 1538230188 S Bi:1:108:1 -115 13 <
ffff9639a63cd780 1538230287 C Bi:1:108:1 0 13 = 55534253 03010000 00000000 00
ffff9639a63cd780 1538230311 S Bo:1:108:2 -115 31 = 55534243 04010000 00e00100 80000a28 00000021 220000f0 00000000 000000
ffff9639a63cd780 1538230403 C Bo:1:108:2 0 31 >
ffff96391fddd000 1538230409 S Bi:1:108:1 -115 122880 <
ffff96391fddd000 1538236603 C Bi:1:108:1 0 122880 = 01810c00 02810c00 03810c00 04810c00 05810c00 06810c00 07810c00 08810c00
ffff9639a63cd780 1538236611 S Bi:1:108:1 -115 13 <
ffff9639a63cd780 1538236652 C Bi:1:108:1 0 13 = 55534253 04010000 00000000 00
ffff9639a63cd780 1538236761 S Bo:1:108:2 -115 31 = 55534243 05010000 001c0000 80000a28 00000022 1200000e 00000000 000000
ffff9639a63cd780 1538236905 C Bo:1:108:2 0 31 >
ffff96391fddd000 1538236915 S Bi:1:108:1 -115 7168 <
ffff96391fddd000 1538237797 C Bi:1:108:1 0 7168 = 01f90c00 02f90c00 03f90c00 04f90c00 05f90c00 06f90c00 07f90c00 08f90c00
ffff9639a63cd780 1538237806 S Bi:1:108:1 -115 13 <
ffff9639a63cd780 1538237939 C Bi:1:108:1 0 13 = 55534253 05010000 00000000 00
ffff9639a63cd780 1538238035 S Bo:1:108:2 -115 31 = 55534243 06010000 00020000 80000a28 00000022 20000001 00000000 000000
ffff9639a63cd780 1538238172 C Bo:1:108:2 0 31 >
ffff96391fddd900 1538238205 S Bi:1:108:1 -115 512 <
ffff96391fddd900 1538238939 C Bi:1:108:1 0 512 = 01000d00 02000d00 03000d00 04000d00 05000d00 06000d00 07000d00 08000d00
ffff9639a63cd780 1538238947 S Bi:1:108:1 -115 13 <
ffff9639a63cd780 1538239057 C Bi:1:108:1 0 13 = 55534253 06010000 00000000 00
ffff9639a63cd780 1538239085 S Bo:1:108:2 -115 31 = 55534243 07010000 00020000 80000a28 00000022 21000001 00000000 000000
ffff9639a63cd780 1538239153 C Bo:1:108:2 0 31 >
ffff96391fddd900 1538239160 S Bi:1:108:1 -115 512 <
ffff96391fddd900 1538239916 C Bi:1:108:1 0 512 = 81000d00 82000d00 83000d00 84000d00 85000d00 86000d00 87000d00 88000d00
ffff9639a63cd780 1538239925 S Bi:1:108:1 -115 13 <
ffff9639a63cd780 1538240027 C Bi:1:108:1 0 13 = 55534253 07010000 00000000 00
ffff9639a63cd780 1538240050 S Bo:1:108:2 -115 31 = 55534243 08010000 00e00100 80000a28 00000022 220000f0 00000000 000000
ffff9639a63cd780 1538240184 C Bo:1:108:2 0 31 >
ffff96391fddd900 1538240191 S Bi:1:108:1 -115 122880 <
ffff96391fddd900 1538246354 C Bi:1:108:1 0 122880 = 01010d00 02010d00 03010d00 04010d00 05010d00 06010d00 07010d00 08010d00
ffff9639a63cd780 1538246362 S Bi:1:108:1 -115 13 <
ffff9639a63cd780 1538246402 C Bi:1:108:1 0 13 = 55534253 08010000 00000000 00
ffff9639a63cd780 1538246489 S Bo:1:108:2 -115 31 = 55534243 09010000 001c0000 80000a28 00000023 1200000e 00000000 000000
ffff9639a63cd780 1538246530 C Bo:1:108:2 0 31 >
ffff96391fddd900 1538246545 S Bi:1:108:1 -115 7168 <
ffff96391fddd900 1538247544 C Bi:1:108:1 0 7168 = 01790d00 02790d00 03790d00 04790d00 ffffff0f 06790d00 07790d00 08790d00
ffff9639a63cd780 1538247554 S Bi:1:108:1 -115 13 <
ffff9639a63cd780 1538247662 C Bi:1:108:1 0 13 = 55534253 09010000 00000000 00
ffff9639a63cd780 1538247750 S Bo:1:108:2 -115 31 = 55534243 0a010000 00020000 80000a28 00000023 20000001 00000000 000000
ffff9639a63cd780 1538247778 C Bo:1:108:2 0 31 >
ffff9637b5ee7300 1538247798 S Bi:1:108:1 -115 512 <
ffff9637b5ee7300 1538248543 C Bi:1:108:1 0 512 = ffffff0f ffffff0f ffffff0f 04800d00 ffffff0f ffffff0f ffffff0f 08800d00
ffff9639a63cd780 1538248551 S Bi:1:108:1 -115 13 <
ffff9639a63cd780 1538248653 C Bi:1:108:1 0 13 = 55534253 0a010000 00000000 00
ffff9639a63cd780 1538248677 S Bo:1:108:2 -115 31 = 55534243 0b010000 00020000 80000a28 00000023 21000001 00000000 000000
ffff9639a63cd780 1538248777 C Bo:1:108:2 0 31 >
ffff96391fddd900 1538248784 S Bi:1:108:1 -115 512 <
ffff96391fddd900 1538249541 C Bi:1:108:1 0 512 = 81800d00 82800d00 83800d00 84800d00 85800d00 86800d00 87800d00 88800d00
ffff9639a63cd780 1538249547 S Bi:1:108:1 -115 13 <
ffff9639a63cd780 1538249652 C Bi:1:108:1 0 13 = 55534253 0b010000 00000000 00
ffff9639a63cd780 1538249674 S Bo:1:108:2 -115 31 = 55534243 0c010000 00e00100 80000a28 00000023 220000f0 00000000 000000
ffff9639a63cd780 1538249777 C Bo:1:108:2 0 31 >
ffff96391fddd900 1538249785 S Bi:1:108:1 -115 122880 <
ffff96391fddd900 1538255962 C Bi:1:108:1 0 122880 = 01810d00 02810d00 03810d00 04810d00 05810d00 06810d00 07810d00 08810d00
ffff9639a63cd780 1538255974 S Bi:1:108:1 -115 13 <
ffff9639a63cd780 1538256038 C Bi:1:108:1 0 13 = 55534253 0c010000 00000000 00
ffff9639a63cd780 1538256158 S Bo:1:108:2 -115 31 = 55534243 0d010000 001c0000 80000a28 00000024 1200000e 00000000 000000
ffff9639a63cd780 1538256280 C Bo:1:108:2 0 31 >
ffff96391fddd900 1538256288 S Bi:1:108:1 -115 7168 <
ffff96391fddd900 1538257296 C Bi:1:108:1 0 7168 = 00000000 00000000 00000000 00000000 00000000 00000000 00000000 00000000
ffff9639a63cd780 1538257304 S Bi:1:108:1 -115 13 <
ffff9639a63cd780 1538257430 C Bi:1:108:1 0 13 = 55534253 0d010000 00000000 00
ffff9639a63cd780 1538257505 S Bo:1:108:2 -115 31 = 55534243 0e010000 00020000 80000a28 00000024 20000001 00000000 000000
ffff9639a63cd780 1538257654 C Bo:1:108:2 0 31 >
ffff96391fddd000 1538257686 S Bi:1:108:1 -115 512 <
ffff96391fddd000 1538258291 C Bi:1:108:1 0 512 = 00000000 00000000 00000000 00000000 00000000 00000000 00000000 00000000
ffff9639a63cd780 1538258297 S Bi:1:108:1 -115 13 <
ffff9639a63cd780 1538258429 C Bi:1:108:1 0 13 = 55534253 0e010000 00000000 00
ffff9639a63cd780 1538258480 S Bo:1:108:2 -115 31 = 55534243 0f010000 00020000 80000a28 00000024 21000001 00000000 000000
ffff9639a63cd780 1538258526 C Bo:1:108:2 0 31 >
ffff96391de05240 1538258533 S Bi:1:108:1 -115 512 <
ffff96391de05240 1538259292 C Bi:1:108:1 0 512 = 00000000 00000000 00000000 00000000 00000000 00000000 00000000 00000000
ffff9639a63cd780 1538259297 S Bi:1:108:1 -115 13 <
ffff9639a63cd780 1538259402 C Bi:1:108:1 0 13 = 55534253 0f010000 00000000 00
ffff9639a63cd780 1538259430 S Bo:1:108:2 -115 31 = 55534243 10010000 00e00100 80000a28 00000024 220000f0 00000000 000000
ffff9639a63cd780 1538259527 C Bo:1:108:2 0 31 >
ffff96391de05240 1538259533 S Bi:1:108:1 -115 122880 <
ffff96391de05240 1538265718 C Bi:1:108:1 0 122880 = 00000000 00000000 00000000 00000000 00000000 00000000 00000000 00000000
ffff9639a63cd780 1538265725 S Bi:1:108:1 -115 13 <
ffff9639a63cd780 1538265776 C Bi:1:108:1 0 13 = 55534253 10010000 00000000 00
ffff9639a63cd780 1538265902 S Bo:1:108:2 -115 31 = 55534243 11010000 001c0000 80000a28 00000025 1200000e 00000000 000000
ffff9639a63cd780 1538266029 C Bo:1:108:2 0 31 >
ffff9637b5f9ac00 1538266056 S Bi:1:108:1 -115 7168 <
ffff9637b5f9ac00 1538266921 C Bi:1:108:1 0 7168 = 01790e00 02790e00 03790e00 04790e00 05790e00 06790e00 07790e00 08790e00
ffff9639a63cd780 1538266942 S Bi:1:108:1 -115 13 <
ffff9639a63cd780 1538267055 C Bi:1:108:1 0 13 = 55534253 11010000 00000000 00
ffff9639a63cd780 1538267146 S Bo:1:108:2 -115 31 = 55534243 12010000 00020000 80000a28 00000025 20000001 00000000 000000
ffff9639a63cd780 1538267277 C Bo:1:108:2 0 31 >
ffff96391fddd000 1538267297 S Bi:1:108:1 -115 512 <
ffff96391fddd000 1538268054 C Bi:1:108:1 0 512 = 01800e00 02800e00 03800e00 04800e00 05800e00 06800e00 07800e00 08800e00
ffff9639a63cd780 1538268065 S Bi:1:108:1 -115 13 <
ffff9639a63cd780 1538268162 C Bi:1:108:1 0 13 = 55534253 12010000 00000000 00
ffff9639a63cd780 1538268189 S Bo:1:108:2 -115 31 = 55534243 13010000 00020000 80000a28 00000025 21000001 00000000 000000
ffff9639a63cd780 1538268278 C Bo:1:108:2 0 31 >
ffff96391fddd900 1538268287 S Bi:1:108:1 -115 512 <
ffff96391fddd900 1538269040 C Bi:1:108:1 0 512 = 81800e00 82800e00 83800e00 84800e00 85800e00 86800e00 87800e00 88800e00
ffff9639a63cd780 1538269046 S Bi:1:108:1 -115 13 <
ffff9639a63cd780 1538269152 C Bi:1:108:1 0 13 = 55534253 13010000 00000000 00
ffff9639a63cd780 1538269178 S Bo:1:108:2 -115 31 = 55534243 14010000 00e00100 80000a28 00000025 220000f0 00000000 000000
ffff9639a63cd780 1538269276 C Bo:1:108:2 0 31 >
ffff96391de05240 1538269282 S Bi:1:108:1 -115 122880 <
ffff96391de05240 1538275486 C Bi:1:108:1 0 122880 = 01810e00 02810e00 03810e00 04810e00 05810e00 06810e00 07810e00 08810e00
ffff9639a63cd780 1538275494 S Bi:1:108:1 -115 13 <
ffff9639a63cd780 1538275525 C Bi:1:108:1 0 13 = 55534253 14010000 00000000 00
ffff9639a63cd780 1538275631 S Bo:1:108:2 -115 31 = 55534243 15010000 001c0000 80000a28 00000026 1200000e 00000000 000000
ffff9639a63cd780 1538275797 C Bo:1:108:2 0 31 >
ffff9637b5ee7300 1538275829 S Bi:1:108:1 -115 7168 <
ffff9637b5ee7300 1538276696 C Bi:1:108:1 0 7168 = 00000000 00000000 00000000 00000000 00000000 00000000 00000000 00000000
ffff9639a63cd780 1538276723 S Bi:1:108:1 -115 13 <
ffff9639a63cd780 1538276822 C Bi:1:108:1 0 13 = 55534253 15010000 00000000 00
ffff9639a63cd780 1538276926 S Bo:1:108:2 -115 31 = 55534243 16010000 00020000 80000a28 00000026 20000001 00000000 000000
ffff9639a63cd780 1538277030 C Bo:1:108:2 0 31 >
ffff96391fddd900 1538277061 S Bi:1:108:1 -115 512 <
ffff96391fddd900 1538277791 C Bi:1:108:1 0 512 = 00000000 00000000 00000000 00000000 00000000 00000000 00000000 00000000
ffff9639a63cd780 1538277800 S Bi:1:108:1 -115 13 <
ffff9639a63cd780 1538277901 C Bi:1:108:1 0 13 = 55534253 16010000 00000000 00
ffff9639a63cd780 1538277945 S Bo:1:108:2 -115 31 = 55534243 17010000 00020000 80000a28 00000026 21000001 00000000 000000
ffff9639a63cd780 1538278027 C Bo:1:108:2 0 31 >
ffff96391de05240 1538278035 S Bi:1:108:1 -115 512 <
ffff96391de05240 1538278792 C Bi:1:108:1 0 512 = 00000000 00000000 00000000 00000000 00000000 00000000 00000000 00000000
ffff9639a63cd780 1538278798 S Bi:1:108:1 -115 13 <
ffff9639a63cd780 1538278902 C Bi:1:108:1 0 13 = 55534253 17010000 00000000 00
ffff9639a63cd780 1538278925 S Bo:1:108:2 -115 31 = 55534243 18010000 00e00100 80000a28 00000026 220000f0 00000000 000000
ffff9639a63cd780 1538279027 C Bo:1:108:2 0 31 >
ffff96391de05240 1538279035 S Bi:1:108:1 -115 122880 <
ffff96391de05240 1538285103 C Bi:1:108:1 0 122880 = 00000000 00000000 00000000 00000000 00000000 00000000 00000000 00000000
ffff9639a63cd780 1538285111 S Bi:1:108:1 -115 13 <
ffff9639a63cd780 1538285150 C Bi:1:108:1 0 13 = 55534253 18010000 00000000 00
ffff9639a63cd780 1538285275 S Bo:1:108:2 -115 31 = 55534243 19010000 001c0000 80000a28 00000027 1200000e 00000000 000000
ffff9639a63cd780 1538285402 C Bo:1:108:2 0 31 >
ffff9637b5ee7f00 1538285422 S Bi:1:108:1 -115 7168 <
ffff9637b5ee7f00 1538286293 C Bi:1:108:1 0 7168 = 00000000 00000000 00000000 00000000 00000000 00000000 00000000 00000000
ffff9639a63cd780 1538286303 S Bi:1:108:1 -115 13 <
ffff9639a63cd780 1538286401 C Bi:1:108:1 0 13 = 55534253 19010000 00000000 00
ffff9639a63cd780 1538286480 S Bo:1:108:2 -115 31 = 55534243 1a010000 00020000 80000a28 00000027 20000001 00000000 000000
ffff9639a63cd780 1538286527 C Bo:1:108:2 0 31 >
ffff9637b5f9ac00 1538286544 S Bi:1:108:1 -115 512 <
ffff9637b5f9ac00 1538287294 C Bi:1:108:1 0 512 = 00000000 00000000 00000000 00000000 00000000 00000000 00000000 00000000
ffff9639a63cd780 1538287313 S Bi:1:108:1 -115 13 <
ffff9639a63cd780 1538287403 C Bi:1:108:1 0 13 = 55534253 1a010000 00000000 00
ffff9639a63cd780 1538287428 S Bo:1:108:2 -115 31 = 55534243 1b010000 00020000 80000a28 00000027 21000001 00000000 000000
ffff9639a63cd780 1538287529 C Bo:1:108:2 0 31 >
ffff96391fddd900 1538287537 S Bi:1:108:1 -115 512 <
ffff96391fddd900 1538288305 C Bi:1:108:1 0 512 = 00000000 00000000 00000000 00000000 00000000 00000000 00000000 00000000
ffff9639a63cd780 1538288313 S Bi:1:108:1 -115 13 <
ffff9639a63cd780 1538288429 C Bi:1:108:1 0 13 = 55534253 1b010000 00000000 00
ffff9639a63cd780 1538288456 S Bo:1:108:2 -115 31 = 55534243 1c010000 00e00100 80000a28 00000027 220000f0 00000000 000000
ffff9639a63cd780 1538288527 C Bo:1:108:2 0 31 >
ffff96391fddd900 1538288534 S Bi:1:108:1 -115 122880 <
ffff96391fddd900 1538294604 C Bi:1:108:1 0 122880 = 00000000 00000000 00000000 00000000 00000000 00000000 00000000 00000000
ffff9639a63cd780 1538294613 S Bi:1:108:1 -115 13 <
ffff9639a63cd780 1538294655 C Bi:1:108:1 0 13 = 55534253 1c010000 00000000 00
ffff9639a63cd780 1538294759 S Bo:1:108:2 -115 31 = 55534243 1d010000 001c0000 80000a28 00000028 1200000e 00000000 000000
ffff9639a63cd780 1538294904 C Bo:1:108:2 0 31 >
ffff96391fddd900 1538294913 S Bi:1:108:1 -115 7168 <
ffff96391fddd900 1538295809 C Bi:1:108:1 0 7168 = 00000000 00000000 00000000 00000000 00000000 00000000 00000000 00000000
ffff9639a63cd780 1538295818 S Bi:1:108:1 -115 13 <
ffff9639a63cd780 1538295903 C Bi:1:108:1 0 13 = 55534253 1d010000 00000000 00
ffff9639a63cd780 1538295980 S Bo:1:108:2 -115 31 = 55534243 1e010000 00020000 80000a28 00000028 20000001 00000000 000000
ffff9639a63cd780 1538296032 C Bo:1:108:2 0 31 >
ffff96391fddd000 1538296042 S Bi:1:108:1 -115 512 <
ffff96391fddd000 1538296792 C Bi:1:108:1 0 512 = 00000000 00000000 00000000 00000000 00000000 00000000 00000000 00000000
ffff9639a63cd780 1538296799 S Bi:1:108:1 -115 13 <
ffff9639a63cd780 1538296902 C Bi:1:108:1 0 13 = 55534253 1e010000 00000000 00
ffff9639a63cd780 1538296931 S Bo:1:108:2 -115 31 = 55534243 1f010000 00020000 80000a28 00000028 21000001 00000000 000000
ffff9639a63cd780 1538297028 C Bo:1:108:2 0 31 >
ffff9637b5f9ac00 1538297037 S Bi:1:108:1 -115 512 <
ffff9637b5f9ac00 1538297803 C Bi:1:108:1 0 512 = 00000000 00000000 00000000 00000000 00000000 00000000 00000000 00000000
ffff9639a63cd780 1538297811 S Bi:1:108:1 -115 13 <
ffff9639a63cd780 1538297936 C Bi:1:108:1 0 13 = 55534253 1f010000 00000000 00
ffff9639a63cd780 1538297977 S Bo:1:108:2 -115 31 = 55534243 20010000 00e00100 80000a28 00000028 220000f0 00000000 000000
ffff9639a63cd780 1538298037 C Bo:1:108:2 0 31 >
ffff9637b5ee7f00 1538298045 S Bi:1:108:1 -115 122880 <
ffff9637b5ee7f00 1538304218 C Bi:1:108:1 0 122880 = 00000000 00000000 00000000 00000000 00000000 00000000 00000000 00000000
ffff9639a63cd780 1538304227 S Bi:1:108:1 -115 13 <
ffff9639a63cd780 1538304278 C Bi:1:108:1 0 13 = 55534253 20010000 00000000 00
ffff9639a63cd780 1538304377 S Bo:1:108:2 -115 31 = 55534243 21010000 001c0000 80000a28 00000029 1200000e 00000000 000000
ffff9639a63cd780 1538304405 C Bo:1:108:2 0 31 >
ffff9637b5f9ac00 1538304420 S Bi:1:108:1 -115 7168 <
ffff9637b5f9ac00 1538305421 C Bi:1:108:1 0 7168 = 00000000 00000000 00000000 00000000 00000000 00000000 00000000 00000000
ffff9639a63cd780 1538305429 S Bi:1:108:1 -115 13 <
ffff9639a63cd780 1538305528 C Bi:1:108:1 0 13 = 55534253 21010000 00000000 00
ffff9639a63cd780 1538305616 S Bo:1:108:2 -115 31 = 55534243 22010000 00020000 80000a28 00000029 20000001 00000000 000000
ffff9639a63cd780 1538305657 C Bo:1:108:2 0 31 >
ffff96391fddd000 1538305666 S Bi:1:108:1 -115 512 <
ffff96391fddd000 1538306417 C Bi:1:108:1 0 512 = 00000000 00000000 00000000 00000000 00000000 00000000 00000000 00000000
ffff9639a63cd780 1538306431 S Bi:1:108:1 -115 13 <
ffff9639a63cd780 1538306555 C Bi:1:108:1 0 13 = 55534253 22010000 00000000 00
ffff9639a63cd780 1538306595 S Bo:1:108:2 -115 31 = 55534243 23010000 00020000 80000a28 00000029 21000001 00000000 000000
ffff9639a63cd780 1538306652 C Bo:1:108:2 0 31 >
ffff9637b5f9ac00 1538306670 S Bi:1:108:1 -115 512 <
ffff9637b5f9ac00 1538307415 C Bi:1:108:1 0 512 = 00000000 00000000 00000000 00000000 00000000 00000000 00000000 00000000
ffff9639a63cd780 1538307433 S Bi:1:108:1 -115 13 <
ffff9639a63cd780 1538307526 C Bi:1:108:1 0 13 = 55534253 23010000 00000000 00
ffff9639a63cd780 1538307561 S Bo:1:108:2 -115 31 = 55534243 24010000 00120100 80000a28 00000029 22000089 00000000 000000
ffff9639a63cd780 1538307651 C Bo:1:108:2 0 31 >
ffff9637b5f9ac00 1538307670 S Bi:1:108:1 -115 70144 <
ffff9637b5f9ac00 1538311458 C Bi:1:108:1 0 70144 = 00000000 00000000 00000000 00000000 00000000 00000000 00000000 00000000
ffff9639a63cd780 1538311479 S Bi:1:108:1 -115 13 <
ffff9639a63cd780 1538311528 C Bi:1:108:1 0 13 = 55534253 24010000 00000000 00
ffff9639a63cd780 1538311609 S Bo:1:108:2 -115 31 = 55534243 25010000 00e80000 80000a28 00000029 ac000074 00000000 000000
ffff9639a63cd780 1538311658 C Bo:1:108:2 0 31 >
ffff96391fddd000 1538311674 S Bi:1:108:1 -115 59392 <
ffff96391fddd000 1538314958 C Bi:1:108:1 0 59392 = 00000000 00000000 00000000 00000000 00000000 00000000 00000000 00000000
ffff9639a63cd780 1538314971 S Bi:1:108:1 -115 13 <
ffff9639a63cd780 1538315027 C Bi:1:108:1 0 13 = 55534253 25010000 00000000 00
ffff9639a63cd780 1538315335 S Bo:1:108:2 -115 31 = 55534243 26010000 00020000 80000a28 0000002a 20000001 00000000 000000
ffff9639a63cd780 1538315407 C Bo:1:108:2 0 31 >
ffff96391de05240 1538315435 S Bi:1:108:1 -115 512 <
ffff96391de05240 1538316183 C Bi:1:108:1 0 512 = 00000000 00000000 00000000 00000000 00000000 00000000 00000000 00000000
ffff9639a63cd780 1538316193 S Bi:1:108:1 -115 13 <
ffff9639a63cd780 1538316287 C Bi:1:108:1 0 13 = 55534253 26010000 00000000 00
ffff9639a63cd780 1538316319 S Bo:1:108:2 -115 31 = 55534243 27010000 00020000 80000a28 0000002a 21000001 00000000 000000
ffff9639a63cd780 1538316412 C Bo:1:108:2 0 31 >
ffff9637b5ee7f00 1538316421 S Bi:1:108:1 -115 512 <
ffff9637b5ee7f00 1538317166 C Bi:1:108:1 0 512 = 00000000 00000000 00000000 00000000 00000000 00000000 00000000 00000000
ffff9639a63cd780 1538317173 S Bi:1:108:1 -115 13 <
ffff9639a63cd780 1538317305 C Bi:1:108:1 0 13 = 55534253 27010000 00000000 00
ffff9639a63cd780 1538317344 S Bo:1:108:2 -115 31 = 55534243 28010000 00e00100 80000a28 0000002a 220000f0 00000000 000000
ffff9639a63cd780 1538317402 C Bo:1:108:2 0 31 >
ffff96391fddd900 1538317408 S Bi:1:108:1 -115 122880 <
ffff96391fddd900 1538323588 C Bi:1:108:1 0 122880 = 00000000 00000000 00000000 00000000 00000000 00000000 00000000 00000000
ffff9639a63cd780 1538323598 S Bi:1:108:1 -115 13 <
ffff9639a63cd780 1538323689 C Bi:1:108:1 0 13 = 55534253 28010000 00000000 00
ffff9639a63cd780 1538323809 S Bo:1:108:2 -115 31 = 55534243 29010000 001c0000 80000a28 0000002b 1200000e 00000000 000000
ffff9639a63cd780 1538323903 C Bo:1:108:2 0 31 >
ffff96391fddd900 1538323923 S Bi:1:108:1 -115 7168 <
ffff96391fddd900 1538324919 C Bi:1:108:1 0 7168 = 00000000 00000000 00000000 00000000 00000000 00000000 00000000 00000000
ffff9639a63cd780 1538324928 S Bi:1:108:1 -115 13 <
ffff9639a63cd780 1538325028 C Bi:1:108:1 0 13 = 55534253 29010000 00000000 00
ffff9639a63cd780 1538325099 S Bo:1:108:2 -115 31 = 55534243 2a010000 00020000 80000a28 0000002b 20000001 00000000 000000
ffff9639a63cd780 1538325152 C Bo:1:108:2 0 31 >
ffff96391de05240 1538325178 S Bi:1:108:1 -115 512 <
ffff96391de05240 1538325917 C Bi:1:108:1 0 512 = 00000000 00000000 00000000 00000000 00000000 00000000 00000000 00000000
ffff9639a63cd780 1538325924 S Bi:1:108:1 -115 13 <
ffff9639a63cd780 1538326028 C Bi:1:108:1 0 13 = 55534253 2a010000 00000000 00
ffff9639a63cd780 1538326051 S Bo:1:108:2 -115 31 = 55534243 2b010000 00020000 80000a28 0000002b 21000001 00000000 000000
ffff9639a63cd780 1538326153 C Bo:1:108:2 0 31 >
ffff96391fddd900 1538326158 S Bi:1:108:1 -115 512 <
ffff96391fddd900 1538326916 C Bi:1:108:1 0 512 = 00000000 00000000 00000000 00000000 00000000 00000000 00000000 00000000
ffff9639a63cd780 1538326923 S Bi:1:108:1 -115 13 <
ffff9639a63cd780 1538327027 C Bi:1:108:1 0 13 = 55534253 2b010000 00000000 00
ffff9639a63cd780 1538327054 S Bo:1:108:2 -115 31 = 55534243 2c010000 00e00100 80000a28 0000002b 220000f0 00000000 000000
ffff9639a63cd780 1538327151 C Bo:1:108:2 0 31 >
ffff96391fddd900 1538327156 S Bi:1:108:1 -115 122880 <
ffff96391fddd900 1538333228 C Bi:1:108:1 0 122880 = 00000000 00000000 00000000 00000000 00000000 00000000 00000000 00000000
ffff9639a63cd780 1538333235 S Bi:1:108:1 -115 13 <
ffff9639a63cd780 1538333277 C Bi:1:108:1 0 13 = 55534253 2c010000 00000000 00
ffff9639a63cd780 1538333385 S Bo:1:108:2 -115 31 = 55534243 2d010000 001c0000 80000a28 0000002c 1200000e 00000000 000000
ffff9639a63cd780 1538333530 C Bo:1:108:2 0 31 >
ffff9637b5f9ac00 1538333537 S Bi:1:108:1 -115 7168 <
ffff9637b5f9ac00 1538334435 C Bi:1:108:1 0 7168 = 00000000 00000000 00000000 00000000 00000000 00000000 00000000 00000000
ffff9639a63cd780 1538334447 S Bi:1:108:1 -115 13 <
ffff9639a63cd780 1538334527 C Bi:1:108:1 0 13 = 55534253 2d010000 00000000 00
ffff9639a63cd780 1538334608 S Bo:1:108:2 -115 31 = 55534243 2e010000 00020000 80000a28 0000002c 20000001 00000000 000000
ffff9639a63cd780 1538334652 C Bo:1:108:2 0 31 >
ffff96391fddd900 1538334658 S Bi:1:108:1 -115 512 <
ffff96391fddd900 1538335416 C Bi:1:108:1 0 512 = 01001200 02001200 03001200 04001200 05001200 06001200 07001200 08001200
ffff9639a63cd780 1538335430 S Bi:1:108:1 -115 13 <
ffff9639a63cd780 1538335527 C Bi:1:108:1 0 13 = 55534253 2e010000 00000000 00
ffff9639a63cd780 1538335557 S Bo:1:108:2 -115 31 = 55534243 2f010000 00020000 80000a28 0000002c 21000001 00000000 000000
ffff9639a63cd780 1538335652 C Bo:1:108:2 0 31 >
ffff9637b5ee7f00 1538335658 S Bi:1:108:1 -115 512 <
ffff9637b5ee7f00 1538336402 C Bi:1:108:1 0 512 = 81001200 82001200 83001200 84001200 85001200 86001200 87001200 88001200
ffff9639a63cd780 1538336430 S Bi:1:108:1 -115 13 <
ffff9639a63cd780 1538336555 C Bi:1:108:1 0 13 = 55534253 2f010000 00000000 00
ffff9639a63cd780 1538336607 S Bo:1:108:2 -115 31 = 55534243 30010000 00e00100 80000a28 0000002c 220000f0 00000000 000000
ffff9639a63cd780 1538336677 C Bo:1:108:2 0 31 >
ffff9637b5f9ac00 1538336697 S Bi:1:108:1 -115 122880 <
ffff9637b5f9ac00 1538342842 C Bi:1:108:1 0 122880 = 01011200 02011200 03011200 04011200 05011200 06011200 07011200 08011200
ffff9639a63cd780 1538342852 S Bi:1:108:1 -115 13 <
ffff9639a63cd780 1538342900 C Bi:1:108:1 0 13 = 55534253 30010000 00000000 00
ffff9639a63cd780 1538343004 S Bo:1:108:2 -115 31 = 55534243 31010000 001c0000 80000a28 0000002d 1200000e 00000000 000000
ffff9639a63cd780 1538343153 C Bo:1:108:2 0 31 >
ffff9637b5f9ac00 1538343163 S Bi:1:108:1 -115 7168 <
ffff9637b5f9ac00 1538344047 C Bi:1:108:1 0 7168 = 00000000 00000000 00000000 00000000 00000000 00000000 00000000 00000000
ffff9639a63cd780 1538344077 S Bi:1:108:1 -115 13 <
ffff9639a63cd780 1538344153 C Bi:1:108:1 0 13 = 55534253 31010000 00000000 00
ffff9639a63cd780 1538344238 S Bo:1:108:2 -115 31 = 55534243 32010000 00020000 80000a28 0000002d 20000001 00000000 000000
ffff9639a63cd780 1538344281 C Bo:1:108:2 0 31 >
ffff96391fddd000 1538344292 S Bi:1:108:1 -115 512 <
ffff96391fddd000 1538345043 C Bi:1:108:1 0 512 = 00000000 00000000 00000000 00000000 00000000 00000000 00000000 00000000
ffff9639a63cd780 1538345052 S Bi:1:108:1 -115 13 <
ffff9639a63cd780 1538345151 C Bi:1:108:1 0 13 = 55534253 32010000 00000000 00
ffff9639a63cd780 1538345196 S Bo:1:108:2 -115 31 = 55534243 33010000 00020000 80000a28 0000002d 21000001 00000000 000000
ffff9639a63cd780 1538345277 C Bo:1:108:2 0 31 >
ffff96391de05240 1538345284 S Bi:1:108:1 -115 512 <
ffff96391de05240 1538346040 C Bi:1:108:1 0 512 = 00000000 00000000 00000000 00000000 00000000 00000000 00000000 00000000
ffff9639a63cd780 1538346046 S Bi:1:108:1 -115 13 <
ffff9639a63cd780 1538346162 C Bi:1:108:1 0 13 = 55534253 33010000 00000000 00
ffff9639a63cd780 1538346189 S Bo:1:108:2 -115 31 = 55534243 34010000 00e00100 80000a28 0000002d 220000f0 00000000 000000
ffff9639a63cd780 1538346277 C Bo:1:108:2 0 31 >
ffff9637b5ee7f00 1538346293 S Bi:1:108:1 -115 122880 <
ffff9637b5ee7f00 1538352468 C Bi:1:108:1 0 122880 = 00000000 00000000 00000000 00000000 00000000 00000000 00000000 00000000
ffff9639a63cd780 1538352488 S Bi:1:108:1 -115 13 <
ffff9639a63cd780 1538352527 C Bi:1:108:1 0 13 = 55534253 34010000 00000000 00
ffff9639a63cd780 1538352648 S Bo:1:108:2 -115 31 = 55534243 35010000 001c0000 80000a28 0000002e 1200000e 00000000 000000
ffff9639a63cd780 1538352778 C Bo:1:108:2 0 31 >
ffff96391fddd000 1538352784 S Bi:1:108:1 -115 7168 <
ffff96391fddd000 1538353809 C Bi:1:108:1 0 7168 = 00000000 00000000 00000000 00000000 00000000 00000000 00000000 00000000
ffff9639a63cd780 1538353815 S Bi:1:108:1 -115 13 <
ffff9639a63cd780 1538353930 C Bi:1:108:1 0 13 = 55534253 35010000 00000000 00
ffff9639a63cd780 1538354011 S Bo:1:108:2 -115 31 = 55534243 36010000 00020000 80000a28 0000002e 20000001 00000000 000000
ffff9639a63cd780 1538354152 C Bo:1:108:2 0 31 >
ffff9637b5f9ac00 1538354189 S Bi:1:108:1 -115 512 <
ffff9637b5f9ac00 1538354917 C Bi:1:108:1 0 512 = 00000000 00000000 00000000 00000000 00000000 00000000 00000000 00000000
ffff9639a63cd780 1538354924 S Bi:1:108:1 -115 13 <
ffff9639a63cd780 1538355027 C Bi:1:108:1 0 13 = 55534253 36010000 00000000 00
ffff9639a63cd780 1538355054 S Bo:1:108:2 -115 31 = 55534243 37010000 00020000 80000a28 0000002e 21000001 00000000 000000
ffff9639a63cd780 1538355152 C Bo:1:108:2 0 31 >
ffff96391fddd000 1538355159 S Bi:1:108:1 -115 512 <
ffff96391fddd000 1538355915 C Bi:1:108:1 0 512 = 00000000 00000000 00000000 00000000 00000000 00000000 00000000 00000000
ffff9639a63cd780 1538355921 S Bi:1:108:1 -115 13 <
ffff9639a63cd780 1538356028 C Bi:1:108:1 0 13 = 55534253 37010000 00000000 00
ffff9639a63cd780 1538356052 S Bo:1:108:2 -115 31 = 55534243 38010000 00e00100 80000a28 0000002e 220000f0 00000000 000000
ffff9639a63cd780 1538356152 C Bo:1:108:2 0 31 >
ffff96391fddd000 1538356159 S Bi:1:108:1 -115 122880 <
ffff96391fddd000 1538362344 C Bi:1:108:1 0 122880 = 00000000 00000000 00000000 00000000 00000000 00000000 00000000 00000000
ffff9639a63cd780 1538362359 S Bi:1:108:1 -115 13 <
ffff9639a63cd780 1538362402 C Bi:1:108:1 0 13 = 55534253 38010000 00000000 00
ffff9639a63cd780 1538362479 S Bo:1:108:2 -115 31 = 55534243 39010000 001c0000 80000a28 0000002f 1200000e 00000000 000000
ffff9639a63cd780 1538362527 C Bo:1:108:2 0 31 >
ffff96391fddd000 1538362536 S Bi:1:108:1 -115 7168 <
ffff96391fddd000 1538363544 C Bi:1:108:1 0 7168 = 00000000 00000000 00000000 00000000 00000000 00000000 00000000 00000000
ffff9639a63cd780 1538363555 S Bi:1:108:1 -115 13 <
ffff9639a63cd780 1538363652 C Bi:1:108:1 0 13 = 55534253 39010000 00000000 00
ffff9639a63cd780 1538363721 S Bo:1:108:2 -115 31 = 55534243 3a010000 00020000 80000a28 0000002f 20000001 00000000 000000
ffff9639a63cd780 1538363778 C Bo:1:108:2 0 31 >
ffff9637b5ee7f00 1538363799 S Bi:1:108:1 -115 512 <
ffff9637b5ee7f00 1538364545 C Bi:1:108:1 0 512 = 00000000 00000000 00000000 00000000 00000000 00000000 00000000 00000000
ffff9639a63cd780 1538364561 S Bi:1:108:1 -115 13 <
ffff9639a63cd780 1538364653 C Bi:1:108:1 0 13 = 55534253 3a010000 00000000 00
ffff9639a63cd780 1538364678 S Bo:1:108:2 -115 31 = 55534243 3b010000 00020000 80000a28 0000002f 21000001 00000000 000000
ffff9639a63cd780 1538364778 C Bo:1:108:2 0 31 >
ffff96391fddd900 1538364785 S Bi:1:108:1 -115 512 <
ffff96391fddd900 1538365553 C Bi:1:108:1 0 512 = 00000000 00000000 00000000 00000000 00000000 00000000 00000000 00000000
ffff9639a63cd780 1538365562 S Bi:1:108:1 -115 13 <
ffff9639a63cd780 1538365662 C Bi:1:108:1 0 13 = 55534253 3b010000 00000000 00
ffff9639a63cd780 1538365689 S Bo:1:108:2 -115 31 = 55534243 3c010000 00e00100 80000a28 0000002f 220000f0 00000000 000000
ffff9639a63cd780 1538365779 C Bo:1:108:2 0 31 >
ffff9637b5f9ac00 1538365790 S Bi:1:108:1 -115 122880 <
ffff9637b5f9ac00 1538371956 C Bi:1:108:1 0 122880 = 00000000 00000000 00000000 00000000 00000000 00000000 00000000 00000000
ffff9639a63cd780 1538371981 S Bi:1:108:1 -115 13 <
ffff9639a63cd780 1538372028 C Bi:1:108:1 0 13 = 55534253 3c010000 00000000 00
ffff9639a63cd780 1538372129 S Bo:1:108:2 -115 31 = 55534243 3d010000 001c0000 80000a28 00000030 1200000e 00000000 000000
ffff9639a63cd780 1538372279 C Bo:1:108:2 0 31 >
ffff96391fddd900 1538372287 S Bi:1:108:1 -115 7168 <
ffff96391fddd900 1538373185 C Bi:1:108:1 0 7168 = 01f91300 02f91300 03f91300 04f91300 05f91300 06f91300 07f91300 08f91300
ffff9639a63cd780 1538373194 S Bi:1:108:1 -115 13 <
ffff9639a63cd780 1538373306 C Bi:1:108:1 0 13 = 55534253 3d010000 00000000 00
ffff9639a63cd780 1538373389 S Bo:1:108:2 -115 31 = 55534243 3e010000 00020000 80000a28 00000030 20000001 00000000 000000
ffff9639a63cd780 1538373530 C Bo:1:108:2 0 31 >
ffff96391fddd900 1538373539 S Bi:1:108:1 -115 512 <
ffff96391fddd900 1538374167 C Bi:1:108:1 0 512 = 01001400 02001400 03001400 04001400 05001400 06001400 07001400 08001400
ffff9639a63cd780 1538374175 S Bi:1:108:1 -115 13 <
ffff9639a63cd780 1538374278 C Bi:1:108:1 0 13 = 55534253 3e010000 00000000 00
ffff9639a63cd780 1538374315 S Bo:1:108:2 -115 31 = 55534243 3f010000 00020000 80000a28 00000030 21000001 00000000 000000
ffff9639a63cd780 1538374430 C Bo:1:108:2 0 31 >
ffff96391de05240 1538374437 S Bi:1:108:1 -115 512 <
ffff96391de05240 1538375041 C Bi:1:108:1 0 512 = 81001400 82001400 83001400 84001400 85001400 86001400 87001400 88001400
ffff9639a63cd780 1538375047 S Bi:1:108:1 -115 13 <
ffff9639a63cd780 1538375163 C Bi:1:108:1 0 13 = 55534253 3f010000 00000000 00
ffff9639a63cd780 1538375192 S Bo:1:108:2 -115 31 = 55534243 40010000 000a0100 80000a28 00000030 22000085 00000000 000000
ffff9639a63cd780 1538375278 C Bo:1:108:2 0 31 >
ffff96391de05240 1538375286 S Bi:1:108:1 -115 68096 <
ffff96391de05240 1538378827 C Bi:1:108:1 0 68096 = 01011400 02011400 03011400 04011400 05011400 06011400 07011400 08011400
ffff9639a63cd780 1538378836 S Bi:1:108:1 -115 13 <
ffff9639a63cd780 1538378904 C Bi:1:108:1 0 13 = 55534253 40010000 00000000 00
ffff9639a63cd780 1538378960 S Bo:1:108:2 -115 31 = 55534243 41010000 00f00000 80000a28 00000030 a8000078 00000000 000000
ffff9639a63cd780 1538379027 C Bo:1:108:2 0 31 >
ffff96391fddd000 1538379035 S Bi:1:108:1 -115 61440 <
ffff96391fddd000 1538382323 C Bi:1:108:1 0 61440 = 01441400 02441400 03441400 04441400 05441400 06441400 07441400 08441400
ffff9639a63cd780 1538382335 S Bi:1:108:1 -115 13 <
ffff9639a63cd780 1538382403 C Bi:1:108:1 0 13 = 55534253 41010000 00000000 00
ffff9639a63cd780 1538382646 S Bo:1:108:2 -115 31 = 55534243 42010000 00020000 80000a28 00000031 20000001 00000000 000000
ffff9639a63cd780 1538382778 C Bo:1:108:2 0 31 >
ffff96391fddd000 1538382787 S Bi:1:108:1 -115 512 <
ffff96391fddd000 1538383416 C Bi:1:108:1 0 512 = 00000000 00000000 00000000 00000000 00000000 00000000 00000000 00000000
ffff9639a63cd780 1538383437 S Bi:1:108:1 -115 13 <
ffff9639a63cd780 1538383528 C Bi:1:108:1 0 13 = 55534253 42010000 00000000 00
ffff9639a63cd780 1538383565 S Bo:1:108:2 -115 31 = 55534243 43010000 00020000 80000a28 00000031 21000001 00000000 000000
ffff9639a63cd780 1538383652 C Bo:1:108:2 0 31 >
ffff9637b5f9ac00 1538383682 S Bi:1:108:1 -115 512 <
ffff9637b5f9ac00 1538384293 C Bi:1:108:1 0 512 = 00000000 00000000 00000000 00000000 00000000 00000000 00000000 00000000
ffff9639a63cd780 1538384324 S Bi:1:108:1 -115 13 <
ffff9639a63cd780 1538384403 C Bi:1:108:1 0 13 = 55534253 43010000 00000000 00
ffff9639a63cd780 1538384452 S Bo:1:108:2 -115 31 = 55534243 44010000 00e00100 80000a28 00000031 220000f0 00000000 000000
ffff9639a63cd780 1538384528 C Bo:1:108:2 0 31 >
ffff96391de056c0 1538384534 S Bi:1:108:1 -115 122880 <
ffff96391de056c0 1538390651 C Bi:1:108:1 0 122880 = 00000000 00000000 00000000 00000000 00000000 00000000 00000000 00000000
ffff9639a63cd780 1538390658 S Bi:1:108:1 -115 13 <
ffff9639a63cd780 1538390777 C Bi:1:108:1 0 13 = 55534253 44010000 00000000 00
ffff9639a63cd780 1538390861 S Bo:1:108:2 -115 31 = 55534243 45010000 001c0000 80000a28 00000032 1200000e 00000000 000000
ffff9639a63cd780 1538390902 C Bo:1:108:2 0 31 >
ffff96391fddd900 1538390910 S Bi:1:108:1 -115 7168 <
ffff96391fddd900 1538391906 C Bi:1:108:1 0 7168 = 00000000 00000000 00000000 00000000 00000000 00000000 00000000 00000000
ffff9639a63cd780 1538391916 S Bi:1:108:1 -115 13 <
ffff9639a63cd780 1538392028 C Bi:1:108:1 0 13 = 55534253 45010000 00000000 00
ffff9639a63cd780 1538392095 S Bo:1:108:2 -115 31 = 55534243 46010000 00020000 80000a28 00000032 20000001 00000000 000000
ffff9639a63cd780 1538392151 C Bo:1:108:2 0 31 >
ffff96391fddd900 1538392157 S Bi:1:108:1 -115 512 <
ffff96391fddd900 1538392915 C Bi:1:108:1 0 512 = 00000000 00000000 00000000 00000000 00000000 00000000 00000000 00000000
ffff9639a63cd780 1538392928 S Bi:1:108:1 -115 13 <
ffff9639a63cd780 1538393037 C Bi:1:108:1 0 13 = 55534253 46010000 00000000 00
ffff9639a63cd780 1538393063 S Bo:1:108:2 -115 31 = 55534243 47010000 00020000 80000a28 00000032 21000001 00000000 000000
ffff9639a63cd780 1538393151 C Bo:1:108:2 0 31 >
ffff9637b5ee7300 1538393166 S Bi:1:108:1 -115 512 <
ffff9637b5ee7300 1538393790 C Bi:1:108:1 0 512 = 00000000 00000000 00000000 00000000 00000000 00000000 00000000 00000000
ffff9639a63cd780 1538393806 S Bi:1:108:1 -115 13 <
ffff9639a63cd780 1538393901 C Bi:1:108:1 0 13 = 55534253 47010000 00000000 00
ffff9639a63cd780 1538393931 S Bo:1:108:2 -115 31 = 55534243 48010000 00e00100 80000a28 00000032 220000f0 00000000 000000
ffff9639a63cd780 1538394026 C Bo:1:108:2 0 31 >
ffff96391fddd000 1538394031 S Bi:1:108:1 -115 122880 <
ffff96391fddd000 1538400144 C Bi:1:108:1 0 122880 = 00000000 00000000 00000000 00000000 00000000 00000000 00000000 00000000
ffff9639a63cd780 1538400153 S Bi:1:108:1 -115 13 <
ffff9639a63cd780 1538400281 C Bi:1:108:1 0 13 = 55534253 48010000 00000000 00
ffff9639a63cd780 1538400570 S Bo:1:108:2 -115 31 = 55534243 49010000 001c0000 80000a28 00000033 1200000e 00000000 000000
ffff9639a63cd780 1538400666 C Bo:1:108:2 0 31 >
ffff96391fddd000 1538400698 S Bi:1:108:1 -115 7168 <
ffff96391fddd000 1538401543 C Bi:1:108:1 0 7168 = 00000000 00000000 00000000 00000000 00000000 00000000 00000000 00000000
ffff9639a63cd780 1538401551 S Bi:1:108:1 -115 13 <
ffff9639a63cd780 1538401651 C Bi:1:108:1 0 13 = 55534253 49010000 00000000 00
ffff9639a63cd780 1538401752 S Bo:1:108:2 -115 31 = 55534243 4a010000 00020000 80000a28 00000033 20000001 00000000 000000
ffff9639a63cd780 1538401905 C Bo:1:108:2 0 31 >
ffff96391fddd000 1538401917 S Bi:1:108:1 -115 512 <
ffff96391fddd000 1538402553 C Bi:1:108:1 0 512 = 00000000 00000000 00000000 00000000 00000000 00000000 00000000 00000000
ffff9639a63cd780 1538402562 S Bi:1:108:1 -115 13 <
ffff9639a63cd780 1538402680 C Bi:1:108:1 0 13 = 55534253 4a010000 00000000 00
ffff9639a63cd780 1538402707 S Bo:1:108:2 -115 31 = 55534243 4b010000 00020000 80000a28 00000033 21000001 00000000 000000
ffff9639a63cd780 1538402787 C Bo:1:108:2 0 31 >
ffff96391de056c0 1538402795 S Bi:1:108:1 -115 512 <
ffff96391de056c0 1538403553 C Bi:1:108:1 0 512 = 00000000 00000000 00000000 00000000 00000000 00000000 00000000 00000000
ffff9639a63cd780 1538403560 S Bi:1:108:1 -115 13 <
ffff9639a63cd780 1538403661 C Bi:1:108:1 0 13 = 55534253 4b010000 00000000 00
ffff9639a63cd780 1538403686 S Bo:1:108:2 -115 31 = 55534243 4c010000 00e00100 80000a28 00000033 220000f0 00000000 000000
ffff9639a63cd780 1538403777 C Bo:1:108:2 0 31 >
ffff96391de056c0 1538403784 S Bi:1:108:1 -115 122880 <
ffff96391de056c0 1538409737 C Bi:1:108:1 0 122880 = 00000000 00000000 00000000 00000000 00000000 00000000 00000000 00000000
ffff9639a63cd780 1538409745 S Bi:1:108:1 -115 13 <
ffff9639a63cd780 1538409776 C Bi:1:108:1 0 13 = 55534253 4c010000 00000000 00
ffff9639a63cd780 1538409893 S Bo:1:108:2 -115 31 = 55534243 4d010000 001c0000 80000a28 00000034 1200000e 00000000 000000
ffff9639a63cd780 1538410042 C Bo:1:108:2 0 31 >
ffff9637b5f9ac00 1538410056 S Bi:1:108:1 -115 7168 <
ffff9637b5f9ac00 1538410908 C Bi:1:108:1 0 7168 = 00000000 00000000 00000000 00000000 00000000 00000000 00000000 00000000
ffff9639a63cd780 1538410939 S Bi:1:108:1 -115 13 <
ffff9639a63cd780 1538411027 C Bi:1:108:1 0 13 = 55534253 4d010000 00000000 00
ffff9639a63cd780 1538411132 S Bo:1:108:2 -115 31 = 55534243 4e010000 00020000 80000a28 00000034 20000001 00000000 000000
ffff9639a63cd780 1538411280 C Bo:1:108:2 0 31 >
ffff96391fddd900 1538411295 S Bi:1:108:1 -115 512 <
ffff96391fddd900 1538411916 C Bi:1:108:1 0 512 = 00000000 00000000 00000000 00000000 00000000 00000000 00000000 00000000
ffff9639a63cd780 1538411923 S Bi:1:108:1 -115 13 <
ffff9639a63cd780 1538412056 C Bi:1:108:1 0 13 = 55534253 4e010000 00000000 00
ffff9639a63cd780 1538412083 S Bo:1:108:2 -115 31 = 55534243 4f010000 00020000 80000a28 00000034 21000001 00000000 000000
ffff9639a63cd780 1538412152 C Bo:1:108:2 0 31 >
ffff96391de056c0 1538412160 S Bi:1:108:1 -115 512 <
ffff96391de056c0 1538412903 C Bi:1:108:1 0 512 = 00000000 00000000 00000000 00000000 00000000 00000000 00000000 00000000
ffff9639a63cd780 1538412909 S Bi:1:108:1 -115 13 <
ffff9639a63cd780 1538413027 C Bi:1:108:1 0 13 = 55534253 4f010000 00000000 00
ffff9639a63cd780 1538413051 S Bo:1:108:2 -115 31 = 55534243 50010000 00e00100 80000a28 00000034 220000f0 00000000 000000
ffff9639a63cd780 1538413153 C Bo:1:108:2 0 31 >
ffff96391fddd900 1538413161 S Bi:1:108:1 -115 122880 <
ffff96391fddd900 1538419214 C Bi:1:108:1 0 122880 = 00000000 00000000 00000000 00000000 00000000 00000000 00000000 00000000
ffff9639a63cd780 1538419221 S Bi:1:108:1 -115 13 <
ffff9639a63cd780 1538419285 C Bi:1:108:1 0 13 = 55534253 50010000 00000000 00
ffff9639a63cd780 1538419374 S Bo:1:108:2 -115 31 = 55534243 51010000 001c0000 80000a28 00000035 1200000e 00000000 000000
ffff9639a63cd780 1538419405 C Bo:1:108:2 0 31 >
ffff96391fddd900 1538419417 S Bi:1:108:1 -115 7168 <
ffff96391fddd900 1538420429 C Bi:1:108:1 0 7168 = 00000000 00000000 00000000 00000000 00000000 00000000 00000000 00000000
ffff9639a63cd780 1538420441 S Bi:1:108:1 -115 13 <
ffff9639a63cd780 1538420549 C Bi:1:108:1 0 13 = 55534253 51010000 00000000 00
ffff9639a63cd780 1538420645 S Bo:1:108:2 -115 31 = 55534243 52010000 00020000 80000a28 00000035 20000001 00000000 000000
ffff9639a63cd780 1538420778 C Bo:1:108:2 0 31 >
ffff96391fddd900 1538420786 S Bi:1:108:1 -115 512 <
ffff96391fddd900 1538421423 C Bi:1:108:1 0 512 = 00000000 00000000 00000000 00000000 00000000 00000000 00000000 00000000
ffff9639a63cd780 1538421434 S Bi:1:108:1 -115 13 <
ffff9639a63cd780 1538421529 C Bi:1:108:1 0 13 = 55534253 52010000 00000000 00
ffff9639a63cd780 1538421560 S Bo:1:108:2 -115 31 = 55534243 53010000 00020000 80000a28 00000035 21000001 00000000 000000
ffff9639a63cd780 1538421653 C Bo:1:108:2 0 31 >
ffff9637b5f9ac00 1538421683 S Bi:1:108:1 -115 512 <
ffff9637b5f9ac00 1538422293 C Bi:1:108:1 0 512 = 00000000 00000000 00000000 00000000 00000000 00000000 00000000 00000000
ffff9639a63cd780 1538422305 S Bi:1:108:1 -115 13 <
ffff9639a63cd780 1538422403 C Bi:1:108:1 0 13 = 55534253 53010000 00000000 00
ffff9639a63cd780 1538422453 S Bo:1:108:2 -115 31 = 55534243 54010000 00e00100 80000a28 00000035 220000f0 00000000 000000
ffff9639a63cd780 1538422527 C Bo:1:108:2 0 31 >
ffff96391de056c0 1538422532 S Bi:1:108:1 -115 122880 <
ffff96391de056c0 1538428590 C Bi:1:108:1 0 122880 = 00000000 00000000 00000000 00000000 00000000 00000000 00000000 00000000
ffff9639a63cd780 1538428598 S Bi:1:108:1 -115 13 <
ffff9639a63cd780 1538428652 C Bi:1:108:1 0 13 = 55534253 54010000 00000000 00
ffff9639a63cd780 1538428743 S Bo:1:108:2 -115 31 = 55534243 55010000 001c0000 80000a28 00000036 1200000e 00000000 000000
ffff9639a63cd780 1538428779 C Bo:1:108:2 0 31 >
ffff9637b5ee7300 1538428791 S Bi:1:108:1 -115 7168 <
ffff9637b5ee7300 1538429796 C Bi:1:108:1 0 7168 = 00000000 00000000 00000000 00000000 00000000 00000000 00000000 00000000
ffff9639a63cd780 1538429805 S Bi:1:108:1 -115 13 <
ffff9639a63cd780 1538429912 C Bi:1:108:1 0 13 = 55534253 55010000 00000000 00
ffff9639a63cd780 1538430041 S Bo:1:108:2 -115 31 = 55534243 56010000 00020000 80000a28 00000036 20000001 00000000 000000
ffff9639a63cd780 1538430181 C Bo:1:108:2 0 31 >
ffff9637b5ee7300 1538430205 S Bi:1:108:1 -115 512 <
ffff9637b5ee7300 1538430781 C Bi:1:108:1 0 512 = 00000000 00000000 00000000 00000000 00000000 00000000 00000000 00000000
ffff9639a63cd780 1538430791 S Bi:1:108:1 -115 13 <
ffff9639a63cd780 1538430903 C Bi:1:108:1 0 13 = 55534253 56010000 00000000 00
ffff9639a63cd780 1538430936 S Bo:1:108:2 -115 31 = 55534243 57010000 00020000 80000a28 00000036 21000001 00000000 000000
ffff9639a63cd780 1538431028 C Bo:1:108:2 0 31 >
ffff9637b5ee7300 1538431042 S Bi:1:108:1 -115 512 <
ffff9637b5ee7300 1538431667 C Bi:1:108:1 0 512 = 00000000 00000000 00000000 00000000 00000000 00000000 00000000 00000000
ffff9639a63cd780 1538431686 S Bi:1:108:1 -115 13 <
ffff9639a63cd780 1538431777 C Bi:1:108:1 0 13 = 55534253 57010000 00000000 00
ffff9639a63cd780 1538431813 S Bo:1:108:2 -115 31 = 55534243 58010000 00e00100 80000a28 00000036 220000f0 00000000 000000
ffff9639a63cd780 1538431902 C Bo:1:108:2 0 31 >
ffff96391fddd000 1538431908 S Bi:1:108:1 -115 122880 <
ffff96391fddd000 1538437980 C Bi:1:108:1 0 122880 = 00000000 00000000 00000000 00000000 00000000 00000000 00000000 00000000
ffff9639a63cd780 1538437989 S Bi:1:108:1 -115 13 <
ffff9639a63cd780 1538438029 C Bi:1:108:1 0 13 = 55534253 58010000 00000000 00
ffff9639a63cd780 1538438114 S Bo:1:108:2 -115 31 = 55534243 59010000 001c0000 80000a28 00000037 1200000e 00000000 000000
ffff9639a63cd780 1538438155 C Bo:1:108:2 0 31 >
ffff96391de056c0 1538438173 S Bi:1:108:1 -115 7168 <
ffff96391de056c0 1538439171 C Bi:1:108:1 0 7168 = 00000000 00000000 00000000 00000000 00000000 00000000 00000000 00000000
ffff9639a63cd780 1538439182 S Bi:1:108:1 -115 13 <
ffff9639a63cd780 1538439278 C Bi:1:108:1 0 13 = 55534253 59010000 00000000 00
ffff9639a63cd780 1538439343 S Bo:1:108:2 -115 31 = 55534243 5a010000 00020000 80000a28 00000037 20000001 00000000 000000
ffff9639a63cd780 1538439403 C Bo:1:108:2 0 31 >
ffff9637b5f9ac00 1538439409 S Bi:1:108:1 -115 512 <
ffff9637b5f9ac00 1538440159 C Bi:1:108:1 0 512 = 00000000 00000000 00000000 00000000 00000000 00000000 00000000 00000000
ffff9639a63cd780 1538440183 S Bi:1:108:1 -115 13 <
ffff9639a63cd780 1538440290 C Bi:1:108:1 0 13 = 55534253 5a010000 00000000 00
ffff9639a63cd780 1538440314 S Bo:1:108:2 -115 31 = 55534243 5b010000 00020000 80000a28 00000037 21000001 00000000 000000
ffff9639a63cd780 1538440403 C Bo:1:108:2 0 31 >
ffff9637b5f9ac00 1538440427 S Bi:1:108:1 -115 512 <
ffff9637b5f9ac00 1538441029 C Bi:1:108:1 0 512 = 00000000 00000000 00000000 00000000 00000000 00000000 00000000 00000000
ffff9639a63cd780 1538441038 S Bi:1:108:1 -115 13 <
ffff9639a63cd780 1538441152 C Bi:1:108:1 0 13 = 55534253 5b010000 00000000 00
ffff9639a63cd780 1538441178 S Bo:1:108:2 -115 31 = 55534243 5c010000 00e00100 80000a28 00000037 220000f0 00000000 000000
ffff9639a63cd780 1538441277 C Bo:1:108:2 0 31 >
ffff9637b5f9ac00 1538441287 S Bi:1:108:1 -115 122880 <
ffff9637b5f9ac00 1538447345 C Bi:1:108:1 0 122880 = 00000000 00000000 00000000 00000000 00000000 00000000 00000000 00000000
ffff9639a63cd780 1538447355 S Bi:1:108:1 -115 13 <
ffff9639a63cd780 1538447401 C Bi:1:108:1 0 13 = 55534253 5c010000 00000000 00
ffff9639a63cd780 1538447507 S Bo:1:108:2 -115 31 = 55534243 5d010000 001c0000 80000a28 00000038 1200000e 00000000 000000
ffff9639a63cd780 1538447651 C Bo:1:108:2 0 31 >
ffff96391fddd000 1538447659 S Bi:1:108:1 -115 7168 <
ffff96391fddd000 1538448556 C Bi:1:108:1 0 7168 = 00000000 00000000 00000000 00000000 00000000 00000000 00000000 00000000
ffff9639a63cd780 1538448566 S Bi:1:108:1 -115 13 <
ffff9639a63cd780 1538448661 C Bi:1:108:1 0 13 = 55534253 5d010000 00000000 00
ffff9639a63cd780 1538448732 S Bo:1:108:2 -115 31 = 55534243 5e010000 00020000 80000a28 00000038 20000001 00000000 000000
ffff9639a63cd780 1538448778 C Bo:1:108:2 0 31 >
ffff96391fddd000 1538448788 S Bi:1:108:1 -115 512 <
ffff96391fddd000 1538449556 C Bi:1:108:1 0 512 = 00000000 00000000 00000000 00000000 00000000 00000000 00000000 00000000
ffff9639a63cd780 1538449587 S Bi:1:108:1 -115 13 <
ffff9639a63cd780 1538449688 C Bi:1:108:1 0 13 = 55534253 5e010000 00000000 00
ffff9639a63cd780 1538449740 S Bo:1:108:2 -115 31 = 55534243 5f010000 00020000 80000a28 00000038 21000001 00000000 000000
ffff9639a63cd780 1538449776 C Bo:1:108:2 0 31 >
ffff9637b5f9ac00 1538449808 S Bi:1:108:1 -115 512 <
ffff9637b5f9ac00 1538450529 C Bi:1:108:1 0 512 = 00000000 00000000 00000000 00000000 00000000 00000000 00000000 00000000
ffff9639a63cd780 1538450541 S Bi:1:108:1 -115 13 <
ffff9639a63cd780 1538450652 C Bi:1:108:1 0 13 = 55534253 5f010000 00000000 00
ffff9639a63cd780 1538450691 S Bo:1:108:2 -115 31 = 55534243 60010000 00e00100 80000a28 00000038 220000f0 00000000 000000
ffff9639a63cd780 1538450779 C Bo:1:108:2 0 31 >
ffff96391fddd900 1538450786 S Bi:1:108:1 -115 122880 <
ffff96391fddd900 1538456965 C Bi:1:108:1 0 122880 = 00000000 00000000 00000000 00000000 00000000 00000000 00000000 00000000
ffff9639a63cd780 1538456978 S Bi:1:108:1 -115 13 <
ffff9639a63cd780 1538457027 C Bi:1:108:1 0 13 = 55534253 60010000 00000000 00
ffff9639a63cd780 1538457146 S Bo:1:108:2 -115 31 = 55534243 61010000 001c0000 80000a28 00000039 1200000e 00000000 000000
ffff9639a63cd780 1538457290 C Bo:1:108:2 0 31 >
ffff96391fddd900 1538457299 S Bi:1:108:1 -115 7168 <
ffff96391fddd900 1538458311 C Bi:1:108:1 0 7168 = 00000000 00000000 00000000 00000000 00000000 00000000 00000000 00000000
ffff9639a63cd780 1538458341 S Bi:1:108:1 -115 13 <
ffff9639a63cd780 1538458426 C Bi:1:108:1 0 13 = 55534253 61010000 00000000 00
ffff9639a63cd780 1538458528 S Bo:1:108:2 -115 31 = 55534243 62010000 00020000 80000a28 00000039 20000001 00000000 000000
ffff9639a63cd780 1538458655 C Bo:1:108:2 0 31 >
ffff9637b5f9ac00 1538458670 S Bi:1:108:1 -115 512 <
ffff9637b5f9ac00 1538459432 C Bi:1:108:1 0 512 = 00000000 00000000 00000000 00000000 00000000 00000000 00000000 00000000
ffff9639a63cd780 1538459447 S Bi:1:108:1 -115 13 <
ffff9639a63cd780 1538459556 C Bi:1:108:1 0 13 = 55534253 62010000 00000000 00
ffff9639a63cd780 1538459602 S Bo:1:108:2 -115 31 = 55534243 63010000 00020000 80000a28 00000039 21000001 00000000 000000
ffff9639a63cd780 1538459652 C Bo:1:108:2 0 31 >
ffff9637b5f9ac00 1538459663 S Bi:1:108:1 -115 512 <
ffff9637b5f9ac00 1538460541 C Bi:1:108:1 0 512 = 00000000 00000000 00000000 00000000 00000000 00000000 00000000 00000000
ffff9639a63cd780 1538460556 S Bi:1:108:1 -115 13 <
ffff9639a63cd780 1538460653 C Bi:1:108:1 0 13 = 55534253 63010000 00000000 00
ffff9639a63cd780 1538460693 S Bo:1:108:2 -115 31 = 55534243 64010000 00e00100 80000a28 00000039 220000f0 00000000 000000
ffff9639a63cd780 1538460778 C Bo:1:108:2 0 31 >
ffff96391fddd000 1538460786 S Bi:1:108:1 -115 122880 <
ffff96391fddd000 1538466966 C Bi:1:108:1 0 122880 = 00000000 00000000 00000000 00000000 00000000 00000000 00000000 00000000
ffff9639a63cd780 1538466979 S Bi:1:108:1 -115 13 <
ffff9639a63cd780 1538467030 C Bi:1:108:1 0 13 = 55534253 64010000 00000000 00
ffff9639a63cd780 1538467114 S Bo:1:108:2 -115 31 = 55534243 65010000 001c0000 80000a28 0000003a 1200000e 00000000 000000
ffff9639a63cd780 1538467153 C Bo:1:108:2 0 31 >
ffff9637b5f9ac00 1538467174 S Bi:1:108:1 -115 7168 <
ffff9637b5f9ac00 1538468174 C Bi:1:108:1 0 7168 = 00000000 00000000 00000000 00000000 00000000 00000000 00000000 00000000
ffff9639a63cd780 1538468184 S Bi:1:108:1 -115 13 <
ffff9639a63cd780 1538468278 C Bi:1:108:1 0 13 = 55534253 65010000 00000000 00
ffff9639a63cd780 1538468348 S Bo:1:108:2 -115 31 = 55534243 66010000 00020000 80000a28 0000003a 20000001 00000000 000000
ffff9639a63cd780 1538468402 C Bo:1:108:2 0 31 >
ffff96391fddd000 1538468411 S Bi:1:108:1 -115 512 <
ffff96391fddd000 1538469165 C Bi:1:108:1 0 512 = 00000000 00000000 00000000 00000000 00000000 00000000 00000000 00000000
ffff9639a63cd780 1538469182 S Bi:1:108:1 -115 13 <
ffff9639a63cd780 1538469277 C Bi:1:108:1 0 13 = 55534253 66010000 00000000 00
ffff9639a63cd780 1538469316 S Bo:1:108:2 -115 31 = 55534243 67010000 00020000 80000a28 0000003a 21000001 00000000 000000
ffff9639a63cd780 1538469402 C Bo:1:108:2 0 31 >
ffff9637b5ee7300 1538469421 S Bi:1:108:1 -115 512 <
ffff9637b5ee7300 1538470168 C Bi:1:108:1 0 512 = 00000000 00000000 00000000 00000000 00000000 00000000 00000000 00000000
ffff9639a63cd780 1538470177 S Bi:1:108:1 -115 13 <
ffff9639a63cd780 1538470284 C Bi:1:108:1 0 13 = 55534253 67010000 00000000 00
ffff9639a63cd780 1538470317 S Bo:1:108:2 -115 31 = 55534243 68010000 00e00100 80000a28 0000003a 220000f0 00000000 000000
ffff9639a63cd780 1538470415 C Bo:1:108:2 0 31 >
ffff96391de05840 1538470421 S Bi:1:108:1 -115 122880 <
ffff96391de05840 1538476599 C Bi:1:108:1 0 122880 = 00000000 00000000 00000000 00000000 00000000 00000000 00000000 00000000
ffff9639a63cd780 1538476610 S Bi:1:108:1 -115 13 <
ffff9639a63cd780 1538476650 C Bi:1:108:1 0 13 = 55534253 68010000 00000000 00
ffff9639a63cd780 1538476750 S Bo:1:108:2 -115 31 = 55534243 69010000 001c0000 80000a28 0000003b 1200000e 00000000 000000
ffff9639a63cd780 1538476780 C Bo:1:108:2 0 31 >
ffff96391fddd900 1538476788 S Bi:1:108:1 -115 7168 <
ffff96391fddd900 1538477810 C Bi:1:108:1 0 7168 = 00000000 00000000 00000000 00000000 00000000 00000000 00000000 00000000
ffff9639a63cd780 1538477839 S Bi:1:108:1 -115 13 <
ffff9639a63cd780 1538477931 C Bi:1:108:1 0 13 = 55534253 69010000 00000000 00
ffff9639a63cd780 1538478026 S Bo:1:108:2 -115 31 = 55534243 6a010000 00020000 80000a28 0000003b 20000001 00000000 000000
ffff9639a63cd780 1538478153 C Bo:1:108:2 0 31 >
ffff9637b5ee7f00 1538478186 S Bi:1:108:1 -115 512 <
ffff9637b5ee7f00 1538478919 C Bi:1:108:1 0 512 = 00000000 00000000 00000000 00000000 00000000 00000000 00000000 00000000
ffff9639a63cd780 1538478928 S Bi:1:108:1 -115 13 <
ffff9639a63cd780 1538479028 C Bi:1:108:1 0 13 = 55534253 6a010000 00000000 00
ffff9639a63cd780 1538479055 S Bo:1:108:2 -115 31 = 55534243 6b010000 00020000 80000a28 0000003b 21000001 00000000 000000
ffff9639a63cd780 1538479152 C Bo:1:108:2 0 31 >
ffff96391fddd900 1538479159 S Bi:1:108:1 -115 512 <
ffff96391fddd900 1538479906 C Bi:1:108:1 0 512 = 00000000 00000000 00000000 00000000 00000000 00000000 00000000 00000000
ffff9639a63cd780 1538479914 S Bi:1:108:1 -115 13 <
ffff9639a63cd780 1538480036 C Bi:1:108:1 0 13 = 55534253 6b010000 00000000 00
ffff9639a63cd780 1538480098 S Bo:1:108:2 -115 31 = 55534243 6c010000 00e00100 80000a28 0000003b 220000f0 00000000 000000
ffff9639a63cd780 1538480166 C Bo:1:108:2 0 31 >
ffff9637b5f9ac00 1538480183 S Bi:1:108:1 -115 122880 <
ffff9637b5f9ac00 1538486346 C Bi:1:108:1 0 122880 = 00000000 00000000 00000000 00000000 00000000 00000000 00000000 00000000
ffff9639a63cd780 1538486356 S Bi:1:108:1 -115 13 <
ffff9639a63cd780 1538486406 C Bi:1:108:1 0 13 = 55534253 6c010000 00000000 00
ffff9639a63cd780 1538486523 S Bo:1:108:2 -115 31 = 55534243 6d010000 001c0000 80000a28 0000003c 1200000e 00000000 000000
ffff9639a63cd780 1538486654 C Bo:1:108:2 0 31 >
ffff96391fddd900 1538486661 S Bi:1:108:1 -115 7168 <
ffff96391fddd900 1538487671 C Bi:1:108:1 0 7168 = 01f91900 02f91900 03f91900 04f91900 05f91900 06f91900 07f91900 08f91900
ffff9639a63cd780 1538487681 S Bi:1:108:1 -115 13 <
ffff9639a63cd780 1538487788 C Bi:1:108:1 0 13 = 55534253 6d010000 00000000 00
ffff9639a63cd780 1538487861 S Bo:1:108:2 -115 31 = 55534243 6e010000 00020000 80000a28 0000003c 20000001 00000000 000000
ffff9639a63cd780 1538487906 C Bo:1:108:2 0 31 >
ffff9637b5ee7f00 1538487922 S Bi:1:108:1 -115 512 <
ffff9637b5ee7f00 1538488667 C Bi:1:108:1 0 512 = 01001a00 02001a00 03001a00 04001a00 05001a00 06001a00 07001a00 08001a00
ffff9639a63cd780 1538488682 S Bi:1:108:1 -115 13 <
ffff9639a63cd780 1538488779 C Bi:1:108:1 0 13 = 55534253 6e010000 00000000 00
ffff9639a63cd780 1538488814 S Bo:1:108:2 -115 31 = 55534243 6f010000 00020000 80000a28 0000003c 21000001 00000000 000000
ffff9639a63cd780 1538488903 C Bo:1:108:2 0 31 >
ffff96391fddd000 1538488909 S Bi:1:108:1 -115 512 <
ffff96391fddd000 1538489668 C Bi:1:108:1 0 512 = 81001a00 82001a00 83001a00 84001a00 85001a00 86001a00 87001a00 88001a00
ffff9639a63cd780 1538489676 S Bi:1:108:1 -115 13 <
ffff9639a63cd780 1538489777 C Bi:1:108:1 0 13 = 55534253 6f010000 00000000 00
ffff9639a63cd780 1538489805 S Bo:1:108:2 -115 31 = 55534243 70010000 00e00100 80000a28 0000003c 220000f0 00000000 000000
ffff9639a63cd780 1538489903 C Bo:1:108:2 0 31 >
ffff96391de05840 1538489910 S Bi:1:108:1 -115 122880 <
ffff96391de05840 1538496083 C Bi:1:108:1 0 122880 = 01011a00 02011a00 03011a00 04011a00 05011a00 06011a00 07011a00 08011a00
ffff9639a63cd780 1538496093 S Bi:1:108:1 -115 13 <
ffff9639a63cd780 1538496155 C Bi:1:108:1 0 13 = 55534253 70010000 00000000 00
ffff9639a63cd780 1538496256 S Bo:1:108:2 -115 31 = 55534243 71010000 001c0000 80000a28 0000003d 1200000e 00000000 000000
ffff9639a63cd780 1538496404 C Bo:1:108:2 0 31 >
ffff96391fddd000 1538496413 S Bi:1:108:1 -115 7168 <
ffff96391fddd000 1538497320 C Bi:1:108:1 0 7168 = 01791a00 02791a00 03791a00 04791a00 05791a00 06791a00 07791a00 08791a00
ffff9639a63cd780 1538497331 S Bi:1:108:1 -115 13 <
ffff9639a63cd780 1538497434 C Bi:1:108:1 0 13 = 55534253 71010000 00000000 00
ffff9639a63cd780 1538497525 S Bo:1:108:2 -115 31 = 55534243 72010000 00020000 80000a28 0000003d 20000001 00000000 000000
ffff9639a63cd780 1538497654 C Bo:1:108:2 0 31 >
ffff96391de05840 1538497663 S Bi:1:108:1 -115 512 <
ffff96391de05840 1538498420 C Bi:1:108:1 0 512 = 01801a00 02801a00 03801a00 04801a00 05801a00 06801a00 07801a00 08801a00
ffff9639a63cd780 1538498427 S Bi:1:108:1 -115 13 <
ffff9639a63cd780 1538498555 C Bi:1:108:1 0 13 = 55534253 72010000 00000000 00
ffff9639a63cd780 1538498601 S Bo:1:108:2 -115 31 = 55534243 73010000 00020000 80000a28 0000003d 21000001 00000000 000000
ffff9639a63cd780 1538498664 C Bo:1:108:2 0 31 >
ffff96391fddd000 1538498671 S Bi:1:108:1 -115 512 <
ffff96391fddd000 1538499417 C Bi:1:108:1 0 512 = 81801a00 82801a00 83801a00 84801a00 85801a00 86801a00 87801a00 88801a00
ffff9639a63cd780 1538499421 S Bi:1:108:1 -115 13 <
ffff9639a63cd780 1538499528 C Bi:1:108:1 0 13 = 55534253 73010000 00000000 00
ffff9639a63cd780 1538499552 S Bo:1:108:2 -115 31 = 55534243 74010000 00e00100 80000a28 0000003d 220000f0 00000000 000000
ffff9639a63cd780 1538499653 C Bo:1:108:2 0 31 >
ffff9637b5f9ac00 1538499672 S Bi:1:108:1 -115 122880 <
ffff9637b5f9ac00 1538505842 C Bi:1:108:1 0 122880 = 01811a00 02811a00 03811a00 04811a00 05811a00 06811a00 07811a00 08811a00
ffff9639a63cd780 1538505859 S Bi:1:108:1 -115 13 <
ffff9639a63cd780 1538505900 C Bi:1:108:1 0 13 = 55534253 74010000 00000000 00
ffff9639a63cd780 1538506017 S Bo:1:108:2 -115 31 = 55534243 75010000 001c0000 80000a28 0000003e 1200000e 00000000 000000
ffff9639a63cd780 1538506162 C Bo:1:108:2 0 31 >
ffff96391fddd000 1538506176 S Bi:1:108:1 -115 7168 <
ffff96391fddd000 1538507056 C Bi:1:108:1 0 7168 = 01f91a00 02f91a00 03f91a00 04f91a00 05f91a00 06f91a00 07f91a00 08f91a00
ffff9639a63cd780 1538507065 S Bi:1:108:1 -115 13 <
ffff9639a63cd780 1538507161 C Bi:1:108:1 0 13 = 55534253 75010000 00000000 00
ffff9639a63cd780 1538507239 S Bo:1:108:2 -115 31 = 55534243 76010000 00020000 80000a28 0000003e 20000001 00000000 000000
ffff9639a63cd780 1538507277 C Bo:1:108:2 0 31 >
ffff96391fddd900 1538507299 S Bi:1:108:1 -115 512 <
ffff96391fddd900 1538508030 C Bi:1:108:1 0 512 = 01001b00 02001b00 03001b00 04001b00 05001b00 06001b00 07001b00 08001b00
ffff9639a63cd780 1538508042 S Bi:1:108:1 -115 13 <
ffff9639a63cd780 1538508180 C Bi:1:108:1 0 13 = 55534253 76010000 00000000 00
ffff9639a63cd780 1538508220 S Bo:1:108:2 -115 31 = 55534243 77010000 00020000 80000a28 0000003e 21000001 00000000 000000
ffff9639a63cd780 1538508277 C Bo:1:108:2 0 31 >
ffff9637b5ee7f00 1538508307 S Bi:1:108:1 -115 512 <
ffff9637b5ee7f00 1538509040 C Bi:1:108:1 0 512 = 81001b00 82001b00 83001b00 84001b00 85001b00 86001b00 87001b00 88001b00
ffff9639a63cd780 1538509049 S Bi:1:108:1 -115 13 <
ffff9639a63cd780 1538509181 C Bi:1:108:1 0 13 = 55534253 77010000 00000000 00
ffff9639a63cd780 1538509237 S Bo:1:108:2 -115 31 = 55534243 78010000 00e00100 80000a28 0000003e 220000f0 00000000 000000
ffff9639a63cd780 1538509277 C Bo:1:108:2 0 31 >
ffff9637b5ee7f00 1538509297 S Bi:1:108:1 -115 122880 <
ffff9637b5ee7f00 1538515472 C Bi:1:108:1 0 122880 = 01011b00 02011b00 03011b00 04011b00 05011b00 06011b00 07011b00 08011b00
ffff9639a63cd780 1538515490 S Bi:1:108:1 -115 13 <
ffff9639a63cd780 1538515526 C Bi:1:108:1 0 13 = 55534253 78010000 00000000 00
ffff9639a63cd780 1538515629 S Bo:1:108:2 -115 31 = 55534243 79010000 001c0000 80000a28 0000003f 1200000e 00000000 000000
ffff9639a63cd780 1538515778 C Bo:1:108:2 0 31 >
ffff96391fddd900 1538515800 S Bi:1:108:1 -115 7168 <
ffff96391fddd900 1538516683 C Bi:1:108:1 0 7168 = 01791b00 02791b00 03791b00 04791b00 05791b00 06791b00 07791b00 08791b00
ffff9639a63cd780 1538516692 S Bi:1:108:1 -115 13 <
ffff9639a63cd780 1538516798 C Bi:1:108:1 0 13 = 55534253 79010000 00000000 00
ffff9639a63cd780 1538516876 S Bo:1:108:2 -115 31 = 55534243 7a010000 00020000 80000a28 0000003f 20000001 00000000 000000
ffff9639a63cd780 1538516901 C Bo:1:108:2 0 31 >
ffff96391fddd900 1538516906 S Bi:1:108:1 -115 512 <
ffff96391fddd900 1538517792 C Bi:1:108:1 0 512 = 01801b00 02801b00 03801b00 04801b00 05801b00 06801b00 07801b00 08801b00
ffff9639a63cd780 1538517797 S Bi:1:108:1 -115 13 <
ffff9639a63cd780 1538517904 C Bi:1:108:1 0 13 = 55534253 7a010000 00000000 00
ffff9639a63cd780 1538517954 S Bo:1:108:2 -115 31 = 55534243 7b010000 00020000 80000a28 0000003f 21000001 00000000 000000
ffff9639a63cd780 1538518027 C Bo:1:108:2 0 31 >
ffff96391fddd900 1538518031 S Bi:1:108:1 -115 512 <
ffff96391fddd900 1538518792 C Bi:1:108:1 0 512 = 81801b00 82801b00 83801b00 84801b00 85801b00 86801b00 87801b00 88801b00
ffff9639a63cd780 1538518796 S Bi:1:108:1 -115 13 <
ffff9639a63cd780 1538518902 C Bi:1:108:1 0 13 = 55534253 7b010000 00000000 00
ffff9639a63cd780 1538518927 S Bo:1:108:2 -115 31 = 55534243 7c010000 00e00100 80000a28 0000003f 220000f0 00000000 000000
ffff9639a63cd780 1538519027 C Bo:1:108:2 0 31 >
ffff9637b5f9ac00 1538519041 S Bi:1:108:1 -115 122880 <
ffff9637b5f9ac00 1538525227 C Bi:1:108:1 0 122880 = 01811b00 02811b00 03811b00 04811b00 05811b00 06811b00 07811b00 08811b00
ffff9639a63cd780 1538525240 S Bi:1:108:1 -115 13 <
ffff9639a63cd780 1538525278 C Bi:1:108:1 0 13 = 55534253 7c010000 00000000 00
ffff9639a63cd780 1538525385 S Bo:1:108:2 -115 31 = 55534243 7d010000 001c0000 80000a28 00000040 1200000e 00000000 000000
ffff9639a63cd780 1538525531 C Bo:1:108:2 0 31 >
ffff96391fddd900 1538525541 S Bi:1:108:1 -115 7168 <
ffff96391fddd900 1538526570 C Bi:1:108:1 0 7168 = 01f91b00 02f91b00 03f91b00 04f91b00 05f91b00 06f91b00 07f91b00 08f91b00
ffff9639a63cd780 1538526582 S Bi:1:108:1 -115 13 <
ffff9639a63cd780 1538526680 C Bi:1:108:1 0 13 = 55534253 7d010000 00000000 00
ffff9639a63cd780 1538526775 S Bo:1:108:2 -115 31 = 55534243 7e010000 00020000 80000a28 00000040 20000001 00000000 000000
ffff9639a63cd780 1538526908 C Bo:1:108:2 0 31 >
ffff96391fddd000 1538526920 S Bi:1:108:1 -115 512 <
ffff96391fddd000 1538527682 C Bi:1:108:1 0 512 = 01001c00 02001c00 03001c00 04001c00 05001c00 06001c00 07001c00 08001c00
ffff9639a63cd780 1538527690 S Bi:1:108:1 -115 13 <
ffff9639a63cd780 1538527805 C Bi:1:108:1 0 13 = 55534253 7e010000 00000000 00
ffff9639a63cd780 1538527855 S Bo:1:108:2 -115 31 = 55534243 7f010000 00020000 80000a28 00000040 21000001 00000000 000000
ffff9639a63cd780 1538527902 C Bo:1:108:2 0 31 >
ffff96391de053c0 1538527909 S Bi:1:108:1 -115 512 <
ffff96391de053c0 1538528668 C Bi:1:108:1 0 512 = 81001c00 82001c00 83001c00 84001c00 85001c00 86001c00 87001c00 88001c00
ffff9639a63cd780 1538528675 S Bi:1:108:1 -115 13 <
ffff9639a63cd780 1538528777 C Bi:1:108:1 0 13 = 55534253 7f010000 00000000 00
ffff9639a63cd780 1538528798 S Bo:1:108:2 -115 31 = 55534243 80010000 00e00100 80000a28 00000040 220000f0 00000000 000000
ffff9639a63cd780 1538528902 C Bo:1:108:2 0 31 >
ffff96391de053c0 1538528909 S Bi:1:108:1 -115 122880 <
ffff96391de053c0 1538534969 C Bi:1:108:1 0 122880 = 01011c00 02011c00 03011c00 04011c00 05011c00 06011c00 07011c00 08011c00
ffff9639a63cd780 1538534979 S Bi:1:108:1 -115 13 <
ffff9639a63cd780 1538535027 C Bi:1:108:1 0 13 = 55534253 80010000 00000000 00
ffff9639a63cd780 1538535154 S Bo:1:108:2 -115 31 = 55534243 81010000 001c0000 80000a28 00000041 1200000e 00000000 000000
ffff9639a63cd780 1538535278 C Bo:1:108:2 0 31 >
ffff9637b5ee7f00 1538535311 S Bi:1:108:1 -115 7168 <
ffff9637b5ee7f00 1538536297 C Bi:1:108:1 0 7168 = 01791c00 02791c00 03791c00 04791c00 05791c00 06791c00 07791c00 08791c00
ffff9639a63cd780 1538536304 S Bi:1:108:1 -115 13 <
ffff9639a63cd780 1538536404 C Bi:1:108:1 0 13 = 55534253 81010000 00000000 00
ffff9639a63cd780 1538536467 S Bo:1:108:2 -115 31 = 55534243 82010000 00020000 80000a28 00000041 20000001 00000000 000000
ffff9639a63cd780 1538536531 C Bo:1:108:2 0 31 >
ffff96391fddd000 1538536560 S Bi:1:108:1 -115 512 <
ffff96391fddd000 1538537294 C Bi:1:108:1 0 512 = 01801c00 02801c00 03801c00 04801c00 05801c00 06801c00 07801c00 08801c00
ffff9639a63cd780 1538537300 S Bi:1:108:1 -115 13 <
ffff9639a63cd780 1538537413 C Bi:1:108:1 0 13 = 55534253 82010000 00000000 00
ffff9639a63cd780 1538537442 S Bo:1:108:2 -115 31 = 55534243 83010000 00020000 80000a28 00000041 21000001 00000000 000000
ffff9639a63cd780 1538537537 C Bo:1:108:2 0 31 >
ffff9637b5ee7300 1538537548 S Bi:1:108:1 -115 512 <
ffff9637b5ee7300 1538538292 C Bi:1:108:1 0 512 = 81801c00 82801c00 83801c00 84801c00 85801c00 86801c00 87801c00 88801c00
ffff9639a63cd780 1538538299 S Bi:1:108:1 -115 13 <
ffff9639a63cd780 1538538402 C Bi:1:108:1 0 13 = 55534253 83010000 00000000 00
ffff9639a63cd780 1538538440 S Bo:1:108:2 -115 31 = 55534243 84010000 00540000 80000a28 00000041 2200002a 00000000 000000
ffff9639a63cd780 1538538527 C Bo:1:108:2 0 31 >
ffff96391fddd900 1538538533 S Bi:1:108:1 -115 21504 <
ffff96391fddd900 1538540202 C Bi:1:108:1 0 21504 = 01811c00 02811c00 03811c00 04811c00 05811c00 06811c00 07811c00 08811c00
ffff9639a63cd780 1538540229 S Bi:1:108:1 -115 13 <
ffff9639a63cd780 1538540291 C Bi:1:108:1 0 13 = 55534253 84010000 00000000 00
ffff9639a63cd780 1538540345 S Bo:1:108:2 -115 31 = 55534243 85010000 00e60000 80000a28 00000041 4d000073 00000000 000000
ffff9639a63cd780 1538540405 C Bo:1:108:2 0 31 >
ffff9637b5ee7300 1538540428 S Bi:1:108:1 -115 58880 <
ffff9637b5ee7300 1538543708 C Bi:1:108:1 0 58880 = 81961c00 82961c00 83961c00 84961c00 85961c00 86961c00 87961c00 88961c00
ffff9639a63cd780 1538543717 S Bi:1:108:1 -115 13 <
ffff9639a63cd780 1538543784 C Bi:1:108:1 0 13 = 55534253 85010000 00000000 00
ffff9639a63cd780 1539514817 S Bo:1:108:2 -115 31 = 55534243 86010000 00020000 80000a28 000144b6 80000001 00000000 000000
ffff9639a63cd780 1539514909 C Bo:1:108:2 0 31 >
ffff96391fddd900 1539514928 S Bi:1:108:1 -115 512 <
ffff96391fddd900 1539517033 C Bi:1:108:1 0 512 = 2e202020 20202020 20202010 00002a16 64506450 14002a16 6450b443 00000000
ffff9639a63cd780 1539517051 S Bi:1:108:1 -115 13 <
ffff9639a63cd780 1539517158 C Bi:1:108:1 0 13 = 55534253 86010000 00000000 00
ffff9639a63cd780 1539517205 S Bo:1:108:2 -115 31 = 55534243 87010000 00020000 80000a28 000144b6 81000001 00000000 000000
ffff9639a63cd780 1539517280 C Bo:1:108:2 0 31 >
ffff96391fddd900 1539517298 S Bi:1:108:1 -115 512 <
ffff96391fddd900 1539518532 C Bi:1:108:1 0 512 = 042d0064 00650063 006c000f 000c6100 72006100 63006100 6f000000 2e007000
ffff9639a63cd780 1539518552 S Bi:1:108:1 -115 13 <
ffff9639a63cd780 1539518655 C Bi:1:108:1 0 13 = 55534253 87010000 00000000 00
ffff9639a63cd780 1539518682 S Bo:1:108:2 -115 31 = 55534243 88010000 001c0000 80000a28 000144b6 8200000e 00000000 000000
ffff9639a63cd780 1539518779 C Bo:1:108:2 0 31 >
ffff96391fddd900 1539518797 S Bi:1:108:1 -115 7168 <
ffff96391fddd900 1539520411 C Bi:1:108:1 0 7168 = 02520050 0046002d 0041000f 00652d00 32003000 31003900 2d000000 32003000
ffff9639a63cd780 1539520419 S Bi:1:108:1 -115 13 <
ffff9639a63cd780 1539520657 C Bi:1:108:1 0 13 = 55534253 88010000 00000000 00
ffff9639a63cd780 1539520822 S Bo:1:108:2 -115 31 = 55534243 89010000 00020000 80000a28 00002f8f 40000001 00000000 000000
ffff9639a63cd780 1539520906 C Bo:1:108:2 0 31 >
ffff96391fddd900 1539520930 S Bi:1:108:1 -115 512 <
ffff96391fddd900 1539523160 C Bi:1:108:1 0 512 = 2e202020 20202020 20202010 0000199f 644f644f 0200199f 644f40f1 00000000
ffff9639a63cd780 1539523209 S Bi:1:108:1 -115 13 <
ffff9639a63cd780 1539523280 C Bi:1:108:1 0 13 = 55534253 89010000 00000000 00
ffff9639a63cd780 1539523338 S Bo:1:108:2 -115 31 = 55534243 8a010000 00020000 80000a28 00002f8f 41000001 00000000 000000
ffff9639a63cd780 1539523404 C Bo:1:108:2 0 31 >
ffff96391fddd900 1539523439 S Bi:1:108:1 -115 512 <
ffff96391fddd900 1539525467 C Bi:1:108:1 0 512 = 41610067 00720065 0073000f 00e97300 61006f00 0000ffff ffff0000 ffffffff
ffff9639a63cd780 1539525696 S Bi:1:108:1 -115 13 <
ffff9639a63cd780 1539525779 C Bi:1:108:1 0 13 = 55534253 8a010000 00000000 00
ffff9639a63cd780 1539525925 S Bo:1:108:2 -115 31 = 55534243 8b010000 001c0000 80000a28 00002f8f 4200000e 00000000 000000
ffff9639a63cd780 1539526029 C Bo:1:108:2 0 31 >
ffff96391fddd900 1539526040 S Bi:1:108:1 -115 7168 <
ffff96391fddd900 1539528415 C Bi:1:108:1 0 7168 = 42340038 002e006a 0070000f 00796700 0000ffff ffffffff ffff0000 ffffffff
ffff9639a63cd780 1539528448 S Bi:1:108:1 -115 13 <
ffff9639a63cd780 1539528655 C Bi:1:108:1 0 13 = 55534253 8b010000 00000000 00
ffff9639a63cd780 1539528795 S Bo:1:108:2 -115 31 = 55534243 8c010000 00020000 80000a28 000031f7 b0000001 00000000 000000
ffff9639a63cd780 1539528906 C Bo:1:108:2 0 31 >
ffff96391fddd900 1539528942 S Bi:1:108:1 -115 512 <
ffff96391fddd900 1539530286 C Bi:1:108:1 0 512 = 2e202020 20202020 20202010 0064259f 644f644f 0300259f 644fc717 00000000
ffff9639a63cd780 1539530815 S Bi:1:108:1 -115 13 <
ffff9639a63cd780 1539530904 C Bi:1:108:1 0 13 = 55534253 8c010000 00000000 00
ffff9639a63cd780 1539530941 S Bo:1:108:2 -115 31 = 55534243 8d010000 00020000 80000a28 000031f7 b1000001 00000000 000000
ffff9639a63cd780 1539531028 C Bo:1:108:2 0 31 >
ffff9637b5f9ac00 1539531034 S Bi:1:108:1 -115 512 <
ffff9637b5f9ac00 1539532161 C Bi:1:108:1 0 512 = e543432d 41527e31 475a2020 00644e7b 734f5c50 1500257a 734f49f6 528e1b0c
ffff9639a63cd780 1539532172 S Bi:1:108:1 -115 13 <
ffff9639a63cd780 1539532282 C Bi:1:108:1 0 13 = 55534253 8d010000 00000000 00
ffff9639a63cd780 1539532318 S Bo:1:108:2 -115 31 = 55534243 8e010000 001c0000 80000a28 000031f7 b200000e 00000000 000000
ffff9639a63cd780 1539532406 C Bo:1:108:2 0 31 >
ffff96391fddd000 1539532419 S Bi:1:108:1 -115 7168 <
ffff96391fddd000 1539533915 C Bi:1:108:1 0 7168 = e5610074 00200037 0020000f 00933100 20003100 20005500 6e000000 6f006600
ffff9639a63cd780 1539533928 S Bi:1:108:1 -115 13 <
ffff9639a63cd780 1539534156 C Bi:1:108:1 0 13 = 55534253 8e010000 00000000 00
ffff9639a63cd780 1539534288 S Bo:1:108:2 -115 31 = 55534243 8f010000 00020000 80000a28 000146ba 60000001 00000000 000000
ffff9639a63cd780 1539534402 C Bo:1:108:2 0 31 >
ffff9637b5f9ac00 1539534409 S Bi:1:108:1 -115 512 <
ffff9637b5f9ac00 1539535787 C Bi:1:108:1 0 512 = 2e202020 20202020 20202010 0000836a 69506950 1400836a 6950f263 00000000
ffff9639a63cd780 1539535797 S Bi:1:108:1 -115 13 <
ffff9639a63cd780 1539535904 C Bi:1:108:1 0 13 = 55534253 8f010000 00000000 00
ffff9639a63cd780 1539535937 S Bo:1:108:2 -115 31 = 55534243 90010000 00020000 80000a28 000146ba 61000001 00000000 000000
ffff9639a63cd780 1539536030 C Bo:1:108:2 0 31 >
ffff9637b5f9ac00 1539536066 S Bi:1:108:1 -115 512 <
ffff9637b5f9ac00 1539536909 C Bi:1:108:1 0 512 = 31353733 38317e35 504e4720 0064876a 6950af50 14006004 64501d65 fc2e0300
ffff9639a63cd780 1539536924 S Bi:1:108:1 -115 13 <
ffff9639a63cd780 1539537028 C Bi:1:108:1 0 13 = 55534253 90010000 00000000 00
ffff9639a63cd780 1539537065 S Bo:1:108:2 -115 31 = 55534243 91010000 001c0000 80000a28 000146ba 6200000e 00000000 000000
ffff9639a63cd780 1539537153 C Bo:1:108:2 0 31 >
ffff96399f650240 1539537169 S Bi:1:108:1 -115 7168 <
ffff96399f650240 1539538536 C Bi:1:108:1 0 7168 = 422e0070 006e0067 0000000f 00aeffff ffffffff ffffffff ffff0000 ffffffff
ffff9639a63cd780 1539538564 S Bi:1:108:1 -115 13 <
ffff9639a63cd780 1539538780 C Bi:1:108:1 0 13 = 55534253 91010000 00000000 00
ffff9639a63cd780 1539538907 S Bo:1:108:2 -115 31 = 55534243 92010000 00020000 80000a28 00007862 e0000001 00000000 000000
ffff9639a63cd780 1539539028 C Bo:1:108:2 0 31 >
ffff9637b5f9ac00 1539539036 S Bi:1:108:1 -115 512 <
ffff9637b5f9ac00 1539540450 C Bi:1:108:1 0 512 = 2e202020 20202020 20202010 00008ca0 644f644f 07008ca0 644f7a7e 00000000
ffff9639a63cd780 1539540489 S Bi:1:108:1 -115 13 <
ffff9639a63cd780 1539540539 C Bi:1:108:1 0 13 = 55534253 92010000 00000000 00
ffff9639a63cd780 1539540583 S Bo:1:108:2 -115 31 = 55534243 93010000 00020000 80000a28 00007862 e1000001 00000000 000000
ffff9639a63cd780 1539540656 C Bo:1:108:2 0 31 >
ffff9637b5f9ac00 1539540752 S Bi:1:108:1 -115 512 <
ffff9637b5f9ac00 1539541664 C Bi:1:108:1 0 512 = 042d0073 00790073 0074000f 00f06500 6d002d00 63006100 6c000000 6c007300
ffff9639a63cd780 1539541676 S Bi:1:108:1 -115 13 <
ffff9639a63cd780 1539541780 C Bi:1:108:1 0 13 = 55534253 93010000 00000000 00
ffff9639a63cd780 1539541808 S Bo:1:108:2 -115 31 = 55534243 94010000 001c0000 80000a28 00007862 e200000e 00000000 000000
ffff9639a63cd780 1539541902 C Bo:1:108:2 0 31 >
ffff96399f650240 1539541908 S Bi:1:108:1 -115 7168 <
ffff96399f650240 1539543536 C Bi:1:108:1 0 7168 = 53484d2d 504f7e32 43202020 00008ca0 644faf50 07005a54 a34eb77e 3c040000
ffff9639a63cd780 1539543547 S Bi:1:108:1 -115 13 <
ffff9639a63cd780 1539543654 C Bi:1:108:1 0 13 = 55534253 94010000 00000000 00
ffff9639a63cd780 1539543829 S Bo:1:108:2 -115 31 = 55534243 95010000 00020000 80000a28 0000793a f0000001 00000000 000000
ffff9639a63cd780 1539543903 C Bo:1:108:2 0 31 >
ffff96399f650180 1539543921 S Bi:1:108:1 -115 512 <
ffff96399f650180 1539545169 C Bi:1:108:1 0 512 = 2e202020 20202020 20202010 00008fa0 644f644f 07008fa0 644ffb8b 00000000
ffff9639a63cd780 1539545182 S Bi:1:108:1 -115 13 <
ffff9639a63cd780 1539545279 C Bi:1:108:1 0 13 = 55534253 95010000 00000000 00
ffff9639a63cd780 1539545309 S Bo:1:108:2 -115 31 = 55534243 96010000 00020000 80000a28 0000793a f1000001 00000000 000000
ffff9639a63cd780 1539545403 C Bo:1:108:2 0 31 >
ffff96391de053c0 1539545409 S Bi:1:108:1 -115 512 <
ffff96391de053c0 1539546418 C Bi:1:108:1 0 512 = 00000000 00000000 00000000 00000000 00000000 00000000 00000000 00000000
ffff9639a63cd780 1539546423 S Bi:1:108:1 -115 13 <
ffff9639a63cd780 1539546527 C Bi:1:108:1 0 13 = 55534253 96010000 00000000 00
ffff9639a63cd780 1539546560 S Bo:1:108:2 -115 31 = 55534243 97010000 001c0000 80000a28 0000793a f200000e 00000000 000000
ffff9639a63cd780 1539546653 C Bo:1:108:2 0 31 >
ffff96399f650300 1539546657 S Bi:1:108:1 -115 7168 <
ffff96399f650300 1539548194 C Bi:1:108:1 0 7168 = 00000000 00000000 00000000 00000000 00000000 00000000 00000000 00000000
ffff9639a63cd780 1539548203 S Bi:1:108:1 -115 13 <
ffff9639a63cd780 1539548441 C Bi:1:108:1 0 13 = 55534253 97010000 00000000 00
ffff9639a63cd780 1539548603 S Bo:1:108:2 -115 31 = 55534243 98010000 00020000 80000a28 00007a85 d0000001 00000000 000000
ffff9639a63cd780 1539548687 C Bo:1:108:2 0 31 >
ffff9637b5f9ac00 1539548704 S Bi:1:108:1 -115 512 <
ffff9637b5f9ac00 1539550669 C Bi:1:108:1 0 512 = 2e202020 20202020 20202010 000093a0 644f644f 070093a0 644fa9a0 00000000
ffff9639a63cd780 1539550681 S Bi:1:108:1 -115 13 <
ffff9639a63cd780 1539550777 C Bi:1:108:1 0 13 = 55534253 98010000 00000000 00
ffff9639a63cd780 1539550813 S Bo:1:108:2 -115 31 = 55534243 99010000 00020000 80000a28 00007a85 d1000001 00000000 000000
ffff9639a63cd780 1539550903 C Bo:1:108:2 0 31 >
ffff96391de053c0 1539550909 S Bi:1:108:1 -115 512 <
ffff96391de053c0 1539552558 C Bi:1:108:1 0 512 = 01620061 0063006b 0067000f 00397200 6f007500 6e006400 2e000000 74007800
ffff9639a63cd780 1539552565 S Bi:1:108:1 -115 13 <
ffff9639a63cd780 1539552654 C Bi:1:108:1 0 13 = 55534253 99010000 00000000 00
ffff9639a63cd780 1539552681 S Bo:1:108:2 -115 31 = 55534243 9a010000 001c0000 80000a28 00007a85 d200000e 00000000 000000
ffff9639a63cd780 1539552778 C Bo:1:108:2 0 31 >
ffff96391de053c0 1539552783 S Bi:1:108:1 -115 7168 <
ffff96391de053c0 1539554795 C Bi:1:108:1 0 7168 = 416c006f 00670069 006e000f 00e42e00 74007800 74000000 ffff0000 ffffffff
ffff9639a63cd780 1539554799 S Bi:1:108:1 -115 13 <
ffff9639a63cd780 1539555028 C Bi:1:108:1 0 13 = 55534253 9a010000 00000000 00
ffff9639a63cd780 1539555148 S Bo:1:108:2 -115 31 = 55534243 9b010000 00020000 80000a28 000085cf f0000001 00000000 000000
ffff9639a63cd780 1539555280 C Bo:1:108:2 0 31 >
ffff9637b5ee7300 1539555290 S Bi:1:108:1 -115 512 <
ffff9637b5ee7300 1539556808 C Bi:1:108:1 0 512 = 2e202020 20202020 20202010 0000c9a0 644f644f 0800c9a0 644f4b55 00000000
ffff9639a63cd780 1539556835 S Bi:1:108:1 -115 13 <
ffff9639a63cd780 1539556935 C Bi:1:108:1 0 13 = 55534253 9b010000 00000000 00
ffff9639a63cd780 1539556986 S Bo:1:108:2 -115 31 = 55534243 9c010000 00020000 80000a28 000085cf f1000001 00000000 000000
ffff9639a63cd780 1539557028 C Bo:1:108:2 0 31 >
ffff96399f650300 1539557036 S Bi:1:108:1 -115 512 <
ffff96399f650300 1539558541 C Bi:1:108:1 0 512 = 4373002e 00700064 0066000f 00ff0000 ffffffff ffffffff ffff0000 ffffffff
ffff9639a63cd780 1539558546 S Bi:1:108:1 -115 13 <
ffff9639a63cd780 1539558652 C Bi:1:108:1 0 13 = 55534253 9c010000 00000000 00
ffff9639a63cd780 1539558674 S Bo:1:108:2 -115 31 = 55534243 9d010000 001c0000 80000a28 000085cf f200000e 00000000 000000
ffff9639a63cd780 1539558778 C Bo:1:108:2 0 31 >
ffff96399f650300 1539558787 S Bi:1:108:1 -115 7168 <
ffff96399f650300 1539560810 C Bi:1:108:1 0 7168 = 01630061 00640065 0072000f 00386e00 6f007300 2d006400 6f000000 2d006100
ffff9639a63cd780 1539560816 S Bi:1:108:1 -115 13 <
ffff9639a63cd780 1539560936 C Bi:1:108:1 0 13 = 55534253 9d010000 00000000 00
ffff9639a63cd780 1539561073 S Bo:1:108:2 -115 31 = 55534243 9e010000 00020000 80000a28 0000ad81 f0000001 00000000 000000
ffff9639a63cd780 1539561182 C Bo:1:108:2 0 31 >
ffff9637b5f9ac00 1539561210 S Bi:1:108:1 -115 512 <
ffff9637b5f9ac00 1539562545 C Bi:1:108:1 0 512 = 2e202020 20202020 20202010 00003ca1 644f644f 0a003ca1 644f6bd0 00000000
ffff9639a63cd780 1539562554 S Bi:1:108:1 -115 13 <
ffff9639a63cd780 1539562653 C Bi:1:108:1 0 13 = 55534253 9e010000 00000000 00
ffff9639a63cd780 1539562683 S Bo:1:108:2 -115 31 = 55534243 9f010000 00020000 80000a28 0000ad81 f1000001 00000000 000000
ffff9639a63cd780 1539562778 C Bo:1:108:2 0 31 >
ffff96391de053c0 1539562783 S Bi:1:108:1 -115 512 <
ffff96391de053c0 1539563666 C Bi:1:108:1 0 512 = 00000000 00000000 00000000 00000000 00000000 00000000 00000000 00000000
ffff9639a63cd780 1539563670 S Bi:1:108:1 -115 13 <
ffff9639a63cd780 1539563777 C Bi:1:108:1 0 13 = 55534253 9f010000 00000000 00
ffff9639a63cd780 1539563803 S Bo:1:108:2 -115 31 = 55534243 a0010000 001c0000 80000a28 0000ad81 f200000e 00000000 000000
ffff9639a63cd780 1539563903 C Bo:1:108:2 0 31 >
ffff9637b5ee7300 1539563909 S Bi:1:108:1 -115 7168 <
ffff9637b5ee7300 1539565435 C Bi:1:108:1 0 7168 = 00000000 00000000 00000000 00000000 00000000 00000000 00000000 00000000
ffff9639a63cd780 1539565449 S Bi:1:108:1 -115 13 <
ffff9639a63cd780 1539565555 C Bi:1:108:1 0 13 = 55534253 a0010000 00000000 00
ffff9639a63cd780 1539565664 S Bo:1:108:2 -115 31 = 55534243 a1010000 00020000 80000a28 0000ad82 00000001 00000000 000000
ffff9639a63cd780 1539565807 C Bo:1:108:2 0 31 >
ffff96399f650300 1539565815 S Bi:1:108:1 -115 512 <
ffff96399f650300 1539566416 C Bi:1:108:1 0 512 = 2e202020 20202020 20202010 00003ca1 644f644f 0a003ca1 644f6cd0 00000000
ffff9639a63cd780 1539566420 S Bi:1:108:1 -115 13 <
ffff9639a63cd780 1539566527 C Bi:1:108:1 0 13 = 55534253 a1010000 00000000 00
ffff9639a63cd780 1539566549 S Bo:1:108:2 -115 31 = 55534243 a2010000 00020000 80000a28 0000ad82 01000001 00000000 000000
ffff9639a63cd780 1539566652 C Bo:1:108:2 0 31 >
ffff96399f650300 1539566660 S Bi:1:108:1 -115 512 <
ffff96399f650300 1539567291 C Bi:1:108:1 0 512 = 00000000 00000000 00000000 00000000 00000000 00000000 00000000 00000000
ffff9639a63cd780 1539567298 S Bi:1:108:1 -115 13 <
ffff9639a63cd780 1539567402 C Bi:1:108:1 0 13 = 55534253 a2010000 00000000 00
ffff9639a63cd780 1539567425 S Bo:1:108:2 -115 31 = 55534243 a3010000 001c0000 80000a28 0000ad82 0200000e 00000000 000000
ffff9639a63cd780 1539567528 C Bo:1:108:2 0 31 >
ffff96391de053c0 1539567533 S Bi:1:108:1 -115 7168 <
ffff96391de053c0 1539568807 C Bi:1:108:1 0 7168 = 00000000 00000000 00000000 00000000 00000000 00000000 00000000 00000000
ffff9639a63cd780 1539568814 S Bi:1:108:1 -115 13 <
ffff9639a63cd780 1539569028 C Bi:1:108:1 0 13 = 55534253 a3010000 00000000 00
ffff9639a63cd780 1539569139 S Bo:1:108:2 -115 31 = 55534243 a4010000 00020000 80000a28 0000ad82 20000001 00000000 000000
ffff9639a63cd780 1539569289 C Bo:1:108:2 0 31 >
ffff9637b5ee7300 1539569299 S Bi:1:108:1 -115 512 <
ffff9637b5ee7300 1539569914 C Bi:1:108:1 0 512 = 2e202020 20202020 20202010 00003ca1 644f644f 0a003ca1 644f6ed0 00000000
ffff9639a63cd780 1539569922 S Bi:1:108:1 -115 13 <
ffff9639a63cd780 1539570028 C Bi:1:108:1 0 13 = 55534253 a4010000 00000000 00
ffff9639a63cd780 1539570064 S Bo:1:108:2 -115 31 = 55534243 a5010000 00020000 80000a28 0000ad82 21000001 00000000 000000
ffff9639a63cd780 1539570153 C Bo:1:108:2 0 31 >
ffff96399f650300 1539570158 S Bi:1:108:1 -115 512 <
ffff96399f650300 1539570917 C Bi:1:108:1 0 512 = 03640069 00730074 0073000f 00115f00 61007200 74006600 75000000 6c005f00
ffff9639a63cd780 1539570923 S Bi:1:108:1 -115 13 <
ffff9639a63cd780 1539571028 C Bi:1:108:1 0 13 = 55534253 a5010000 00000000 00
ffff9639a63cd780 1539571050 S Bo:1:108:2 -115 31 = 55534243 a6010000 001c0000 80000a28 0000ad82 2200000e 00000000 000000
ffff9639a63cd780 1539571152 C Bo:1:108:2 0 31 >
ffff96399f650300 1539571165 S Bi:1:108:1 -115 7168 <
ffff96399f650300 1539572560 C Bi:1:108:1 0 7168 = 41524348 49567e33 434f4d20 00643ca1 644faf50 0a00d554 a34e23d4 07ec3300
ffff9639a63cd780 1539572587 S Bi:1:108:1 -115 13 <
ffff9639a63cd780 1539572685 C Bi:1:108:1 0 13 = 55534253 a6010000 00000000 00
ffff9639a63cd780 1539572751 S Bo:1:108:2 -115 31 = 55534243 a7010000 00020000 80000a28 0000b0d0 e0000001 00000000 000000
ffff9639a63cd780 1539572777 C Bo:1:108:2 0 31 >
ffff9637b5ee7300 1539572785 S Bi:1:108:1 -115 512 <
ffff9637b5ee7300 1539573917 C Bi:1:108:1 0 512 = 02740075 002e0063 006f000f 00c46d00 5f007500 62007500 6e000000 74007500
ffff9639a63cd780 1539573926 S Bi:1:108:1 -115 13 <
ffff9639a63cd780 1539574028 C Bi:1:108:1 0 13 = 55534253 a7010000 00000000 00
ffff9639a63cd780 1539574057 S Bo:1:108:2 -115 31 = 55534243 a8010000 00020000 80000a28 0000b0d0 e1000001 00000000 000000
ffff9639a63cd780 1539574155 C Bo:1:108:2 0 31 >
ffff96399f6500c0 1539574161 S Bi:1:108:1 -115 512 <
ffff96399f6500c0 1539575168 C Bi:1:108:1 0 512 = 02740075 002e0063 006f000f 00046d00 5f007500 62007500 6e000000 74007500
ffff9639a63cd780 1539575175 S Bi:1:108:1 -115 13 <
ffff9639a63cd780 1539575288 C Bi:1:108:1 0 13 = 55534253 a8010000 00000000 00
ffff9639a63cd780 1539575313 S Bo:1:108:2 -115 31 = 55534243 a9010000 001c0000 80000a28 0000b0d0 e200000e 00000000 000000
ffff9639a63cd780 1539575403 C Bo:1:108:2 0 31 >
ffff9637b5f9ac00 1539575419 S Bi:1:108:1 -115 7168 <
ffff9637b5f9ac00 1539577061 C Bi:1:108:1 0 7168 = 02740075 002e0063 006f000f 00dd6d00 5f007500 62007500 6e000000 74007500
ffff9639a63cd780 1539577077 S Bi:1:108:1 -115 13 <
ffff9639a63cd780 1539577183 C Bi:1:108:1 0 13 = 55534253 a9010000 00000000 00
ffff9639a63cd780 1539577308 S Bo:1:108:2 -115 31 = 55534243 aa010000 00020000 80000a28 0000b0d1 90000001 00000000 000000
ffff9639a63cd780 1539577404 C Bo:1:108:2 0 31 >
ffff9637b5f9ac00 1539577410 S Bi:1:108:1 -115 512 <
ffff9637b5f9ac00 1539579169 C Bi:1:108:1 0 512 = 2e202020 20202020 20202010 006447a1 644f644f 0b0047a1 644f6505 00000000
ffff9639a63cd780 1539579177 S Bi:1:108:1 -115 13 <
ffff9639a63cd780 1539579277 C Bi:1:108:1 0 13 = 55534253 aa010000 00000000 00
ffff9639a63cd780 1539579313 S Bo:1:108:2 -115 31 = 55534243 ab010000 00020000 80000a28 0000b0d1 91000001 00000000 000000
ffff9639a63cd780 1539579402 C Bo:1:108:2 0 31 >
ffff96391de053c0 1539579408 S Bi:1:108:1 -115 512 <
ffff96391de053c0 1539581405 C Bi:1:108:1 0 512 = 0262005f 00310025 0033000f 00a96100 37002e00 30002e00 30000000 2b007200
ffff9639a63cd780 1539581410 S Bi:1:108:1 -115 13 <
ffff9639a63cd780 1539581528 C Bi:1:108:1 0 13 = 55534253 ab010000 00000000 00
ffff9639a63cd780 1539581552 S Bo:1:108:2 -115 31 = 55534243 ac010000 001c0000 80000a28 0000b0d1 9200000e 00000000 000000
ffff9639a63cd780 1539581653 C Bo:1:108:2 0 31 >
ffff96399f6500c0 1539581658 S Bi:1:108:1 -115 7168 <
ffff96399f6500c0 1539584932 C Bi:1:108:1 0 7168 = 0161006e 00640072 006f000f 00c96900 64002d00 6c006900 62000000 6c006f00
ffff9639a63cd780 1539584939 S Bi:1:108:1 -115 13 <
ffff9639a63cd780 1539585163 C Bi:1:108:1 0 13 = 55534253 ac010000 00000000 00
ffff9639a63cd780 1539585218 S Bo:1:108:2 -115 31 = 55534243 ad010000 00020000 80000a28 0000b537 80000001 00000000 000000
ffff9639a63cd780 1539585303 C Bo:1:108:2 0 31 >
ffff96399f6500c0 1539585310 S Bi:1:108:1 -115 512 <
ffff96399f6500c0 1539586181 C Bi:1:108:1 0 512 = 01670069 006d0070 002d000f 00f46400 61007400 61005f00 32000000 2e003800
ffff9639a63cd780 1539586187 S Bi:1:108:1 -115 13 <
ffff9639a63cd780 1539586277 C Bi:1:108:1 0 13 = 55534253 ad010000 00000000 00
ffff9639a63cd780 1539586305 S Bo:1:108:2 -115 31 = 55534243 ae010000 00020000 80000a28 0000b537 81000001 00000000 000000
ffff9639a63cd780 1539586413 C Bo:1:108:2 0 31 >
ffff96399f6500c0 1539586421 S Bi:1:108:1 -115 512 <
ffff96399f6500c0 1539587054 C Bi:1:108:1 0 512 = 01670069 0074002d 006d000f 00276100 6e005f00 31002500 33000000 61003200
ffff9639a63cd780 1539587061 S Bi:1:108:1 -115 13 <
ffff9639a63cd780 1539587162 C Bi:1:108:1 0 13 = 55534253 ae010000 00000000 00
ffff9639a63cd780 1539587186 S Bo:1:108:2 -115 31 = 55534243 af010000 001c0000 80000a28 0000b537 8200000e 00000000 000000
ffff9639a63cd780 1539587278 C Bo:1:108:2 0 31 >
ffff9637b5f9ac00 1539587284 S Bi:1:108:1 -115 7168 <
ffff9637b5f9ac00 1539588546 C Bi:1:108:1 0 7168 = 025f0031 00250033 0061000f 006c3300 2e003200 32002e00 32000000 2d003100
ffff9639a63cd780 1539588554 S Bi:1:108:1 -115 13 <
ffff9639a63cd780 1539588788 C Bi:1:108:1 0 13 = 55534253 af010000 00000000 00
ffff9639a63cd780 1539588851 S Bo:1:108:2 -115 31 = 55534243 b0010000 00020000 80000a28 0000b665 90000001 00000000 000000
ffff9639a63cd780 1539588904 C Bo:1:108:2 0 31 >
ffff9637b5f9ac00 1539588919 S Bi:1:108:1 -115 512 <
ffff9637b5f9ac00 1539590930 C Bi:1:108:1 0 512 = 02760061 005f0031 002e000f 00553200 2d003100 5f006100 6c000000 6c002e00
ffff9639a63cd780 1539590938 S Bi:1:108:1 -115 13 <
ffff9639a63cd780 1539591055 C Bi:1:108:1 0 13 = 55534253 b0010000 00000000 00
ffff9639a63cd780 1539591089 S Bo:1:108:2 -115 31 = 55534243 b1010000 00020000 80000a28 0000b665 91000001 00000000 000000
ffff9639a63cd780 1539591153 C Bo:1:108:2 0 31 >
ffff9637b5ee7300 1539591183 S Bi:1:108:1 -115 512 <
ffff9637b5ee7300 1539593167 C Bi:1:108:1 0 512 = 02250033 00610034 002e000f 00f53500 2e003500 2d003100 5f000000 61006d00
ffff9639a63cd780 1539593176 S Bi:1:108:1 -115 13 <
ffff9639a63cd780 1539593278 C Bi:1:108:1 0 13 = 55534253 b1010000 00000000 00
ffff9639a63cd780 1539593308 S Bo:1:108:2 -115 31 = 55534243 b2010000 001c0000 80000a28 0000b665 9200000e 00000000 000000
ffff9639a63cd780 1539593403 C Bo:1:108:2 0 31 >
ffff96399f6500c0 1539593408 S Bi:1:108:1 -115 7168 <
ffff96399f6500c0 1539596669 C Bi:1:108:1 0 7168 = 4c494243 4c557e32 44454220 006457a1 644faf50 0b00f254 a34e255f 24010700
ffff9639a63cd780 1539596675 S Bi:1:108:1 -115 13 <
ffff9639a63cd780 1539596903 C Bi:1:108:1 0 13 = 55534253 b2010000 00000000 00
ffff9639a63cd780 1539596959 S Bo:1:108:2 -115 31 = 55534243 b3010000 00020000 80000a28 0000b6de 30000001 00000000 000000
ffff9639a63cd780 1539597029 C Bo:1:108:2 0 31 >
ffff96391de053c0 1539597037 S Bi:1:108:1 -115 512 <
ffff96391de053c0 1539597916 C Bi:1:108:1 0 512 = 016c0069 0062006a 0073000f 00c62d00 6f007000 65006e00 6c000000 61007900
ffff9639a63cd780 1539597923 S Bi:1:108:1 -115 13 <
ffff9639a63cd780 1539598027 C Bi:1:108:1 0 13 = 55534253 b3010000 00000000 00
ffff9639a63cd780 1539598050 S Bo:1:108:2 -115 31 = 55534243 b4010000 00020000 80000a28 0000b6de 31000001 00000000 000000
ffff9639a63cd780 1539598152 C Bo:1:108:2 0 31 >
ffff96391de053c0 1539598159 S Bi:1:108:1 -115 512 <
ffff96391de053c0 1539598938 C Bi:1:108:1 0 512 = 016c0069 0062006c 0061000f 00236e00 67007400 61006700 2d000000 63006f00
ffff9639a63cd780 1539598945 S Bi:1:108:1 -115 13 <
ffff9639a63cd780 1539599028 C Bi:1:108:1 0 13 = 55534253 b4010000 00000000 00
ffff9639a63cd780 1539599049 S Bo:1:108:2 -115 31 = 55534243 b5010000 001c0000 80000a28 0000b6de 3200000e 00000000 000000
ffff9639a63cd780 1539599153 C Bo:1:108:2 0 31 >
ffff96391de053c0 1539599158 S Bi:1:108:1 -115 7168 <
ffff96391de053c0 1539600409 C Bi:1:108:1 0 7168 = 016c0069 0062006c 0073000f 00ab6100 6e003000 5f003700 2e000000 32002e00
ffff9639a63cd780 1539600418 S Bi:1:108:1 -115 13 <
ffff9639a63cd780 1539600655 C Bi:1:108:1 0 13 = 55534253 b5010000 00000000 00
ffff9639a63cd780 1539600750 S Bo:1:108:2 -115 31 = 55534243 b6010000 00020000 80000a28 0000b7a7 00000001 00000000 000000
ffff9639a63cd780 1539600788 C Bo:1:108:2 0 31 >
ffff96391de059c0 1539600795 S Bi:1:108:1 -115 512 <
ffff96391de059c0 1539601666 C Bi:1:108:1 0 512 = 025f0030 002e0031 007e000f 00e37300 76006e00 32003000 31000000 30003100
ffff9639a63cd780 1539601672 S Bi:1:108:1 -115 13 <
ffff9639a63cd780 1539601788 C Bi:1:108:1 0 13 = 55534253 b6010000 00000000 00
ffff9639a63cd780 1539601821 S Bo:1:108:2 -115 31 = 55534243 b7010000 00020000 80000a28 0000b7a7 01000001 00000000 000000
ffff9639a63cd780 1539601903 C Bo:1:108:2 0 31 >
ffff96399f6500c0 1539601909 S Bi:1:108:1 -115 512 <
ffff96399f6500c0 1539602666 C Bi:1:108:1 0 512 = 032d0037 00750062 0075000f 00816e00 74007500 31005f00 61000000 6d006400
ffff9639a63cd780 1539602671 S Bi:1:108:1 -115 13 <
ffff9639a63cd780 1539602778 C Bi:1:108:1 0 13 = 55534253 b7010000 00000000 00
ffff9639a63cd780 1539602805 S Bo:1:108:2 -115 31 = 55534243 b8010000 001c0000 80000a28 0000b7a7 0200000e 00000000 000000
ffff9639a63cd780 1539602903 C Bo:1:108:2 0 31 >
ffff96399f6500c0 1539602908 S Bi:1:108:1 -115 7168 <
ffff96399f6500c0 1539604282 C Bi:1:108:1 0 7168 = 025f0034 00250033 0061000f 00613400 2e003800 2e003700 2b000000 64006600
ffff9639a63cd780 1539604288 S Bi:1:108:1 -115 13 <
ffff9639a63cd780 1539604528 C Bi:1:108:1 0 13 = 55534253 b8010000 00000000 00
ffff9639a63cd780 1539604608 S Bo:1:108:2 -115 31 = 55534243 b9010000 00020000 80000a28 0000ba77 90000001 00000000 000000
ffff9639a63cd780 1539604680 C Bo:1:108:2 0 31 >
ffff96399f6500c0 1539604700 S Bi:1:108:1 -115 512 <
ffff96399f6500c0 1539605557 C Bi:1:108:1 0 512 = 03250033 00610035 002e000f 003e3400 2e003100 2d003000 75000000 62007500
ffff9639a63cd780 1539605564 S Bi:1:108:1 -115 13 <
ffff9639a63cd780 1539605681 C Bi:1:108:1 0 13 = 55534253 b9010000 00000000 00
ffff9639a63cd780 1539605705 S Bo:1:108:2 -115 31 = 55534243 ba010000 00020000 80000a28 0000ba77 91000001 00000000 000000
ffff9639a63cd780 1539605779 C Bo:1:108:2 0 31 >
ffff96399f6500c0 1539605786 S Bi:1:108:1 -115 512 <
ffff96399f6500c0 1539606541 C Bi:1:108:1 0 512 = 032e0031 002d0030 0075000f 00a96200 75006e00 74007500 31000000 5f006100
ffff9639a63cd780 1539606546 S Bi:1:108:1 -115 13 <
ffff9639a63cd780 1539606652 C Bi:1:108:1 0 13 = 55534253 ba010000 00000000 00
ffff9639a63cd780 1539606672 S Bo:1:108:2 -115 31 = 55534243 bb010000 001c0000 80000a28 0000ba77 9200000e 00000000 000000
ffff9639a63cd780 1539606778 C Bo:1:108:2 0 31 >
ffff96399f6500c0 1539606785 S Bi:1:108:1 -115 7168 <
ffff96399f6500c0 1539608047 C Bi:1:108:1 0 7168 = 03670032 002d0030 002e000f 00fd3100 5f006100 6d006400 36000000 34002e00
ffff9639a63cd780 1539608055 S Bi:1:108:1 -115 13 <
ffff9639a63cd780 1539608278 C Bi:1:108:1 0 13 = 55534253 bb010000 00000000 00
ffff9639a63cd780 1539608326 S Bo:1:108:2 -115 31 = 55534243 bc010000 00020000 80000a28 0000bd90 b0000001 00000000 000000
ffff9639a63cd780 1539608404 C Bo:1:108:2 0 31 >
ffff96399f6500c0 1539608411 S Bi:1:108:1 -115 512 <
ffff96399f6500c0 1539610542 C Bi:1:108:1 0 512 = 446c002e 00640065 0062000f 00830000 ffffffff ffffffff ffff0000 ffffffff
ffff9639a63cd780 1539610548 S Bi:1:108:1 -115 13 <
ffff9639a63cd780 1539610653 C Bi:1:108:1 0 13 = 55534253 bc010000 00000000 00
ffff9639a63cd780 1539610679 S Bo:1:108:2 -115 31 = 55534243 bd010000 00020000 80000a28 0000bd90 b1000001 00000000 000000
ffff9639a63cd780 1539610778 C Bo:1:108:2 0 31 >
ffff96399f6500c0 1539610783 S Bi:1:108:1 -115 512 <
ffff96399f6500c0 1539612793 C Bi:1:108:1 0 512 = 43740075 0031005f 0061000f 00636c00 6c002e00 64006500 62000000 0000ffff
ffff9639a63cd780 1539612800 S Bi:1:108:1 -115 13 <
ffff9639a63cd780 1539612902 C Bi:1:108:1 0 13 = 55534253 bd010000 00000000 00
ffff9639a63cd780 1539612923 S Bo:1:108:2 -115 31 = 55534243 be010000 001c0000 80000a28 0000bd90 b200000e 00000000 000000
ffff9639a63cd780 1539613028 C Bo:1:108:2 0 31 >
ffff96399f6500c0 1539613034 S Bi:1:108:1 -115 7168 <
ffff96399f6500c0 1539616172 C Bi:1:108:1 0 7168 = 03320030 002d0030 0075000f 00c36200 75006e00 74007500 30000000 2e003100
ffff9639a63cd780 1539616180 S Bi:1:108:1 -115 13 <
ffff9639a63cd780 1539616431 C Bi:1:108:1 0 13 = 55534253 be010000 00000000 00
ffff9639a63cd780 1539616506 S Bo:1:108:2 -115 31 = 55534243 bf010000 00020000 80000a28 0000c1ad f0000001 00000000 000000
ffff9639a63cd780 1539616527 C Bo:1:108:2 0 31 >
ffff96399f6500c0 1539616531 S Bi:1:108:1 -115 512 <
ffff96399f6500c0 1539618682 C Bi:1:108:1 0 512 = 032e0030 002e0033 002d000f 00503300 5f006100 6c006c00 2e000000 64006500
ffff9639a63cd780 1539618689 S Bi:1:108:1 -115 13 <
ffff9639a63cd780 1539618779 C Bi:1:108:1 0 13 = 55534253 bf010000 00000000 00
ffff9639a63cd780 1539618803 S Bo:1:108:2 -115 31 = 55534243 c0010000 00020000 80000a28 0000c1ad f1000001 00000000 000000
ffff9639a63cd780 1539618904 C Bo:1:108:2 0 31 >
ffff96399f6500c0 1539618910 S Bi:1:108:1 -115 512 <
ffff96399f6500c0 1539620799 C Bi:1:108:1 0 512 = 02310036 002e0030 002d000f 00f63100 5f006100 6d006400 36000000 34002e00
ffff9639a63cd780 1539620808 S Bi:1:108:1 -115 13 <
ffff9639a63cd780 1539620904 C Bi:1:108:1 0 13 = 55534253 c0010000 00000000 00
ffff9639a63cd780 1539620931 S Bo:1:108:2 -115 31 = 55534243 c1010000 001c0000 80000a28 0000c1ad f200000e 00000000 000000
ffff9639a63cd780 1539621029 C Bo:1:108:2 0 31 >
ffff96399f6500c0 1539621035 S Bi:1:108:1 -115 7168 <
ffff96399f6500c0 1539623797 C Bi:1:108:1 0 7168 = 022e0031 002d0030 0075000f 00936200 75006e00 74007500 31000000 5f006100
ffff9639a63cd780 1539623805 S Bi:1:108:1 -115 13 <
ffff9639a63cd780 1539624030 C Bi:1:108:1 0 13 = 55534253 c1010000 00000000 00
ffff9639a63cd780 1539624094 S Bo:1:108:2 -115 31 = 55534243 c2010000 00020000 80000a28 0000c8c8 b0000001 00000000 000000
ffff9639a63cd780 1539624178 C Bo:1:108:2 0 31 >
ffff9637b5f9ac00 1539624199 S Bi:1:108:1 -115 512 <
ffff9637b5f9ac00 1539625816 C Bi:1:108:1 0 512 = 036e0074 00750031 005f000f 00e96100 6d006400 36003400 2e000000 64006500
ffff9639a63cd780 1539625832 S Bi:1:108:1 -115 13 <
ffff9639a63cd780 1539625931 C Bi:1:108:1 0 13 = 55534253 c2010000 00000000 00
ffff9639a63cd780 1539625975 S Bo:1:108:2 -115 31 = 55534243 c3010000 00020000 80000a28 0000c8c8 b1000001 00000000 000000
ffff9639a63cd780 1539626029 C Bo:1:108:2 0 31 >
ffff9637b5ee7300 1539626050 S Bi:1:108:1 -115 512 <
ffff9637b5ee7300 1539627917 C Bi:1:108:1 0 512 = 016c0069 00620067 006d000f 00f17000 2d006400 65007600 5f000000 32002500
ffff9639a63cd780 1539627924 S Bi:1:108:1 -115 13 <
ffff9639a63cd780 1539628039 C Bi:1:108:1 0 13 = 55534253 c3010000 00000000 00
ffff9639a63cd780 1539628071 S Bo:1:108:2 -115 31 = 55534243 c4010000 001c0000 80000a28 0000c8c8 b200000e 00000000 000000
ffff9639a63cd780 1539628153 C Bo:1:108:2 0 31 >
ffff96399f6500c0 1539628160 S Bi:1:108:1 -115 7168 <
ffff96399f6500c0 1539631170 C Bi:1:108:1 0 7168 = 4c494247 4e557e32 44454220 00648ea1 644faf50 0c002955 a34e4186 8a510000
ffff9639a63cd780 1539631176 S Bi:1:108:1 -115 13 <
ffff9639a63cd780 1539631306 C Bi:1:108:1 0 13 = 55534253 c4010000 00000000 00
ffff9639a63cd780 1539631374 S Bo:1:108:2 -115 31 = 55534243 c5010000 00020000 80000a28 0001ca49 a0000001 00000000 000000
ffff9639a63cd780 1539631403 C Bo:1:108:2 0 31 >
ffff96399f6500c0 1539631407 S Bi:1:108:1 -115 512 <
ffff96399f6500c0 1539633291 C Bi:1:108:1 0 512 = 025f0036 002e0033 002e000f 007c3000 2d003100 34007500 62000000 75006e00
ffff9639a63cd780 1539633300 S Bi:1:108:1 -115 13 <
ffff9639a63cd780 1539633402 C Bi:1:108:1 0 13 = 55534253 c5010000 00000000 00
ffff9639a63cd780 1539633430 S Bo:1:108:2 -115 31 = 55534243 c6010000 00020000 80000a28 0001ca49 a1000001 00000000 000000
ffff9639a63cd780 1539633527 C Bo:1:108:2 0 31 >
ffff96391de059c0 1539633534 S Bi:1:108:1 -115 512 <
ffff96391de059c0 1539635055 C Bi:1:108:1 0 512 = 01670063 0063002d 006d000f 005c6900 6e006700 77002d00 77000000 36003400
ffff9639a63cd780 1539635066 S Bi:1:108:1 -115 13 <
ffff9639a63cd780 1539635181 C Bi:1:108:1 0 13 = 55534253 c6010000 00000000 00
ffff9639a63cd780 1539635204 S Bo:1:108:2 -115 31 = 55534243 c7010000 001c0000 80000a28 0001ca49 a200000e 00000000 000000
ffff9639a63cd780 1539635279 C Bo:1:108:2 0 31 >
ffff96391de059c0 1539635284 S Bi:1:108:1 -115 7168 <
ffff96391de059c0 1539637298 C Bi:1:108:1 0 7168 = 0277002d 00770036 0034000f 000b2d00 78003800 36002d00 36000000 34005f00
ffff9639a63cd780 1539637303 S Bi:1:108:1 -115 13 <
ffff9639a63cd780 1539637529 C Bi:1:108:1 0 13 = 55534253 c7010000 00000000 00
ffff9639a63cd780 1539637674 S Bo:1:108:2 -115 31 = 55534243 c8010000 00020000 80000a28 0000cc2a b0000001 00000000 000000
ffff9639a63cd780 1539637780 C Bo:1:108:2 0 31 >
ffff9637b5ee7300 1539637796 S Bi:1:108:1 -115 512 <
ffff9637b5ee7300 1539639405 C Bi:1:108:1 0 512 = 2e202020 20202020 20202010 000099a1 644f644f 0c0099a1 644ff7ba 00000000
ffff9639a63cd780 1539639423 S Bi:1:108:1 -115 13 <
ffff9639a63cd780 1539639529 C Bi:1:108:1 0 13 = 55534253 c8010000 00000000 00
ffff9639a63cd780 1539639565 S Bo:1:108:2 -115 31 = 55534243 c9010000 00020000 80000a28 0000cc2a b1000001 00000000 000000
ffff9639a63cd780 1539639652 C Bo:1:108:2 0 31 >
ffff96399f650840 1539639659 S Bi:1:108:1 -115 512 <
ffff96399f650840 1539640917 C Bi:1:108:1 0 512 = 016e006f 006d0065 006e000f 00c56300 6c006100 74007500 72000000 61002d00
ffff9639a63cd780 1539640923 S Bi:1:108:1 -115 13 <
ffff9639a63cd780 1539641027 C Bi:1:108:1 0 13 = 55534253 c9010000 00000000 00
ffff9639a63cd780 1539641054 S Bo:1:108:2 -115 31 = 55534243 ca010000 001c0000 80000a28 0000cc2a b200000e 00000000 000000
ffff9639a63cd780 1539641173 C Bo:1:108:2 0 31 >
ffff96391de059c0 1539641186 S Bi:1:108:1 -115 7168 <
ffff96391de059c0 1539642936 C Bi:1:108:1 0 7168 = 4175006e 00720061 0072000f 00b90000 ffffffff ffffffff ffff0000 ffffffff
ffff9639a63cd780 1539642943 S Bi:1:108:1 -115 13 <
ffff9639a63cd780 1539643182 C Bi:1:108:1 0 13 = 55534253 ca010000 00000000 00
ffff9639a63cd780 1539643309 S Bo:1:108:2 -115 31 = 55534243 cb010000 00020000 80000a28 0000d403 50000001 00000000 000000
ffff9639a63cd780 1539643405 C Bo:1:108:2 0 31 >
ffff96399f650840 1539643424 S Bi:1:108:1 -115 512 <
ffff96399f650840 1539644919 C Bi:1:108:1 0 512 = 2e202020 20202020 20202010 0000afa1 644f644f 0d00afa1 644f8138 00000000
ffff9639a63cd780 1539644933 S Bi:1:108:1 -115 13 <
ffff9639a63cd780 1539645029 C Bi:1:108:1 0 13 = 55534253 cb010000 00000000 00
ffff9639a63cd780 1539645065 S Bo:1:108:2 -115 31 = 55534243 cc010000 00020000 80000a28 0000d403 51000001 00000000 000000
ffff9639a63cd780 1539645154 C Bo:1:108:2 0 31 >
ffff96399f6506c0 1539645160 S Bi:1:108:1 -115 512 <
ffff96399f6506c0 1539646541 C Bi:1:108:1 0 512 = 50415452 494d7e32 43535620 00640974 4c50af50 19000974 4c500a35 422d0000
ffff9639a63cd780 1539646548 S Bi:1:108:1 -115 13 <
ffff9639a63cd780 1539646652 C Bi:1:108:1 0 13 = 55534253 cc010000 00000000 00
ffff9639a63cd780 1539646676 S Bo:1:108:2 -115 31 = 55534243 cd010000 001c0000 80000a28 0000d403 5200000e 00000000 000000
ffff9639a63cd780 1539646779 C Bo:1:108:2 0 31 >
ffff96399f6506c0 1539646784 S Bi:1:108:1 -115 7168 <
ffff96399f6506c0 1539648695 C Bi:1:108:1 0 7168 = 43670000 00ffffff ffffff0f 00f6ffff ffffffff ffffffff ffff0000 ffffffff
ffff9639a63cd780 1539648705 S Bi:1:108:1 -115 13 <
ffff9639a63cd780 1539648818 C Bi:1:108:1 0 13 = 55534253 cd010000 00000000 00
ffff9639a63cd780 1539648966 S Bo:1:108:2 -115 31 = 55534243 ce010000 00020000 80000a28 0000d50e 70000001 00000000 000000
ffff9639a63cd780 1539649030 C Bo:1:108:2 0 31 >
ffff96399f6506c0 1539649037 S Bi:1:108:1 -115 512 <
ffff96399f6506c0 1539650154 C Bi:1:108:1 0 512 = 2e202020 20202020 20202010 0000b2a1 644f644f 0d00b2a1 644f3349 00000000
ffff9639a63cd780 1539650162 S Bi:1:108:1 -115 13 <
ffff9639a63cd780 1539650278 C Bi:1:108:1 0 13 = 55534253 ce010000 00000000 00
ffff9639a63cd780 1539650320 S Bo:1:108:2 -115 31 = 55534243 cf010000 00020000 80000a28 0000d50e 71000001 00000000 000000
ffff9639a63cd780 1539650403 C Bo:1:108:2 0 31 >
ffff9637b5f9ac00 1539650420 S Bi:1:108:1 -115 512 <
ffff9637b5f9ac00 1539651543 C Bi:1:108:1 0 512 = 434f4755 4d454c4f 54585420 0064ea69 4c50af50 1900ea69 4c50df34 47010000
ffff9639a63cd780 1539651556 S Bi:1:108:1 -115 13 <
ffff9639a63cd780 1539651654 C Bi:1:108:1 0 13 = 55534253 cf010000 00000000 00
ffff9639a63cd780 1539651689 S Bo:1:108:2 -115 31 = 55534243 d0010000 001c0000 80000a28 0000d50e 7200000e 00000000 000000
ffff9639a63cd780 1539651778 C Bo:1:108:2 0 31 >
ffff96391de059c0 1539651786 S Bi:1:108:1 -115 7168 <
ffff96391de059c0 1539653435 C Bi:1:108:1 0 7168 = 00000000 00000000 00000000 00000000 00000000 00000000 00000000 00000000
ffff9639a63cd780 1539653442 S Bi:1:108:1 -115 13 <
ffff9639a63cd780 1539653556 C Bi:1:108:1 0 13 = 55534253 d0010000 00000000 00
ffff9639a63cd780 1539653690 S Bo:1:108:2 -115 31 = 55534243 d1010000 00020000 80000a28 0000d536 60000001 00000000 000000
ffff9639a63cd780 1539653781 C Bo:1:108:2 0 31 >
ffff9637b5ee7300 1539653797 S Bi:1:108:1 -115 512 <
ffff9637b5ee7300 1539654917 C Bi:1:108:1 0 512 = 2e202020 20202020 20202010 0000b2a1 644f644f 0d00b2a1 644fb24b 00000000
ffff9639a63cd780 1539654933 S Bi:1:108:1 -115 13 <
ffff9639a63cd780 1539655029 C Bi:1:108:1 0 13 = 55534253 d1010000 00000000 00
ffff9639a63cd780 1539655064 S Bo:1:108:2 -115 31 = 55534243 d2010000 00020000 80000a28 0000d536 61000001 00000000 000000
ffff9639a63cd780 1539655153 C Bo:1:108:2 0 31 >
ffff96399f6506c0 1539655159 S Bi:1:108:1 -115 512 <
ffff96399f6506c0 1539656154 C Bi:1:108:1 0 512 = 5a49502d 464f7e31 54585420 0064f806 724faf50 1500f806 724f180b 81650200
ffff9639a63cd780 1539656160 S Bi:1:108:1 -115 13 <
ffff9639a63cd780 1539656279 C Bi:1:108:1 0 13 = 55534253 d2010000 00000000 00
ffff9639a63cd780 1539656305 S Bo:1:108:2 -115 31 = 55534243 d3010000 001c0000 80000a28 0000d536 6200000e 00000000 000000
ffff9639a63cd780 1539656431 C Bo:1:108:2 0 31 >
ffff96399f6506c0 1539656437 S Bi:1:108:1 -115 7168 <
ffff96399f6506c0 1539658045 C Bi:1:108:1 0 7168 = 41504b20 20202020 20202010 0000cf10 5b505b50 0d00cf10 5b50908c 00000000
ffff9639a63cd780 1539658052 S Bi:1:108:1 -115 13 <
ffff9639a63cd780 1539658153 C Bi:1:108:1 0 13 = 55534253 d3010000 00000000 00
ffff9639a63cd780 1539658276 S Bo:1:108:2 -115 31 = 55534243 d4010000 00020000 80000a28 0000f907 70000001 00000000 000000
ffff9639a63cd780 1539658405 C Bo:1:108:2 0 31 >
ffff9637b5f9ac00 1539658416 S Bi:1:108:1 -115 512 <
ffff9637b5f9ac00 1539659904 C Bi:1:108:1 0 512 = 2e202020 20202020 20202010 006427a2 644f644f 0f0027a2 644fc388 00000000
ffff9639a63cd780 1539659921 S Bi:1:108:1 -115 13 <
ffff9639a63cd780 1539660057 C Bi:1:108:1 0 13 = 55534253 d4010000 00000000 00
ffff9639a63cd780 1539660110 S Bo:1:108:2 -115 31 = 55534243 d5010000 00020000 80000a28 0000f907 71000001 00000000 000000
ffff9639a63cd780 1539660186 C Bo:1:108:2 0 31 >
ffff9637b5ee7300 1539660215 S Bi:1:108:1 -115 512 <
ffff9637b5ee7300 1539661168 C Bi:1:108:1 0 512 = 00000000 00000000 00000000 00000000 00000000 00000000 00000000 00000000
ffff9639a63cd780 1539661186 S Bi:1:108:1 -115 13 <
ffff9639a63cd780 1539661278 C Bi:1:108:1 0 13 = 55534253 d5010000 00000000 00
ffff9639a63cd780 1539661315 S Bo:1:108:2 -115 31 = 55534243 d6010000 001c0000 80000a28 0000f907 7200000e 00000000 000000
ffff9639a63cd780 1539661403 C Bo:1:108:2 0 31 >
ffff96399f6506c0 1539661409 S Bi:1:108:1 -115 7168 <
ffff96399f6506c0 1539662921 C Bi:1:108:1 0 7168 = 00000000 00000000 00000000 00000000 00000000 00000000 00000000 00000000
ffff9639a63cd780 1539662928 S Bi:1:108:1 -115 13 <
ffff9639a63cd780 1539663153 C Bi:1:108:1 0 13 = 55534253 d6010000 00000000 00
ffff9639a63cd780 1539663256 S Bo:1:108:2 -115 31 = 55534243 d7010000 00020000 80000a28 0000f909 20000001 00000000 000000
ffff9639a63cd780 1539663404 C Bo:1:108:2 0 31 >
ffff96391de059c0 1539663411 S Bi:1:108:1 -115 512 <
ffff96391de059c0 1539664155 C Bi:1:108:1 0 512 = 2e202020 20202020 20202010 006427a2 644f644f 0f0027a2 644fde88 00000000
ffff9639a63cd780 1539664159 S Bi:1:108:1 -115 13 <
ffff9639a63cd780 1539664278 C Bi:1:108:1 0 13 = 55534253 d7010000 00000000 00
ffff9639a63cd780 1539664302 S Bo:1:108:2 -115 31 = 55534243 d8010000 00020000 80000a28 0000f909 21000001 00000000 000000
ffff9639a63cd780 1539664403 C Bo:1:108:2 0 31 >
ffff96391de059c0 1539664408 S Bi:1:108:1 -115 512 <
ffff96391de059c0 1539665286 C Bi:1:108:1 0 512 = 53435245 454e7e31 20202020 00002ba2 644faf50 0f007355 a34ece92 30460000
ffff9639a63cd780 1539665291 S Bi:1:108:1 -115 13 <
ffff9639a63cd780 1539665403 C Bi:1:108:1 0 13 = 55534253 d8010000 00000000 00
ffff9639a63cd780 1539665420 S Bo:1:108:2 -115 31 = 55534243 d9010000 001c0000 80000a28 0000f909 2200000e 00000000 000000
ffff9639a63cd780 1539665529 C Bo:1:108:2 0 31 >
ffff96391de059c0 1539665534 S Bi:1:108:1 -115 7168 <
ffff96391de059c0 1539666921 C Bi:1:108:1 0 7168 = 00000000 00000000 00000000 00000000 00000000 00000000 00000000 00000000
ffff9639a63cd780 1539666926 S Bi:1:108:1 -115 13 <
ffff9639a63cd780 1539667153 C Bi:1:108:1 0 13 = 55534253 d9010000 00000000 00
ffff9639a63cd780 1539667264 S Bo:1:108:2 -115 31 = 55534243 da010000 00020000 80000a28 0000fb42 50000001 00000000 000000
ffff9639a63cd780 1539667404 C Bo:1:108:2 0 31 >
ffff9637b5ee7300 1539667420 S Bi:1:108:1 -115 512 <
ffff9637b5ee7300 1539668543 C Bi:1:108:1 0 512 = 2e202020 20202020 20202010 00002fa2 644f644f 0f002fa2 644f71ac 00000000
ffff9639a63cd780 1539668557 S Bi:1:108:1 -115 13 <
ffff9639a63cd780 1539668655 C Bi:1:108:1 0 13 = 55534253 da010000 00000000 00
ffff9639a63cd780 1539668691 S Bo:1:108:2 -115 31 = 55534243 db010000 00020000 80000a28 0000fb42 51000001 00000000 000000
ffff9639a63cd780 1539668778 C Bo:1:108:2 0 31 >
ffff96399f6506c0 1539668784 S Bi:1:108:1 -115 512 <
ffff96399f6506c0 1539669916 C Bi:1:108:1 0 512 = 00000000 00000000 00000000 00000000 00000000 00000000 00000000 00000000
ffff9639a63cd780 1539669921 S Bi:1:108:1 -115 13 <
ffff9639a63cd780 1539670028 C Bi:1:108:1 0 13 = 55534253 db010000 00000000 00
ffff9639a63cd780 1539670053 S Bo:1:108:2 -115 31 = 55534243 dc010000 001c0000 80000a28 0000fb42 5200000e 00000000 000000
ffff9639a63cd780 1539670152 C Bo:1:108:2 0 31 >
ffff96391de059c0 1539670157 S Bi:1:108:1 -115 7168 <
ffff96391de059c0 1539671794 C Bi:1:108:1 0 7168 = 00000000 00000000 00000000 00000000 00000000 00000000 00000000 00000000
ffff9639a63cd780 1539671798 S Bi:1:108:1 -115 13 <
ffff9639a63cd780 1539672055 C Bi:1:108:1 0 13 = 55534253 dc010000 00000000 00
ffff9639a63cd780 1539672174 S Bo:1:108:2 -115 31 = 55534243 dd010000 00020000 80000a28 0000fb42 b0000001 00000000 000000
ffff9639a63cd780 1539672278 C Bo:1:108:2 0 31 >
ffff96391de059c0 1539672285 S Bi:1:108:1 -115 512 <
ffff96391de059c0 1539673416 C Bi:1:108:1 0 512 = 2e202020 20202020 20202010 00002fa2 644f644f 0f002fa2 644f77ac 00000000
ffff9639a63cd780 1539673421 S Bi:1:108:1 -115 13 <
ffff9639a63cd780 1539673527 C Bi:1:108:1 0 13 = 55534253 dd010000 00000000 00
ffff9639a63cd780 1539673550 S Bo:1:108:2 -115 31 = 55534243 de010000 00020000 80000a28 0000fb42 b1000001 00000000 000000
ffff9639a63cd780 1539673653 C Bo:1:108:2 0 31 >
ffff96391de059c0 1539673658 S Bi:1:108:1 -115 512 <
ffff96391de059c0 1539674917 C Bi:1:108:1 0 512 = 414c0031 0037002e 0030000f 009e3400 5f002e00 74007800 74000000 0000ffff
ffff9639a63cd780 1539674922 S Bi:1:108:1 -115 13 <
ffff9639a63cd780 1539675028 C Bi:1:108:1 0 13 = 55534253 de010000 00000000 00
ffff9639a63cd780 1539675049 S Bo:1:108:2 -115 31 = 55534243 df010000 001c0000 80000a28 0000fb42 b200000e 00000000 000000
ffff9639a63cd780 1539675153 C Bo:1:108:2 0 31 >
ffff9637b5ee7300 1539675161 S Bi:1:108:1 -115 7168 <
ffff9637b5ee7300 1539677061 C Bi:1:108:1 0 7168 = 0173006c 00690074 0061000f 00c87a00 2d007200 6f006c00 6c000000 69006e00
ffff9639a63cd780 1539677075 S Bi:1:108:1 -115 13 <
ffff9639a63cd780 1539677306 C Bi:1:108:1 0 13 = 55534253 df010000 00000000 00
ffff9639a63cd780 1539677437 S Bo:1:108:2 -115 31 = 55534243 e0010000 00020000 80000a28 00010e80 d0000001 00000000 000000
ffff9639a63cd780 1539677538 C Bo:1:108:2 0 31 >
ffff9637b5ee7300 1539677546 S Bi:1:108:1 -115 512 <
ffff9637b5ee7300 1539679045 C Bi:1:108:1 0 512 = 2e202020 20202020 20202010 006464a2 644f644f 100064a2 644f59e0 00000000
ffff9639a63cd780 1539679055 S Bi:1:108:1 -115 13 <
ffff9639a63cd780 1539679153 C Bi:1:108:1 0 13 = 55534253 e0010000 00000000 00
ffff9639a63cd780 1539679180 S Bo:1:108:2 -115 31 = 55534243 e1010000 00020000 80000a28 00010e80 d1000001 00000000 000000
ffff9639a63cd780 1539679279 C Bo:1:108:2 0 31 >
ffff96399f6506c0 1539679286 S Bi:1:108:1 -115 512 <
ffff96399f6506c0 1539680793 C Bi:1:108:1 0 512 = e52e0074 00780074 0000000f 0025ffff ffffffff ffffffff ffff0000 ffffffff
ffff9639a63cd780 1539680800 S Bi:1:108:1 -115 13 <
ffff9639a63cd780 1539680903 C Bi:1:108:1 0 13 = 55534253 e1010000 00000000 00
ffff9639a63cd780 1539680928 S Bo:1:108:2 -115 31 = 55534243 e2010000 001c0000 80000a28 00010e80 d200000e 00000000 000000
ffff9639a63cd780 1539681029 C Bo:1:108:2 0 31 >
ffff96391de059c0 1539681035 S Bi:1:108:1 -115 7168 <
ffff96391de059c0 1539683544 C Bi:1:108:1 0 7168 = 0164006f 0077006e 006c000f 00c66f00 61006400 65007200 2e000000 66006100
ffff9639a63cd780 1539683550 S Bi:1:108:1 -115 13 <
ffff9639a63cd780 1539683777 C Bi:1:108:1 0 13 = 55534253 e2010000 00000000 00
ffff9639a63cd780 1539683829 S Bo:1:108:2 -115 31 = 55534243 e3010000 00020000 80000a28 000121a8 d0000001 00000000 000000
ffff9639a63cd780 1539683903 C Bo:1:108:2 0 31 >
ffff96391de059c0 1539683910 S Bi:1:108:1 -115 512 <
ffff96391de059c0 1539686041 C Bi:1:108:1 0 512 = e5730065 0064002e 0064000f 007c6500 63006f00 75007200 74000000 2e007400
ffff9639a63cd780 1539686047 S Bi:1:108:1 -115 13 <
ffff9639a63cd780 1539686182 C Bi:1:108:1 0 13 = 55534253 e3010000 00000000 00
ffff9639a63cd780 1539686206 S Bo:1:108:2 -115 31 = 55534243 e4010000 00020000 80000a28 000121a8 d1000001 00000000 000000
ffff9639a63cd780 1539686277 C Bo:1:108:2 0 31 >
ffff96391de059c0 1539686283 S Bi:1:108:1 -115 512 <
ffff96391de059c0 1539688154 C Bi:1:108:1 0 512 = e5630061 00740064 006f000f 00676300 5f003000 2e003900 35000000 2d003400
ffff9639a63cd780 1539688160 S Bi:1:108:1 -115 13 <
ffff9639a63cd780 1539688277 C Bi:1:108:1 0 13 = 55534253 e4010000 00000000 00
ffff9639a63cd780 1539688299 S Bo:1:108:2 -115 31 = 55534243 e5010000 001c0000 80000a28 000121a8 d200000e 00000000 000000
ffff9639a63cd780 1539688403 C Bo:1:108:2 0 31 >
ffff96391de059c0 1539688409 S Bi:1:108:1 -115 7168 <
ffff96391de059c0 1539690934 C Bi:1:108:1 0 7168 = e56e0074 00750031 005f000f 00e76100 6d006400 36003400 2e000000 64006500
ffff9639a63cd780 1539690941 S Bi:1:108:1 -115 13 <
ffff9639a63cd780 1539691153 C Bi:1:108:1 0 13 = 55534253 e5010000 00000000 00
ffff9639a63cd780 1539691206 S Bo:1:108:2 -115 31 = 55534243 e6010000 00020000 80000a28 000186e2 20000001 00000000 000000
ffff9639a63cd780 1539691278 C Bo:1:108:2 0 31 >
ffff96391de059c0 1539691285 S Bi:1:108:1 -115 512 <
ffff96391de059c0 1539692917 C Bi:1:108:1 0 512 = e5524f4a 45547e32 48544d20 0000a639 47505350 1800a35a 834f6f66 534a0100
ffff9639a63cd780 1539692922 S Bi:1:108:1 -115 13 <
ffff9639a63cd780 1539693029 C Bi:1:108:1 0 13 = 55534253 e6010000 00000000 00
ffff9639a63cd780 1539693054 S Bo:1:108:2 -115 31 = 55534243 e7010000 00020000 80000a28 000186e2 21000001 00000000 000000
ffff9639a63cd780 1539693181 C Bo:1:108:2 0 31 >
ffff96391de059c0 1539693187 S Bi:1:108:1 -115 512 <
ffff96391de059c0 1539694419 C Bi:1:108:1 0 512 = e5520045 0046004c 0045000f 00655800 c3004f00 20005300 4f000000 42005200
ffff9639a63cd780 1539694424 S Bi:1:108:1 -115 13 <
ffff9639a63cd780 1539694529 C Bi:1:108:1 0 13 = 55534253 e7010000 00000000 00
ffff9639a63cd780 1539694548 S Bo:1:108:2 -115 31 = 55534243 e8010000 001c0000 80000a28 000186e2 2200000e 00000000 000000
ffff9639a63cd780 1539694653 C Bo:1:108:2 0 31 >
ffff96391de059c0 1539694658 S Bi:1:108:1 -115 7168 <
ffff96391de059c0 1539696545 C Bi:1:108:1 0 7168 = e52d0031 00310034 002d000f 008f3200 30003100 38002d00 70000000 72006f00
ffff9639a63cd780 1539696552 S Bi:1:108:1 -115 13 <
ffff9639a63cd780 1539696680 C Bi:1:108:1 0 13 = 55534253 e8010000 00000000 00
ffff9639a63cd780 1539696798 S Bo:1:108:2 -115 31 = 55534243 e9010000 00020000 80000a28 00014c72 d0000001 00000000 000000
ffff9639a63cd780 1539696914 C Bo:1:108:2 0 31 >
ffff96391de059c0 1539696927 S Bi:1:108:1 -115 512 <
ffff96391de059c0 1539698417 C Bi:1:108:1 0 512 = 2e202020 20202020 20202010 00644da3 644f644f 14004da3 644f79bf 00000000
ffff9639a63cd780 1539698429 S Bi:1:108:1 -115 13 <
ffff9639a63cd780 1539698527 C Bi:1:108:1 0 13 = 55534253 e9010000 00000000 00
ffff9639a63cd780 1539698556 S Bo:1:108:2 -115 31 = 55534243 ea010000 00020000 80000a28 00014c72 d1000001 00000000 000000
ffff9639a63cd780 1539698652 C Bo:1:108:2 0 31 >
ffff96391de059c0 1539698658 S Bi:1:108:1 -115 512 <
ffff96391de059c0 1539699666 C Bi:1:108:1 0 512 = 50524956 41444f20 20202010 00649c16 64506450 14009c16 645026d1 00000000
ffff9639a63cd780 1539699671 S Bi:1:108:1 -115 13 <
ffff9639a63cd780 1539699777 C Bi:1:108:1 0 13 = 55534253 ea010000 00000000 00
ffff9639a63cd780 1539699796 S Bo:1:108:2 -115 31 = 55534243 eb010000 001c0000 80000a28 00014c72 d200000e 00000000 000000
ffff9639a63cd780 1539699903 C Bo:1:108:2 0 31 >
ffff96391de059c0 1539699908 S Bi:1:108:1 -115 7168 <
ffff96391de059c0 1539701435 C Bi:1:108:1 0 7168 = 00000000 00000000 00000000 00000000 00000000 00000000 00000000 00000000
ffff9639a63cd780 1539701444 S Bi:1:108:1 -115 13 <
ffff9639a63cd780 1539701681 C Bi:1:108:1 0 13 = 55534253 eb010000 00000000 00
ffff9639a63cd780 1539701854 S Bo:1:108:2 -115 31 = 55534243 ec010000 00060000 80000a28 0000007b 70000003 00000000 000000
ffff9639a63cd780 1539701905 C Bo:1:108:2 0 31 >
ffff96391de059c0 1539701910 S Bi:1:108:1 -115 1536 <
ffff96391de059c0 1539703291 C Bi:1:108:1 0 1536 = 2320636c 65617220 3b20726d 202d6620 2e2f3033 355f6e61 6e6f736c 65657020
ffff9639a63cd780 1539703298 S Bi:1:108:1 -115 13 <
ffff9639a63cd780 1539703403 C Bi:1:108:1 0 13 = 55534253 ec010000 00000000 00
ffff9639a63cd780 1539703778 S Bo:1:108:2 -115 31 = 55534243 ed010000 00020000 80000a28 00013a9d b0000001 00000000 000000
ffff9639a63cd780 1539703904 C Bo:1:108:2 0 31 >
ffff96391de059c0 1539703911 S Bi:1:108:1 -115 512 <
ffff96391de059c0 1539705939 C Bi:1:108:1 0 512 = 2e202020 20202020 20202010 00006353 51505150 13006353 515027a2 00000000
ffff9639a63cd780 1539705947 S Bi:1:108:1 -115 13 <
ffff9639a63cd780 1539706028 C Bi:1:108:1 0 13 = 55534253 ed010000 00000000 00
ffff9639a63cd780 1539706058 S Bo:1:108:2 -115 31 = 55534243 ee010000 00020000 80000a28 00013a9d b1000001 00000000 000000
ffff9639a63cd780 1539706153 C Bo:1:108:2 0 31 >
ffff96391de059c0 1539706158 S Bi:1:108:1 -115 512 <
ffff96391de059c0 1539707666 C Bi:1:108:1 0 512 = 424f4c45 54497e31 50532020 00646353 5150af50 1300f085 475031a2 e36c0000
ffff9639a63cd780 1539707671 S Bi:1:108:1 -115 13 <
ffff9639a63cd780 1539707777 C Bi:1:108:1 0 13 = 55534253 ee010000 00000000 00
ffff9639a63cd780 1539707799 S Bo:1:108:2 -115 31 = 55534243 ef010000 001c0000 80000a28 00013a9d b200000e 00000000 000000
ffff9639a63cd780 1539707903 C Bo:1:108:2 0 31 >
ffff96391de059c0 1539707908 S Bi:1:108:1 -115 7168 <
ffff96391de059c0 1539709936 C Bi:1:108:1 0 7168 = 41740065 00730074 0065000f 00422e00 70006400 66000000 ffff0000 ffffffff
ffff9639a63cd780 1539709943 S Bi:1:108:1 -115 13 <
ffff9639a63cd780 1539710055 C Bi:1:108:1 0 13 = 55534253 ef010000 00000000 00
ffff9639a63cd780 1539710204 S Bo:1:108:2 -115 31 = 55534243 f0010000 00020000 80000a28 0001793b d0000001 00000000 000000
ffff9639a63cd780 1539710306 C Bo:1:108:2 0 31 >
ffff96391de059c0 1539710313 S Bi:1:108:1 -115 512 <
ffff96391de059c0 1539711791 C Bi:1:108:1 0 512 = 2e202020 20202020 20202010 0000f7ab 3b503b50 1700f7ab 3b50098c 00000000
ffff9639a63cd780 1539711798 S Bi:1:108:1 -115 13 <
ffff9639a63cd780 1539711902 C Bi:1:108:1 0 13 = 55534253 f0010000 00000000 00
ffff9639a63cd780 1539711927 S Bo:1:108:2 -115 31 = 55534243 f1010000 00020000 80000a28 0001793b d1000001 00000000 000000
ffff9639a63cd780 1539712030 C Bo:1:108:2 0 31 >
ffff96391de059c0 1539712036 S Bi:1:108:1 -115 512 <
ffff96391de059c0 1539713180 C Bi:1:108:1 0 512 = 0161006e 00640072 006f000f 00486900 64005f00 65007800 74000000 72006100
ffff9639a63cd780 1539713186 S Bi:1:108:1 -115 13 <
ffff9639a63cd780 1539713305 C Bi:1:108:1 0 13 = 55534253 f1010000 00000000 00
ffff9639a63cd780 1539713330 S Bo:1:108:2 -115 31 = 55534243 f2010000 001c0000 80000a28 0001793b d200000e 00000000 000000
ffff9639a63cd780 1539713413 C Bo:1:108:2 0 31 >
ffff96391de059c0 1539713422 S Bi:1:108:1 -115 7168 <
ffff96391de059c0 1539714935 C Bi:1:108:1 0 7168 = 00000000 00000000 00000000 00000000 00000000 00000000 00000000 00000000
ffff9639a63cd780 1539714942 S Bi:1:108:1 -115 13 <
ffff9639a63cd780 1539715152 C Bi:1:108:1 0 13 = 55534253 f2010000 00000000 00
ffff9639a63cd780 1539715880 S Bo:1:108:2 -115 31 = 55534243 f3010000 00080000 80000a28 00010187 40000004 00000000 000000
ffff9639a63cd780 1539715907 C Bo:1:108:2 0 31 >
ffff96391de059c0 1539715926 S Bi:1:108:1 -115 2048 <
ffff96391de059c0 1539717306 C Bi:1:108:1 0 2048 = 2320636c 65617220 3b20726d 202d6620 2e2f6c6f 61642026 26206173 202d2d36
ffff9639a63cd780 1539717315 S Bi:1:108:1 -115 13 <
ffff9639a63cd780 1539717413 C Bi:1:108:1 0 13 = 55534253 f3010000 00000000 00
ffff9639a63cd780 1539717738 S Bo:1:108:2 -115 31 = 55534243 f4010000 00080000 80000a28 0000ad81 e0000004 00000000 000000
ffff9639a63cd780 1539717800 C Bo:1:108:2 0 31 >
ffff96391de059c0 1539717807 S Bi:1:108:1 -115 2048 <
ffff96391de059c0 1539719042 C Bi:1:108:1 0 2048 = 2320636c 65617220 3b20726d 202d6620 2e2f6c6f 61642026 26206173 202d2d36
ffff9639a63cd780 1539719047 S Bi:1:108:1 -115 13 <
ffff9639a63cd780 1539719153 C Bi:1:108:1 0 13 = 55534253 f4010000 00000000 00
ffff9639a63cd780 1539719370 S Bo:1:108:2 -115 31 = 55534243 f5010000 00080000 80000a28 0000ad82 10000004 00000000 000000
ffff9639a63cd780 1539719404 C Bo:1:108:2 0 31 >
ffff9637b5ee7300 1539719426 S Bi:1:108:1 -115 2048 <
ffff9637b5ee7300 1539720309 C Bi:1:108:1 0 2048 = 23212f62 696e2f73 680a0a6c 69737461 72636869 76652829 0a7b0a09 61726368
ffff9639a63cd780 1539720324 S Bi:1:108:1 -115 13 <
ffff9639a63cd780 1539720431 C Bi:1:108:1 0 1